version_date,title,brief,keyword,url
2022-03-03 04:27:55,银保监会谈房地产风险调控 郭树清：不希望房地市场调整太剧烈,3月2日，国新办就促进经济金融良性循环和高质量发展有关情况举行发布会。银保监会主席郭树清在谈到房地产风险调控时，回顾自己20多年前贷款买房的经历，提醒银行要注意房地产风险，但同时表示不希望房地产市场调整太剧烈，希望平稳转换。,郭树清 新市民 信贷增长 小微 银保 金融体系 房价下跌 房地产金融 肺炎 处置不良资产,https://jingji.cctv.com/2022/03/03/ARTIO0drdOASmH5mdx8ZdkxX220303.shtml
2022-03-02 16:08:48,小麦管得怎样？种子有无保障？农机够用吗？——透视全国春季农业生产关键问题,当前，全国由南向北陆续进入春耕春管备耕大忙季节。西南冬小麦拔节孕穗，江淮、黄淮南部陆续返青，黄淮中北部、华北、西北还在越冬；华南早稻开始浸种育秧。,深松机 拔节期 大豆油料种源,https://jingji.cctv.com/2022/03/02/ARTIhDToXEEIENrkVnOFVZfI220302.shtml
2022-03-02 15:09:18,银保监会：房地产泡沫化、金融化势头得到扭转,银保监会主席郭树清3月2日在国新办新闻发布会上表示，2021年重点领域金融风险持续得到控制，宏观杠杆率下降大约8个百分点，金融体系资产扩张恢复到较低水平，房地产泡沫化、金融化势头得到扭转。,银保监会 房地产 金融,https://news.cctv.com/2022/03/02/ARTIq6syTsGw8bu5hDQZE87T220302.shtml
2022-02-28 05:58:48,中国汽车品牌强势增长,中汽协数据显示，2021年全年，中国品牌乘用车销量达到了954.3万辆，同比增长23.1%，市场份额达到了44.4%，同比提高了6个百分点。,乘用车销量 联席会秘书长 汽车出口 汽车科技 品牌汽车 汽车协会 汽车市场 汽车销售 汽车企业 汽车集团,https://jingji.cctv.com/2022/02/28/ARTIYNsUAAQngACfv7Vmp96g220228.shtml
2022-02-27 18:46:42,人民网评：政策发力，保持平稳健康的经济环境,在近期召开的地方两会上，各省份将稳增长作为经济工作重心，敲定经济社会发展路线图。面对国内国际的不稳定不确定因素，必须坚持稳的主基调，把住稳的大局，把稳增长放在更重要的位置，稳住中国经济的基本盘。,供给冲击 经济运行,https://news.cctv.com/2022/02/27/ARTI4q5mRfoaYYiuvUL8lGti220227.shtml
2022-02-27 17:18:41,舟稳满帆风——扩内需，市场广阔潜力大,国际上，百年变局叠加疫情全球流行，经济全球化遭遇逆流，世界进入动荡变革期；正如中国宏观经济研究院综合形势研究室主任、研究员郭丽岩所说，一系列扩大消费的举措效果持续显现，居民消费呈现稳步恢复、稳中提质的运行特征。,供给冲击 动态匹配,https://news.cctv.com/2022/02/27/ARTIeqEtEaDzGHyvHC3hyfDa220227.shtml
2022-02-27 17:13:58,新一轮减税降费明确了,随着一系列部署，新一轮减税降费“施工图”逐步明确，围绕中小微企业、个体工商户和制造业等重点行业，坚持阶段性政策为主，与制度性措施相结合，加大减税降费力度。,减税 市场主体,https://news.cctv.com/2022/02/27/ARTIF5s9vPU2O0N7zMvSGTx7220227.shtml
2022-02-27 10:43:13,坚持和完善基本经济制度 扎实推动共同富裕,在向第二个百年奋斗目标迈进的新征程上，必须进一步坚持和完善社会主义基本经济制度，充分发挥社会主义基本经济制度的优势，向着实现共同富裕的目标稳步前进。,基本经济制度 党的领导,https://news.cctv.com/2022/02/27/ARTI0LbpURi4S5gxKDMhXK03220227.shtml
2022-02-27 10:40:51,延续减税降费政策将有效激发市场活力,2月22日，国新办举行财政改革与发展工作新闻发布会，会上表示今年将继续“延续实施涉及科技、就业创业、医疗、教育等11项税费优惠政策，扩大部分已有政策的优惠力度，并且要及早推出一些新的政策举措”。,十四五 税费体系,https://news.cctv.com/2022/02/27/ARTIK3Lvxaa1KwPZ4nomTMrz220227.shtml
2022-02-27 06:04:16,从购物车看乡村振兴,当前，我国农村消费市场取得长足发展，特别是随着收入水平持续提高，农村居民消费能力进一步加强，规模庞大的农村市场不仅引领了消费与产业的升级，成为扩内需、稳增长的新亮点，也是促进经济高质量发展的积极力量和重要引擎。,县域 振兴战略 农村消费者 家居家装 农村食品 京东 居住环境 育儿 海鲜 母婴,https://jingji.cctv.com/2022/02/27/ARTIOdme3CrCsTD6VAhnm5jS220227.shtml
2022-02-26 15:04:26,完善上市公司退市后监管，交易所、全国股转公司等起草相关实施办法,为适应注册制改革和常态化退市的要求，落实证监会关于完善上市公司退市后监管工作的指导意见，上海证券交易所、深圳证券交易所、北京证券交易所和全国股转公司、中国结算联合起草了退市公司进入退市板块挂牌转让的实施办法，于2月25日起向社会公开征求意见。,退市公司 退市程序 退市机制,https://news.cctv.com/2022/02/26/ARTIBOoYSnjBQbMuoMicGNmd220226.shtml
2022-02-26 12:33:12,共建“一带一路”顺应经济全球化潮流（热点对话）,谢来辉：疫情暴发之后，在世界经济复苏乏力的背景下，共建“一带一路”呈现逆势上扬的态势，受到相关国家尤其是发展中国家的热烈欢迎。,一带一路 经济全球化,https://news.cctv.com/2022/02/26/ARTIqNpmGpPOI0thvm03oB6d220226.shtml
2022-02-26 01:23:08,北京发布多项支持政策 企业最高可获2000万元,“2022北京消费季”期间，符合标准的城市商业综合体、线下零售企业、餐饮企业等，将获得数十万至上千万元不等的资金支持。,北京 支持政策 企业,https://jingji.cctv.com/2022/02/26/ARTIuNPW6HgpdEVgAytQCAen220226.shtml
2022-02-25 17:49:09,财政部：1月份全国共销售彩票308.21亿元 同比下降13.8%,1月份，全国共销售彩票308.21亿元，比上年同期减少49.36亿元，下降13.8%。其中，福利彩票机构销售139.79亿元，同比减少12.33亿元，下降8.1%；体育彩票机构销售168.41亿元，同比减少37.03亿元，下降18.0%。,财政部 彩票,https://jingji.cctv.com/2022/02/25/ARTIfw3iMnxVRfAgCWYKqwE1220225.shtml
2022-02-25 02:00:38,费率优惠活动频频 银行理财开打“价格战”,进入2022年，关注理财产品的投资者会发现，各家银行和理财子公司频繁发布理财产品费率优惠活动的公告，争相用更低的费率吸引客户。,费率优惠 银行理财 价格战,https://jingji.cctv.com/2022/02/25/ARTIihZks82kIGlwOiE0XI1X220225.shtml
2022-02-22 00:31:27,央行：设有实体网点的商业银行必须办理人民币现金存取业务,央行副行长范一飞在人民银行和银保监会联合召开的人民币现金服务座谈会上明确指出，设有实体网点的商业银行和农信社等必须办理人民币现金存取业务。,实体网点 商业银行 现金 存取业务,https://jingji.cctv.com/2022/02/22/ARTICbIGwwKDA9MSfqmUbUNA220222.shtml
2022-02-21 01:23:12,关于IPO、财务造假、中介责任……证监会“回复函”透露最新态度,完善IPO发行制度、严打财务造假、厘清中介责任以及加强投资者保护等内容，都是代表委员近期非常关注的问题。对于相关意见建议，证监会在回复中也透露了最新态度。,IPO 财务造假 中介责任 证监会 回复函,https://jingji.cctv.com/2022/02/21/ARTI6J1lSt1iHsIrO2i1ynnI220221.shtml
2022-02-20 06:46:59,供应充足冲抵雨雪天不利影响 节后全国菜价小幅下行,春节假期以来，我国多地出现较大范围的低温雨雪天气，不利于蔬菜生长、采收和运输。但从市场价格来看，全国蔬菜价格呈现持续小幅下行的态势。,蔬菜价格 采收 新发地,https://jingji.cctv.com/2022/02/20/ARTItkiZnorfMQhE4lauewlp220220.shtml
2022-02-19 09:47:45,深圳出台27条硬招建国际消费中心城市,《深圳市关于加快建设国际消费中心城市的若干措施》已经市政府同意印发。《若干措施》共八部分，合计27条，重点聚焦于补齐商业和消费领域发展短板，锻强优势长板，培育引领消费时尚的平台和领先的商业企业，打造具有全球影响力的大湾区消费高地。,中心城市 若干措施,https://jingji.cctv.com/2022/02/19/ARTIwiCf0kC2kCQ9um6Mo0Kc220219.shtml
2022-02-19 06:11:04,春节后多地首套房贷首付比例下调 最低降至20%,山东菏泽之后，又有其他地区传出房贷首付比例下调的消息。昨日，来自多个渠道的信息显示，重庆和江西赣州的不少银行也已经将首套房贷首付比例降至20%。受多地房贷首付比例下调的利好刺激，昨日，港股和A股的地产股全线普遍大涨。,风险防控 政策优化,https://jingji.cctv.com/2022/02/19/ARTIQ7tsf2K3E407egoQwULA220219.shtml
2022-02-18 20:18:17,证监会发布《证券基金经营机构董事、监事、高级管理人员及从业人员监督管理办法》,为贯彻落实新《证券法》，规范证券基金经营机构董事、监事、高级管理人员及从业人员的任职和执业行为，强化经营机构主体责任，促进经营机构合规稳健运行，保护投资者合法权益，证监会制定并发布了《证券基金经营机构董事、监事、高级管理人员及从业人员监督管理办法》。,证券基金 证券法,https://jingji.cctv.com/2022/02/18/ARTIRFyogqloUtuTERvH9ysF220218.shtml
2022-02-18 17:38:08,国家外汇管理局：1月银行结售汇顺差1766亿元,国家外汇管理局统计数据显示，2022年1月，银行结汇15399亿元人民币，售汇13632亿元人民币，结售汇顺差1766亿元人民币。,银行代客 银行结售汇 到期期权,https://news.cctv.com/2022/02/18/ARTIkbDvM0l0xfj7MdTSMql2220218.shtml
