version_date,title,brief,keyword,url
2022-03-30 19:47:39,市场监管总局批准发布一批重要国家标准物质,近日，市场监管总局集中发布了2021年新批准国家一级标准物质345项、国家二级标准物质1774项，涉及食品安全、农业生产、大众健康、新能源等多个领域，为经济社会高质量发展提供坚实计量技术支撑。,市场监管总局 国家标准物质,https://news.cctv.com/2022/03/30/ARTIiNXixDH2reWH9Y9cJOig220330.shtml
2022-03-30 19:34:15,北京证券交易所：决定免收全部上市公司2022年度上市费用,北京证券交易所：决定免收全部上市公司2022年度上市费用。,北京证券交易所 上市公司 费用,https://news.cctv.com/2022/03/30/ARTIb2QpqmnOde4c1rlzJkxM220330.shtml
2022-03-30 17:46:06,财政部：1-2月全国共销售彩票533.02亿元，同比减少14.1亿元,受春节休市、派奖促销、欧冠联赛等因素影响，2月份单月彩票销量同比增长较快，同时受高频快开游戏退市影响，1-2月累计销量同比略有下降，总体基本平稳。,彩票 销售 销量,https://news.cctv.com/2022/03/30/ARTICSMaFAwtVtO8fWoYfi05220330.shtml
2022-03-30 16:07:58,央行：强化对农业农村基础设施建设的金融支持,强化对农业农村基础设施建设的金融支持。,县域 金融 商业,https://news.cctv.com/2022/03/30/ARTIB4KvWgDBzZVAx4t6KqaM220330.shtml
2022-03-30 16:04:01,人民银行印发《关于做好2022年金融支持全面推进乡村振兴重点工作的意见》,人民银行网站30日发布《中国人民银行关于做好2022年金融支持全面推进乡村振兴重点工作的意见》，具体内容如下。,人民银行 乡村振兴,https://news.cctv.com/2022/03/30/ARTItyteS9BQKWoKfBhfxNYi220330.shtml
2022-03-29 20:17:32,国有企业改革深入推进,党的十八大以来，在以习近平同志为核心的党中央坚强领导下，国有企业改革全面发力、深入推进，解决了一批长期想解决而没有解决的问题，取得了一系列重大进展和重要成果。,国有企业改革 深入推进,https://jingji.cctv.com/2022/03/29/ARTIRo7jivXDjXgrZSBcIUg6220329.shtml
2022-03-28 14:39:23,我国保险资金运用余额23.2万亿元,保险资金投资债券、股票、股权三者的占比保持在近60%。截至2021年末，保险资金运用余额23.2万亿元，其中投资债券9.1万亿元，投资股票2.5万亿元，股票型基金0.7万亿元。,保险资金运用 理财产品 股票型基金 余额 我国保险 资本市场 投资者结构 债券 公募基金 银保,https://jingji.cctv.com/2022/03/28/ARTIPsLxPJEOKcMORND0BNXp220328.shtml
2022-03-27 14:45:23,证监会：推动完善民企债券融资支持机制，增强服务民营经济发展质效,为贯彻党中央、国务院关于支持民营企业发展的决策部署，落实政府工作报告关于完善民营企业债券融资支持机制的工作要求，证监会拟于近期推出一系列政策措施，进一步拓宽民营企业债券融资渠道，增强服务民营经济发展质效。,证监会 民企债券 融资,https://jingji.cctv.com/2022/03/27/ARTIqODdPH019fW4wSybvvjU220327.shtml
2022-03-27 09:33:50,1—2月份工业企业利润小幅增长,今年以来，面对复杂严峻的国内外经济形势，各地区、各部门加大稳增长和支持实体经济的力度，工业经济稳定恢复，企业利润小幅增长。2022年1—2月份，全国规模以上工业企业利润同比增长5.0%，增速较去年12月份回升0.8个百分点。,能源原材料 工业企业 利润增长,https://news.cctv.com/2022/03/27/ARTIsWePRikTW5zcsGwgINT6220327.shtml
2022-03-27 09:31:27,2022年1—2月份全国规模以上工业企业利润增长5.0%,1—2月份，全国规模以上工业企业实现利润总额11575.6亿元，同比增长5.0%。,工业企业 利润增长,https://news.cctv.com/2022/03/27/ARTInWZhyJ5Y65fI7isaU3Zn220327.shtml
2022-03-26 20:57:22,人民财评：用政府“紧日子”换取百姓“好日子”,近日，102个中央部门集中向社会公开2022年部门预算，落实过“紧日子”要求压减支出成为鲜明主题词。严格执行中央关于财经工作的方针政策和工作部署，把过“紧日子”的要求落到实处，我们完全有基础有条件推动经济社会持续健康发展。,紧日子 政府工作报告,https://news.cctv.com/2022/03/26/ARTIkyhb5CZTUFfh7yX0cltO220326.shtml
2022-03-26 20:56:26,中经评论：民营企业10年翻两番 民营经济将会继续壮大,核心观点：中国经济网评论员子房先生认为，民营企业数量10年翻两番，有赖于企业家们的努力奋斗，更离不开党和国家的支持。民营企业数量10年翻两番，有赖于企业家们的努力奋斗，更离不开党和国家的支持。,企业总量 民营经济发展,https://news.cctv.com/2022/03/26/ARTIxuO5aQltWlJ4epCgt6bl220326.shtml
2022-03-26 10:09:21,银保监会：加大信贷投放力度 助力行业企业恢复发展,针对当前我国部分行业企业受疫情影响，生产经营困难的情况，中国银保监会相关部门负责人昨天(25日)表示，将抓实抓细已出台各项支持政策落地，助力受疫情影响行业企业恢复发展。,信贷投放 助力,https://jingji.cctv.com/2022/03/26/ARTI0ALRdmDbzDjYBTrJ8NXn220326.shtml
2022-03-26 00:16:23,减负超750亿元！深圳发布惠企纾困“三十条”,3月25日，深圳市人民政府发布惠企纾困“三十条”，全力做好疫情防控和经济社会发展“双统筹”，进一步减轻市场主体负担，帮助市场主体渡过难关。,750亿元 深圳 惠企纾困 三十条,https://jingji.cctv.com/2022/03/26/ARTIaHmTPPNRD5xW5SN2htmS220326.shtml
2022-03-25 00:54:28,“宅经济”商品出口“降温”？商务部这样回应,据海关统计，今年前两个月，我国手机、家用电器出口同比均有所下降。有媒体提出，这是否说明“宅经济”商品出口热度正在下降？商务部新闻发言人束珏婷24日对此进行了回应。,宅经济 出口 商务部,https://jingji.cctv.com/2022/03/25/ARTIlDMGYEKZtQDwR7l0V8Nb220325.shtml
2022-03-25 00:45:42,中行、农行公告！系统升级或维护，多项服务会暂停,近日，中国银行和中国农业银行分别发布公告显示，中国银行将于近期进行系统升级，相关业务将受影响；农业银行将生产系统维护，多项服务期间将短暂暂停。,中行 农行 公告,https://jingji.cctv.com/2022/03/25/ARTInO5URfObjFMDKiMcgGne220325.shtml
2022-03-24 11:03:27,更大规模留抵退税 企业迎来超万亿“真金白银”,今年的《政府工作报告》提出，预计全年退税减税约2.5万亿元，其中留抵退税约1.5万亿元，退税资金全部直达企业。3月22日，财政部、国家税务总局发布《关于进一步加大增值税期末留抵退税政策实施力度的公告》（以下简称《公告》），明确进一步加大留抵退税力度的具体措施和操作办法。新一轮留抵退税政策有哪些亮点？在哪些方面加大了减税退税力度？在3月23日国新办举行的国务院政策例行吹风会上，财政部、国家税务总局相关负责人解答了相关问题。,小微 企业增值税 制造业 留抵 退税 进项增值税 公告 光明日报 存量 退还,https://jingji.cctv.com/2022/03/24/ARTIoVl24ZpyeSSjuiawcEBh220324.shtml
2022-03-23 18:39:11,财政部：四个措施落实增值税留抵退税等新的组合式税费政策,今天（3月23日），国务院新闻办公室举行国务院政策例行吹风会，财政部副部长许宏才、国家税务总局副局长王道树介绍了增值税留抵退税有关情况。,退税 财政部,https://news.cctv.com/2022/03/23/ARTIpMPEt1t8X0hjnjgMSK1S220323.shtml
2022-03-22 06:41:20,退税，来了！预期，稳了！,3月21日召开的国务院常务会议，从财政政策和货币政策方面“左右开弓”，确定实施大规模增值税留抵退税的政策安排，为稳定宏观经济大盘提供强力支撑；部署综合施策稳定市场预期，保持资本市场平稳健康发展。,退税 预期,https://jingji.cctv.com/2022/03/22/ARTIZe3m2QLRV8r2tnlg6qAx220322.shtml
2022-03-21 06:06:45,金融委会议后，哪些政策值得期待？,3月16日，国务院金融稳定发展委员会召开专题会议，研究当前经济形势和资本市场问题。消息一出，迅速刷屏，市场信心随之提振。,金融委会议 政策 期待,https://jingji.cctv.com/2022/03/21/ARTI1EZhbxajNjZw9XjFSJsH220321.shtml
2022-03-18 18:06:50,证监会：正在指导交易所抓紧制定REITs扩募规则,当前，证监会正在会同相关部委，进一步深入推进基础设施REITs试点，完善制度机制，拓宽试点范围，更好发挥公募REITs的功能作用，进一步促进投融资良性循环，助力实体经济发展。,REITs 证监会,https://news.cctv.com/2022/03/18/ARTIXkgKN8vb3jGUPOBZXzfs220318.shtml
2022-03-18 14:28:43,市场监管总局印发《“十四五”市场监管科技发展规划》,市场监管总局发布《“十四五”市场监管科技发展规划》提出，加强“国家科学技术奖励”等高水平成果培育，开展“市场监管科研成果奖”“中国标准创新贡献奖”“中国专利奖”评选表彰活动。,市场监管总局 科技发展规划,https://news.cctv.com/2022/03/18/ARTI4V1BwywR9HKBluvx0tnX220318.shtml
2022-03-18 06:44:15,重大工程建设正酣 助力经济平稳开局,神州大地投资潮涌，重大项目建设正酣。连日来，各地以投资促增长，抓好重大工程和项目实施，多个重大工程项目相继开复工，建设如火如荼。,重大产业项目 经济发展局,https://jingji.cctv.com/2022/03/18/ARTIQi9UtTKJ4oPmwKIuFF2m220318.shtml
2022-03-16 05:55:53,生猪跌到6元一斤，中央收储又来，会不跌了？,这里是民生调查局，见人所未见，调查民生之变。关注你想关注的、你没关注的，调查你想看的、未看到的。,生猪价格,https://jingji.cctv.com/2022/03/16/ARTITlFPpcUDQvQkuGkXBg5s220316.shtml
2022-03-15 10:00:26,1-2月份国民经济恢复好于预期,1-2月份，全国规模以上工业增加值同比增长7.5%，比2021年12月份加快3.2个百分点，比2021年两年平均增速加快1.4个百分点。,2022年 国民经济,https://jingji.cctv.com/2022/03/15/ARTILA3oPqEamcve4QQ90QwM220315.shtml
