version_date,title,brief,keyword,url
2022-04-10 17:24:26,一起向未来！习近平盛赞“两个奥运”,4月8日，习近平总书记出席北京冬奥会、冬残奥会总结表彰大会并发表重要讲话。讲话中，习近平热情洋溢地盛赞“两个奥运”的成功，发出“圆梦冬奥会，一起向未来”的铿锵号召。,习近平 冬奥 冬奥会,https://news.cctv.com/2022/04/10/ARTIMQ0sYONTTvodNmRadlPp220410.shtml
2022-04-10 17:22:42,4月9日0时至10日14时，广州新增22例感染者,4月10日下午，广州召开疫情防控新闻发布会。发布会上，广州市政府副秘书长吴林波介绍，4月8日以来，广州市发生新的本土疫情，从4月9日0时至10日14时，新增22例新冠病毒感染者。本次疫情累计报告新冠病毒感染者23例。从区域分布看，已报告的感染者中，白云区、越秀区、海珠区、天河区分别有19例、2例、1例和1例。,广州,https://news.cctv.com/2022/04/10/ARTIFB3rJN8CDPR2WMZ97iGY220410.shtml
2022-04-10 17:10:07,“动态清零”是真正的以人为本,上海本轮战“疫”已经进入“最关键、最吃劲”阶段。,清零 疫情 防控,https://news.cctv.com/2022/04/10/ARTIOAA36dwVsLbHooT7mRUT220410.shtml
2022-04-10 17:08:45,新冠核酸检测价格再降,近日，国家医保局办公室、国务院应对新型冠状病毒肺炎疫情联防联控机制医疗救助组联合部署新一轮全国新冠核酸检测降价，要求各省份在2021年连续三次降价的基础上，于4月8日前将公立医疗机构新冠核酸检测的单人单检政府指导价下调至每人份不高于28元，多人混检政府指导价下调至每人份不高于8元，确有特殊情况的省份可延至4月30日前降价。,新冠 核酸检测 价格再降,https://news.cctv.com/2022/04/10/ARTIM8NTvRCi9OuHBbwgy1mr220410.shtml
2022-04-10 17:02:51,坚守才能胜利,不同的岗位，一样的坚守。医务人员日夜奋战，挺在抗疫最前沿。,坚守 上海 疫情,https://news.cctv.com/2022/04/10/ARTIxM3rVgKGTSWo4u7NwHzn220410.shtml
2022-04-10 16:59:49,充实医疗力量 携手抗击疫情,一方有难，八方支援。目前，已有来自安徽、浙江、湖北、江苏等多个省份的医疗队进驻上海的多家方舱医院。,方舱 感染者 医疗队,https://news.cctv.com/2022/04/10/ARTI45mrU9nfy3lUu0SBP9vs220410.shtml
2022-04-10 16:33:45,相互守望！这些春日留言让人动容,相互守望！这些春日留言让人动容。,守望 疫情防控 团结互助,https://news.cctv.com/2022/04/10/ARTIGBxyGyCO05ZT1xw9aKgT220410.shtml
2022-04-10 16:30:56,上海战疫录：经济金融守“沪”战！上海对中国有多重要？,当前，上海市疫情处于高峰期。在战“疫”的同时，一场经济金融守“沪”战也在进行。,经济金融 经济运行 金融支持,https://news.cctv.com/2022/04/10/ARTIyr6VSEhXESPfS5w4LVjF220410.shtml
2022-04-10 16:30:17,如剑如影 酣畅淋漓—《艺术里的奥林匹克》带您探寻张旭草书与剑舞的交融之美,《艺术里的奥林匹克》第四十二期，总台央视奥林匹克频道4月10日20:10首播。,艺术里的奥林匹克,https://news.cctv.com/2022/04/10/ARTIiP7WnigQ7zMLBFAWhMIZ220410.shtml
2022-04-10 16:29:15,国务院安委会制定部署安全生产十五条措施,记者10日从应急管理部获悉，国务院安委会近日制定部署安全生产十五条措施，其中明确要求深入扎实开展全国安全生产大检查，对排查整治不认真，未列入清单、经查实属于重大隐患的，要当作事故对待，引发事故的要从严从重追究责任。,安委会 安全生产 生产责任,https://news.cctv.com/2022/04/10/ARTIf4bOMztOCJhuighmwzwx220410.shtml
2022-04-10 16:20:48,交通运输部：严禁在高速公路主线和服务区设置防疫检测点,记者9日从交通运输部获悉，针对当前货运物流存在的突出问题，交通运输部部署落实货运物流保通保畅工作，要求严禁在高速公路主线和服务区设置防疫检测点，严禁擅自关停高速公路服务区。,运输部 检测点 高速公路,https://news.cctv.com/2022/04/10/ARTI9vqmuRwRiUP67mqnu8e9220410.shtml
2022-04-10 16:20:06,强化政治考察  严把政治关口,手拿推荐人选测评表，西藏自治区山南市隆子县玉麦乡党委副书记、乡长仁青平措认真阅读，并逐一填下了自己的意见，两张政治素质测评表，内容包含政治忠诚、政治定力、政治担当、政治能力、政治自律在内的五大方面共40个测评项。,候选人 政治素质 二十大,https://news.cctv.com/2022/04/10/ARTIBQ0SFpzyiLQJAGQJxwJn220410.shtml
2022-04-10 16:01:18,科普解读 | 关于“无症状感染者”的那些事,近期国内本轮疫情中，无症状感染者较之前明显增加。,感染者 科普 疫情,https://news.cctv.com/2022/04/10/ARTI50Ayvl2b0xx9fDsgju9E220410.shtml
2022-04-10 15:54:53,珠海：明日12时起，进入住宅小区、室内公共场所须持48小时内核酸阴性证明或采样证明,据“珠海发布”微信公众号4月10日消息，为因应广州、深圳和佛山等周边城市疫情形势变化，现就科学精准落实珠海市疫情防控工作相关事项通告如下。,珠海 核酸阴性证明,https://news.cctv.com/2022/04/10/ARTIuPZ02tefSRAx9NlXdoyZ220410.shtml
