version_date,title,brief,keyword,url
2022-05-29 14:57:45,【走进老区看新貌】金银花开富农家 铺就乡村振兴路,进入新时代，平邑人民传承红色基因，依托当地金银花特色产业优势，着力打造集金银花、医药、乡村旅游为一体的产业链条，带动当地老百姓增收致富。,走进老区看新貌 金银花,https://news.cctv.com/2022/05/29/ARTIHburR4hDvA0nOXV9HMUU220529.shtml
2022-05-29 14:57:32,广西靖西：持续降雨导致多个乡镇严重内涝 多处塌方,5月28日，连续多日的强降雨导致广西靖西市局部地区出现灾情，吞盘、地州、南坡等乡镇受灾，造成城镇内涝、道路中断、多处塌方、农田受淹。,灾情 靖西市,https://news.cctv.com/2022/05/29/ARTIcYkmqi4WX3T1Fs6BCiMV220529.shtml
2022-05-29 14:51:40,国家卫健委：累计报告接种新冠病毒疫苗337821.1万剂次,截至2022年5月28日，31个省（自治区、直辖市）和新疆生产建设兵团累计报告接种新冠病毒疫苗337821.1万剂次。,新冠 接种 病毒疫苗,https://news.cctv.com/2022/05/29/ARTI5KQiLmP8o5KKoVQFO87Q220529.shtml
2022-05-29 14:50:29,上海：对餐饮、零售、住宿等等困难行业企业给予一次性稳岗补贴,上海市新冠肺炎疫情防控发布会，上海市委常委、常务副市长吴清表示，上海市制定了《上海市加快经济恢复和重振行动方案》，《行动方案》共包括八个方面、50条政策措施。,住宿 餐饮 补贴,https://news.cctv.com/2022/05/29/ARTIfNu7Y7x2p7uBe7QpbgqH220529.shtml
2022-05-29 14:49:04,上海：6月1日起取消企业复工复产审批制度,5月29日下午，上海市新冠肺炎疫情防控发布会，上海市委常委、常务副市长吴清表示，上海市制定了《上海市加快经济恢复和重振行动方案》，《行动方案》共包括八个方面、50条政策措施。,上海 企业 复工复产,https://news.cctv.com/2022/05/29/ARTINGC4w4XHsutHQc0ILOH9220529.shtml
2022-05-29 14:36:14,【走进老区看新貌】发挥种质资源优势 乡村振兴带动百姓增收致富,您现在看到的是新泰市龙廷镇。这里坚持绿色发展理念，通过发挥百合、菊花、甘薯等种质资源优势，以农产品加工增值延伸产业链，建成了一批国家级农业龙头企业，推动乡村振兴，带动当地老百姓增收致富。,走进老区看新貌 绿色农业,https://news.cctv.com/2022/05/29/ARTIeRglblcU24jYakiCTU9y220529.shtml
2022-05-29 14:36:02,【走进老区看新貌】非遗产业转型升级 传统手艺焕发生机,当地大力发展红色旅游和乡村振兴特色产业。临沂市郯城县的木旋玩具是国家级非物质文化遗产，有着600多年的历史，近几年来，在当地政府的扶持下，木旋玩具品牌走出了一条非遗产品的转型升级产业化发展之路。,山东郯城 走进老区看新貌 非遗产业,https://news.cctv.com/2022/05/29/ARTIEq83K0dHGhQ2v2UmfXgq220529.shtml
2022-05-29 14:35:46,【走进老区看新貌】隐士村里柿子红 走出百姓致富路,近年来，村党支部牵头成立“隐士人家”乡村旅游合作社，大力发展特色民宿和山柿种植，集中新建了一批柿子晾晒棚，年产柿子2000万斤左右，全年销售额过亿元，隐士村也成为了远近闻名的产业龙头村。,山东临朐 走进老区看新貌 隐士村,https://news.cctv.com/2022/05/29/ARTIoPe1o9DuvDQW2btbmva3220529.shtml
2022-05-29 14:33:28,【走进老区看新貌】昔日红色抗战线 今朝绿茶种植带,现在大家看到的是位于日照莒县的206国道，抗战时期，这里曾经是莒县军民抗击日军的交通线。昔日的“红色抗战线”如今成为绿茶种植带。当地成立了30多家茶叶专业合作社，年产茶900多吨。,山东莒县 走进老区看新貌 红色抗战线,https://news.cctv.com/2022/05/29/ARTI0WnyhI11jmWD66aOUgUE220529.shtml
2022-05-29 14:33:16,【走进老区看新貌】书写绿色发展答卷 实现经济生态双丰收,这里是日照市五莲山下全产业链的现代农业示范园。红色基因引领绿色发展，当地村庄依托樱桃、苹果等农产品资源，通过探索“党支部+合作社”模式，大力发展乡村采摘游、农家乐等产业，使当地实现了生态效益和经济效益双丰收。,走进老区看新貌 经济生态双丰收,https://news.cctv.com/2022/05/29/ARTI88y6iVucYAmr7wsygQyU220529.shtml
2022-05-29 14:32:58,【走进老区看新貌】山东费县发展特色产业集群 推动转型升级,跟随镜头，我们来到临沂市费县。这里是沂蒙山小调的诞生地，费县木业产业历经多年的发展，从最初的原木粗加工发展成现在板材、粘合剂、家居等链条完整的产业集群。,走进老区看新貌 木业产业集群 转型升级,https://news.cctv.com/2022/05/29/ARTIkQDSGkalGbNkLYKSMhkz220529.shtml
2022-05-29 14:30:53,上海市人民政府发布《上海市加快经济恢复和重振行动方案》,为贯彻落实国务院稳经济一揽子政策措施，高效统筹疫情防控和经济社会发展，有力有序推动经济加快恢复和重振，制定本行动方案。,经济恢复 上海市,https://news.cctv.com/2022/05/29/ARTIRLOedtTeH022cChXIAsm220529.shtml
2022-05-29 13:44:50,自然资源部启动地质灾害防御Ⅳ级响应,当前，我国南方地区陆续进入主汛期，江南、华南、西南等地已经遭遇多次强降雨过程，接连发生贵州织金、四川荣县、福建武平等多起地质灾害。自然资源部于5月27日18时启动地质灾害防御Ⅳ级响应。,自然资源部 地质灾害 Ⅳ级响应,https://news.cctv.com/2022/05/29/ARTI6R5PtH5TDntE51zSLkxW220529.shtml
2022-05-29 13:34:41,见信如晤｜家是玉麦 国是中国,党的十八大以来，习近平总书记多次给各族群众回信，谆谆寄语、饱含深情，殷殷期待、催人奋进。,习近平,https://news.cctv.com/2022/05/29/ARTIgOlF0fa3lHXSVqcY6Ucl220529.shtml
2022-05-29 13:17:48,神舟十四号船箭组合体转运至发射区 计划近日择机实施发射,今天（5月29日）上午，在酒泉卫星发射中心，神舟十四号载人飞船与长征二号F遥十四运载火箭组合体已转运至发射区，计划近日择机实施发射。目前，发射场设施设备状态良好，后续将按计划开展发射前的各项检查、测试工作。,神舟十四号 船箭组合体 发射区,https://news.cctv.com/2022/05/29/ARTIKKCkzD8x1aFY3sbgUDPO220529.shtml
2022-05-29 13:17:34,【大国科学家】姚檀栋：爬冰卧雪40载 守护最后一方净土,“世界屋脊”青藏高原被认为是世界上最后一方净土，也是亚洲十几条大江大河的发源地。它的气候环境变化关系到我国乃至亚洲20多亿人口的生存发展，可谓牵一发而动全身。在全球气候变暖的大背景下，青藏高原到底发生了什么变化？将来又会沿着怎样的趋势演变？这些都是中科院院士姚檀栋近40年来孜孜以求的科学目标。系列报道《大国科学家》，今天（5月29日）就带您认识这位给世界上最后一方净土做“体检”的科学家。,大国科学家 姚檀栋 最后一方净土,https://news.cctv.com/2022/05/29/ARTIaZNLna4G0PEiNdvJ5i8B220529.shtml
2022-05-29 13:10:28,【奋进新征程 建功新时代·走进老区看新貌】山东：传承沂蒙精神 谱写发展新篇,山东18个县市区曾属于沂蒙革命老区，党的十八大以来，山东弘扬沂蒙精神，锐意改革，敢创新路，开创新时代社会主义现代化强省建设新局面。,奋进新征程 建功新时代 走进老区看新貌,https://news.cctv.com/2022/05/29/ARTIWwN4DpAMB3rbeBzHYmsK220529.shtml
