version_date,title,brief,keyword,url
2022-04-12 08:25:42,天津4月11日新增1例本土无症状感染者,据天津卫健委，2022年4月11日0－24时，天津市无新增本土新冠肺炎确诊病例。无新增境外输入性新冠肺炎确诊病例。新增1例本土无症状感染者，无新增境外输入无症状感染者。治愈出院3人（其中本土病例2人，境外输入病例1人）。,天津,https://news.cctv.com/2022/04/12/ARTI8aBKV7YTDndymwn0OfBj220412.shtml
2022-04-12 08:23:20,江苏：海棠花开春意浓,2022年4月11日，江苏省淮安市，里运河畔成片的海棠花进入盛花期，春意盎然。,江苏 淮安 海棠花 春意浓,https://photo.cctv.com/2022/04/12/PHOAanbE0y7pcUFtXxMlqSn6220412.shtml
2022-04-12 08:21:24,第一观察｜总书记海南考察再谈种子“这件大事”,“种子是我国粮食安全的关键。只有用自己的手攥紧中国种子，才能端稳中国饭碗，才能实现粮食安全。”,总书记,https://news.cctv.com/2022/04/12/ARTIIuXps8xnSGDsLeq2g4vW220412.shtml
2022-04-12 08:18:08,新疆乌鲁木齐市乌鲁木齐县（有感）2.5级地震,中国地震台网正式测定：04月12日08时05分在新疆乌鲁木齐市乌鲁木齐县（有感）（北纬43.32度，东经87.62度）发生2.5级地震，震源深度18千米。,发震时刻 纬度 经度,https://news.cctv.com/2022/04/12/ARTInp3gUba5A2OVSfIDmU5N220412.shtml
2022-04-12 08:15:37,春忙如画,阳春三月，各地农民抢抓农时开展农业生产，田间地头一派繁忙景象。,春天 四月 万物复苏 美丽中国,https://photo.cctv.com/2022/04/12/PHOAANH7SHcvyCE7YDRVWduL220412.shtml
2022-04-12 08:14:50,安徽淮南昨日新增无症状感染者2例,据淮南市卫健委，4月11日0-24时，淮南市报告无新增确诊病例，无新增疑似病例。新增无症状感染者2例（田家庵区1例，大通区1例），均在隔离管控人员检测中发现。新增解除医学观察的无症状感染者例38例（凤台县36例，寿县2例）。,淮南市 感染者 新增,https://news.cctv.com/2022/04/12/ARTI5UC30T4VqYFHGiHOatwC220412.shtml
2022-04-12 08:10:00,4月12日0-8时，杭州新增4例新冠病毒无症状感染者,4月12日0-8时，杭州新增4例新冠病毒无症状感染者。,杭州新增,https://news.cctv.com/2022/04/12/ARTIeC2op0KX7Pg51AjpFizC220412.shtml
2022-04-12 08:09:52,安徽：水清岸绿船运忙,2022年4月11日，长江航道安徽省安庆市宿松县段，水清岸绿江阔，船舶运输繁忙。,安徽 安庆 长江航道 水清岸绿　,https://photo.cctv.com/2022/04/12/PHOAhSxEVbKj4Z7bgJVwMm3M220412.shtml
2022-04-12 08:08:25,河北新增44例无症状,据河北卫健委，4月11日0—24时，河北省无新增本土新型冠状病毒肺炎确诊病例；新增本土无症状感染者44例，其中邯郸市20例、保定市19例、沧州市4例、承德市1例（外省关联病例）。治愈出院30例，无症状感染者解除医学观察360例。截至4月11日24时，河北省现有本土确诊病例57例；尚在医学观察本土无症状感染者1305例。,无症状 感染者 治愈 确诊病例 医学观察 出院 肺炎 新型冠状病毒 沧州市 承德市,https://news.cctv.com/2022/04/12/ARTIY2febHeD3jbbqRQIzsOd220412.shtml
2022-04-12 08:08:10,辽宁4月11日新增1例本土确诊病例、24例本土无症状感染者,4月11日0-24时，辽宁省新增1例本土新冠肺炎确诊病例，为阜新市报告；新增24例本土无症状感染者，其中沈阳市报告15例、大连市报告5例、鞍山市报告4例。,确诊病例 感染者 肺炎,https://news.cctv.com/2022/04/12/ARTIhq85ozX1lE7XeJDxC5bL220412.shtml
2022-04-12 08:05:53,【8点见】北医三院就高价殡葬费发布说明,每天8点，央视网为您梳理24小时内发生在咱们身边的大小事儿。,8点见,https://news.cctv.com/2022/04/12/ARTI9z5XG52NYizcnHykxRMs220412.shtml
2022-04-12 08:03:18,探访上海浦东“火眼”实验室负压硬气膜舱,4月11日，工作人员正在“火眼”实验室内进行核酸检测工作。,上海 浦东 实验室 负压硬气膜舱,https://photo.cctv.com/2022/04/12/PHOAMflZarGHIglBYPbYFipg220412.shtml
2022-04-12 07:57:14,江苏溧阳一小区发生一起致1死1伤恶性刑事案件，犯罪嫌疑人被抓获,“常州溧阳公安微警务”微信公众号12日消息，4月11日20时40分许，溧阳市溧城街道金峰新城小区内发生一起1死1伤的恶性刑事案件，溧阳市公安局立即启动重大案件侦破机制，于当晚24时许将涉案犯罪嫌疑人程某某（男，29岁，溧阳人）抓获。目前，伤者已送医救治，无生命危险，案件正在进一步侦办中。,案件 警务,https://news.cctv.com/2022/04/12/ARTIuEuM8A5P7BEQoTNj40PS220412.shtml
2022-04-12 07:52:46,北京4月11日新增4例本土确诊病例,据北京卫健委，4月11日0时至24时，北京市新增4例本土确诊病例(确诊病例1至3昨日均已通报)，无新增疑似病例和无症状感染者；无新增境外输入确诊病例、疑似病例和无症状感染者。治愈出院1例。,病例 确诊 新增 感染者,https://news.cctv.com/2022/04/12/ARTIbPVLhU3cgOHTBU9mnUF0220412.shtml
2022-04-12 07:47:57,上海新增994例本土确诊和22348例本土无症状,4月11日0—24时，上海新增本土新冠肺炎确诊病例994例和无症状感染者22348例，其中273例确诊病例为此前无症状感染者转归，439例确诊病例和21844例无症状感染者在隔离管控中发现，其余在相关风险人群排查中发现。,无症状 确诊病例 感染者 肺炎 新冠 本土 卫健 输入性 闭环 转归,https://news.cctv.com/2022/04/12/ARTI20mPLq431Y77WP3ISSnl220412.shtml
2022-04-12 07:37:52,吉林白山：解除浑江区静态管理，有序恢复生产生活秩序,“健康白山”微信公众号消息，3月30日以来，浑江区已开展五轮区域（全员）核酸检测，经综合研判已实现社会面清零目标。为统筹疫情防控与经济社会发展，市、区两级疫情防控指挥部研究决定，从4月12日起，解除浑江区静态管理，逐步有序恢复生产生活秩序，现将有关事项通告如下。,防控 落实 管控,https://news.cctv.com/2022/04/12/ARTIvBEZ8ZeUatvLhu2qWGLd220412.shtml
2022-04-12 07:30:18,聚焦关键领域 稳物价多措并举,对于PPI环比上涨原因，董莉娟表示，地缘政治等因素推动国际大宗商品价格持续上行，带动国内石油、有色金属等相关行业价格继续上涨。展望下阶段物价走势，业内普遍认为，CPI同比涨幅可能温和上行，随着保供稳价措施持续发力，PPI有望逐步回落。,PPI 供给冲击,https://news.cctv.com/2022/04/12/ARTIDD9E3blVy8ohGDoZIOr6220412.shtml
2022-04-12 07:29:16,山西4月11日新增本土确诊病例1例、无症状感染者3例,4月11日0-24时，山西省新增本土新冠肺炎确诊病例1例（运城市临猗县无症状感染者转为确诊病例1例），新增治愈出院1例（临汾市洪洞县1例）。当日转为确诊病例1例（运城市临猗县1例）。,确诊病例 感染者 无症状,https://news.cctv.com/2022/04/12/ARTInq66tmX6GjrB6emqCclz220412.shtml
2022-04-12 07:28:55,国家文物局：2021年查处涉及全国重点文物保护单位违法案件67起,国家文物局11日发布关于2021年度文物行政执法和安全监管工作情况的通报。通报显示，2021年，全国开展文物执法巡查351390次，发现各类文物违法行为340起；查处涉及全国重点文物保护单位违法案件67起。,国家文物局 违法案件,https://news.cctv.com/2022/04/12/ARTI8oxbOw6R7IlsZ51T4Z1K220412.shtml
2022-04-12 07:08:41,新能源汽车为何纷纷涨价？,近期，不少消费者反映，本想好好挑辆新能源车，还没选定就发现涨价了。比亚迪新能源车2个月内2次涨价，理想汽车涨价1.18万元，小鹏汽车售价上调1万至2万元不等……今年以来，新能源汽车价格“涨”声迭起。,新能源汽车 汽车企业,https://news.cctv.com/2022/04/12/ARTIiH7cGdFF4yTJXAH1rd3w220412.shtml
2022-04-12 07:04:35,中办国办印发意见，推进新时代古籍工作,近日，中共中央办公厅、国务院办公厅印发了《关于推进新时代古籍工作的意见》，并发出通知，要求各地区各部门结合实际认真贯彻落实。,古籍整理 课程体系建设,https://news.cctv.com/2022/04/12/ARTIOAZgYl66pyi2TA6FvnX3220412.shtml
2022-04-12 06:57:04,电信网络诈骗案件立案数连续9个月同比下降,记者从全国打击治理电信网络新型违法犯罪工作电视电话会议上获悉：过去一年来，各地区各部门狠抓打防管控各项措施和行业监管主体责任落实，推动打击治理电信网络诈骗违法犯罪工作取得了明显成效。,电信网络诈骗 案件立案,https://news.cctv.com/2022/04/12/ARTI6oc8VY9yWvX66JjUBB9i220412.shtml
2022-04-12 06:51:22,国务院联防联控机制通知：全力保障货运物流,日前，国务院应对新型冠状病毒感染肺炎疫情联防联控机制印发通知，部署切实做好货运物流保通保畅有关工作。,货运物流 防疫,https://news.cctv.com/2022/04/12/ARTINkwUdnvlMCcwpGKNrz6j220412.shtml
2022-04-12 01:12:44,生态环境部：到2025年底实现排污许可清单式执法检查全覆盖,生态环境部11日公布《关于加强排污许可执法监管的指导意见》，提出到2023年年底，重点行业实施排污许可清单式执法检查。,排污许可证 执法检查,https://news.cctv.com/2022/04/12/ARTIo0e6BPe2ACcMhlhI3dVk220412.shtml
2022-04-12 00:51:44,收拾行李，准备回家！太空“出差三人组”返程倒计时,神舟十三号航天员乘组为期六个月的太空“出差”行将结束。在返回之前，航天员们还有物资清点转移、舱内环境清洁维护、打包下行物品、设置无人飞行模式、检查飞船工作状态、身体监测等工作。,出差三人组 回家,https://news.cctv.com/2022/04/12/ARTIrPQPGwVS2A59K2jZiHxQ220412.shtml
2022-04-11 23:18:02,新华全媒+丨上海一定能渡过难关尽快恢复——上海各界谈坚持动态清零不动摇,动态清零是我国抗击新冠肺炎疫情的总方针，也是2020年武汉保卫战以来，我国疫情防控形成的一套战略性打法。以往多轮疫情都证明，动态清零是符合中国国情的，也是中国当前抗击疫情的最佳选择。,清零 方舱,https://news.cctv.com/2022/04/11/ARTINHCrLVMbjXBSCVS9mUQn220411.shtml
2022-04-11 23:13:12,4月11日0时至21时，浙江海宁新增3例阳性病例,据“海宁发布”微信公众号消息，4月11日0时至21时，海宁市在开展核酸筛查时，新增3例初筛阳性人员，经复核结果为阳性，均在集中隔离点检出。本轮疫情发生以来，海宁市累计报告本土新冠肺炎阳性病例168例。新增的3例基本情况如下。,疫情 隔离 病例,https://news.cctv.com/2022/04/11/ARTIDhHrvBV6AhXRhVpw4LU5220411.shtml
2022-04-11 22:59:43,上海多区公布首批“三区”划分名单,目前，黄浦区、静安区、普陀区、嘉定区、金山区、松江区、青浦区、奉贤区、崇明区已经公布了首批“三区”划分名单。,上海,https://news.cctv.com/2022/04/11/ARTICLsYbXb5xgC4EDvVBl05220411.shtml
2022-04-11 22:52:19,外交部：北约不要企图再搞乱亚洲和全世界,针对北约方面涉华动向，外交部发言人赵立坚11日指出，中国的发展是全世界的机遇，不是任何人的威胁。北约应该立即停止散播针对中方的不实之词和挑衅言论，放弃以意识形态划线的对抗性做法。,北约 中国的发展 外交部发言人 中国对外政策 中方 和平发展道路 涉华 国际社会 基本准则 国际关系,https://news.cctv.com/2022/04/11/ARTInmQWVkzaBa6tquIbDNBh220411.shtml
2022-04-11 22:01:11,台湾屏东县海域5.1级地震,中国地震台网正式测定：4月11日21时47分在台湾屏东县海域（北纬21.62度，东经120.97度）发生5.1级地震，震源深度18千米。,地震,https://news.cctv.com/2022/04/11/ARTIKOvqx2owgOEyZ2AgBYnP220411.shtml
2022-04-11 21:59:54,纪录片《绝笔》：红色特工,2022年清明之际，中央广播电视总台华语环球节目中心于4月4日—11日每周一至周五20:00档，推出六集专题纪录片《绝笔》（第二季），重温、解读十四位共产党员的绝笔，展现一批批革命先烈献身中国革命、追求崇高信仰的牺牲精神。,纪录片《绝笔》,https://news.cctv.com/2022/04/11/ARTI8YgXGrA5jrI8QOTj68F9220411.shtml
2022-04-11 21:54:02,海南三亚明日开展第七轮区域核酸检测,据“三亚发布”微信公众号，4月11日晚，三亚市新型冠状病毒肺炎疫情防控工作指挥部发布通告称，根据三亚市疫情防控形势，市疫情防控指挥部决定，于4月12日07:00至13:00在三亚市中心城区开展第七轮区域核酸检测。,海南三亚,https://news.cctv.com/2022/04/11/ARTI0zwbLb6NVMmUgta0OnHL220411.shtml
2022-04-11 21:53:43,焦点访谈：战“疫”中的中医药力量,最近，世界卫生组织在官网发布了《世界卫生组织中医药救治新冠肺炎专家评估会报告》，这份报告是今年2月底3月初“世界卫生组织中医药救治新冠肺炎专家评估会”在线召开后，来自世卫组织的国际专家评估形成的。两年多来，中医药全面参与疫情防控救治，显示出了独特优势，成为抗击新冠肺炎疫情“中国方案”的一大特色。,焦点访谈,https://news.cctv.com/2022/04/11/ARTIMEnLMUJr5MdXFqdfrRqc220411.shtml
2022-04-11 21:15:17,第17期！总台周看点,第17期！总台周看点。,总台周看点 央视网 资讯,https://news.cctv.com/2022/04/11/ARTIL6N6hLwLpZduNYbwSkGA220411.shtml
2022-04-11 21:05:23,杭州一工地多人确诊负责人被立案,4月8日至今，余杭区良渚一工地多人被确诊为新冠肺炎阳性病例。经公安机关调查，2022年3月以来，该工地负责人周某某未落实疫情防控主体责任，执行防疫措施不到位。目前，周某某因涉嫌妨害传染病防治罪，已被杭州市公安局余杭区分局依法立案调查。,杭州 立案,https://news.cctv.com/2022/04/12/ARTIoiwik7ez09JPTskGXEMy220411.shtml
2022-04-11 21:02:59,证监会、国资委、全国工商联发布关于进一步支持上市公司健康发展的通知,证监会、国资委、全国工商联发布关于进一步支持上市公司健康发展的通知。,国资委 全国工商联 证监会,https://news.cctv.com/2022/04/11/ARTIc6REIYEPZXGAIZnZPVCT220411.shtml
2022-04-11 20:45:16,一季度物价保持平稳，未来走势如何？,全球通胀压力下，中国物价继续保持平稳运行。国家统计局11日发布数据，今年1至3月平均，全国居民消费价格指数（CPI）比上年同期上涨1.1%。专家分析，2022年全年CPI涨幅或将比去年有所扩大，但仍将处在合理区间。,物价涨幅 未来走势,https://news.cctv.com/2022/04/11/ARTIY18vFvuI7uMslMuAWzJl220411.shtml
2022-04-11 20:41:18,我国将加大涉外仲裁人才培养力度,司法部、教育部、科技部、国务院国资委等部门近日印发通知，要求进一步做好涉外仲裁人才培养项目实施工作，到2025年，建立起与国际通行仲裁制度相适应的涉外仲裁人才培养体系。,人才培养 人才支撑,https://news.cctv.com/2022/04/11/ARTIcNVXws4B8Mhja3b1udsr220411.shtml
2022-04-11 20:18:52,国家新闻出版署公布4月份国产网络游戏审批信息，共45款游戏,国家新闻出版署公布2022年4月份国产网络游戏审批信息，共45款游戏。,国产网络游戏 国家新闻出版署 审批,https://news.cctv.com/2022/04/11/ARTIybGGhIdlkuWJ28KQAU22220411.shtml
2022-04-11 20:14:23,各地从严从实精准防控,各地从严从实精准防控，快速有效处置局部地区聚集性疫情，统筹好疫情防控与经济社会发展。,从严从实 精准防控 经济社会发展,https://news.cctv.com/2022/04/11/ARTIvDq4VR6L6WlXDfqQ5gxq220411.shtml
2022-04-11 20:11:16,坚持动态清零 上海落实分类差异化防控举措,上海落实各项分区分类差异化防控举措，推动动态清零目标尽早实现。,动态清零 上海 差异化,https://news.cctv.com/2022/04/11/ARTIiN6W294gBukHA6gDl0cc220411.shtml
2022-04-11 20:00:24,抢抓农时 各地春耕春播春管有序推进,不负春光，不误农时。眼下，各地春耕春播春管工作正平稳、有序、高效推进。,不负春光 不误农时 春耕春管,https://news.cctv.com/2022/04/11/ARTIWscBeKTP4IkDvj5Ha8Wf220411.shtml
2022-04-11 19:57:46,全国人大常委会启动科学技术普及法执法检查,全国人大常委会科学技术普及法执法检查组第一次全体会议11日在京召开，检查组将于4月至6月赴多省份开展实地检查，同时委托部分省人大常委会同步对本行政区域内科学技术普及法的实施情况进行检查。,全国人大 检查组 科学技术普及法,https://news.cctv.com/2022/04/11/ARTIailQG4nPcu7ifb37ieq0220411.shtml
2022-04-11 19:55:19,中办国办印发《关于推进新时代古籍工作的意见》,中共中央办公厅、国务院办公厅近日印发《关于推进新时代古籍工作的意见》。,中办 国办 古籍工作,https://news.cctv.com/2022/04/11/ARTIxeWciRsnCdwEQvu2HMVA220411.shtml
2022-04-11 19:48:53,【奋进新征程 建功新时代·伟大变革】基础教育为民族复兴筑牢稳固根基,百年大计，教育为本。基础教育事关国家发展、民族未来。,新征程 新时代 伟大变革,https://news.cctv.com/2022/04/11/ARTIkau9ofLakDX9FbI23Sph220411.shtml
2022-04-11 19:12:41,农业农村部：统筹做好新冠肺炎疫情防控和畜牧业稳产保供工作,《通知》强调，要保障畜牧业生产资料运输畅通，严格禁止随意设卡拦截、断路封路，涉疫封控地区要因地制宜设置物资中转接驳点，保障仔畜雏禽及种畜禽、饲料、兽药等生产资料物流畅通，防止出现断料断药和生产断档情况。,农业农村部 疫情防控 畜牧业,https://news.cctv.com/2022/04/11/ARTIROO1bGQOCCV25tUPKzfF220411.shtml
2022-04-11 18:17:07,河南漯河一地划定为中风险地区,自4月11日起，划定郾城区海河路沙澧文景苑小区为中风险地区。,疫情 通告 疫情防控,https://news.cctv.com/2022/04/11/ARTIO5v5PmiRJKzfPO4ujPu6220411.shtml
2022-04-11 18:03:18,国务院应对新型冠状病毒感染肺炎疫情联防联控机制：切实做好货运物流保通保畅工作,各地区和有关部门要迅速启动部省站三级调度、路警联动、区域协调的保通保畅工作机制，加强路网监测调度，及时解决路网阻断堵塞等问题，确保交通主干线畅通。,物资 高速公路服务区 接驳点,https://news.cctv.com/2022/04/11/ARTIqNpfQ76fju5qgjobDrML220411.shtml
2022-04-11 17:58:21,鉴往知来，跟着总书记学历史丨从边陲海岛到改革开放重要窗口,南海之滨，千帆竞发，改革的浪潮奔涌不息。,鉴往知来 总书记 海南,https://news.cctv.com/2022/04/11/ARTI4aIsmcxfwEHtU1vuCHKd220411.shtml
2022-04-11 17:49:37,国家统计局：2022年3月份CPI同比上涨1.5% 环比持平,2022年3月份，全国居民消费价格同比上涨1.5%。其中，城市上涨1.6%，农村上涨1.2%；食品价格下降1.5%，非食品价格上涨2.2%；消费品价格上涨1.7%，服务价格上涨1.1%。1—3月平均，全国居民消费价格比上年同期上涨1.1%。,CPI 环比 畜肉类 食品价格 涨跌幅 四舍五入 鲜菜价格 消费品价格 水产品价格 教育文化,https://news.cctv.com/2022/04/11/ARTI40zNZi5MctkbjMT2EpHo220411.shtml
2022-04-11 17:48:43,刚刚，民航局回应东航失事客机传言！,“3·21”东航MU5735航空器飞行事故目前还在调查中，还不能给事故原因和性质下结论。各方将尽全力尽快查明事故原因，依法依程序发布有关信息。,民航局 东航 客机 公安机关 传言 3·21 事故原因 副驾驶 飞行人员 心理健康,https://news.cctv.com/2022/04/11/ARTI22SERLzkLhOsPwSLDCPI220411.shtml
2022-04-11 17:47:35,【组图】“守沪者联盟”丨江西永丰：第二批支援蔬菜即将运抵上海,2022年4月11日，在江西省吉安市永丰县农副产品商贸物流中心，党员干部、志愿者和义工们将新鲜蔬菜进行分拣、包装，准备当日运往上海。,物流中心 党员干部 图片来源 永丰县 农副产品 新鲜蔬菜 摄影师 上海 芦笋 空心菜,https://news.cctv.com/2022/04/11/ARTI4A748Yl1m0azXGvyr8EO220411.shtml
2022-04-11 17:46:25,张伯礼：坚持“动态清零” 不动摇不犹豫,4月11日，天津市增派由78名医务人员组成的中医医疗队驰援上海，中国工程院院士张伯礼在医疗队出发现场嘱托队员，要发挥中医药优势开展救治，坚持“动态清零”不动摇、不犹豫。,张伯礼 中医药救治 医疗队 动态清零 方舱 院感 中医医疗机构 队员 急诊 儿科,https://news.cctv.com/2022/04/11/ARTIqv90oHTckAUCOpYMjkKO220411.shtml
2022-04-11 17:45:11,新华全媒+丨不负春光，这些重点工程“进度条”刷新,一批重点工程的建设“进度条”不断刷新。,进度条 拍摄 输变电工程项目 重点工程 机组 水电站 棠园 两河口 核电 雅砻江,https://news.cctv.com/2022/04/11/ARTImKtuGxdrG7RPUezbp5tW220411.shtml
2022-04-11 17:39:57,一季度我国汽车产销量同比稳步增长,记者11日从中国汽车工业协会获悉，1至3月我国汽车产销量分别达648.4万辆和650.9万辆，同比分别增长2%和0.2%，一季度我国汽车产销量持续同比稳步增长。,一季度 汽车 产销量,https://news.cctv.com/2022/04/11/ARTI0bHn0rhDLaaU26UKsl2T220411.shtml
2022-04-11 17:26:25,芜湖鸠江区在查获冷冻带鱼中检测出阳性样本,4月10日夜，鸠江区接外地协查函后，立即对位于四褐山农贸市场的鸠江区某冷冻经营部进行排查，现场共采样14份，其中人员2份、物品12份，检测结果显示一组带鱼呈弱阳性，其余样本均为阴性。,冷冻 鸠江区 防控,https://news.cctv.com/2022/04/11/ARTI6KfokdjcqUhwVkL6kB7m220411.shtml
2022-04-11 17:21:10,国家卫健委、教育部制定《高等学校、中小学校和托幼机构新冠肺炎疫情防控技术方案（第五版）》,国家卫健委发布《高等学校、中小学校和托幼机构新冠肺炎疫情防控技术方案（第五版）》。,校园 疫情防控 常态化,https://news.cctv.com/2022/04/11/ARTILwDdfAztkaFuDqmPEOFr220411.shtml
2022-04-11 17:15:59,山东邹平市一地明起调整为低风险区,根据国务院联防联控机制有关规定，经综合评估研判，滨州市委统筹疫情防控和经济运行工作领导小组(指挥部)办公室研究决定，自2022年4月12日0时起，将邹平市黄山街道办事处张山村高风险区调整为低风险区。,风险区 邹平市,https://news.cctv.com/2022/04/11/ARTI23b7ig2xDuSZHn3TQLYe220411.shtml
2022-04-11 17:14:13,时政现场说丨总书记和海洋科教工作者共话海洋强国,2022年4月10日，习近平总书记在海南省三亚市考察中国海洋大学三亚海洋研究院，了解发展海洋科技等情况。,习近平,https://news.cctv.com/2022/04/11/ARTISIJbxmtYMVhMhUx7ILwP220411.shtml
2022-04-11 17:12:37,时政现场说丨为未来育种！端牢中国饭碗,2022年4月10日下午，习近平总书记来到了崖州湾种子实验室，了解海南支持种业创新的相关情况。,时政现场说 中国饭碗,https://news.cctv.com/2022/04/11/ARTIoJyY1rSo9YaxEIdCC8dz220411.shtml
2022-04-11 17:11:51,文旅部：进一步调整暂退旅游服务质量保证金相关政策,4月11日，文化和旅游部办公厅印发《关于进一步调整暂退旅游服务质量保证金相关政策的通知》。,旅游服务质量,https://news.cctv.com/2022/04/11/ARTIN3LtKNMpYNd57o5HuUuN220411.shtml
2022-04-11 17:08:49,发挥好党史立德树人的重要作用（新知新觉）,习近平总书记指出：“要用好学校思政课这个渠道，推动党的历史更好进教材、进课堂、进头脑，发挥好党史立德树人的重要作用。”,党史 立德 历史思维 思想政治理论课 树人 新媒体 思政 精品课程 新知 校园文化建设,https://news.cctv.com/2022/04/11/ARTIMxrnw2PZs2bMfvpym28z220411.shtml
2022-04-11 17:08:03,“力戒形式主义、官僚主义”（人民论坛）,一段时间以来，各地各部门深化整治形式主义、官僚主义，引导党员、干部把时间精力投入到干事创业中，凝聚起实干兴邦正能量。,官僚主义 真抓实干 力戒形式主义 政绩观 爬楼 面子 里子 taggedby 办实事 hylanda,https://news.cctv.com/2022/04/11/ARTIr2xPidq2Vl83YWT97e7x220411.shtml
2022-04-11 17:06:58,以伟大自我革命引领伟大社会革命（人民观点）,党的十八大以来，全面从严治党取得了历史性、开创性成就，产生了全方位、深层次影响，探索出依靠党的自我革命跳出历史周期率的成功路径。,社会革命 马克思主义政党 从严治党 历史自觉 奋进历程 革命精神 自我完善 伟大实践 党要管党 自我提高,https://news.cctv.com/2022/04/11/ARTI7U1ykMe39vbfPQRi69t2220411.shtml
2022-04-11 17:05:51,昌都：天更蓝、水更清、家园更美好……,昌都：天更蓝、水更清、家园更美好……,增值电信业务 昌都 千龙 版权所有 网络传播 镜像 经营许可证 有限责任公司 新闻网 书面,https://news.cctv.com/2022/04/11/ARTIagPQS8MruYtF9HYSpZy0220411.shtml
