version_date,title,brief,keyword,url
2022-05-27 09:02:00,国家卫健委：昨日新增本土确诊病例80例、本土无症状感染者274例,5月26日0—24时，31个省（自治区、直辖市）和新疆生产建设兵团报告新增确诊病例102例。,确诊病例 感染者,https://news.cctv.com/2022/05/27/ARTIKUNK45EFjvHuAObjSPhX220527.shtml
2022-05-27 08:49:04,吉林省5月26日新增本土确诊病例2例、本土无症状感染者5例,5月26日0-24时，全省新增本地确诊病例2例（轻型），均在延边州；新增本地无症状感染者5例，其中通化市2例，白山市2例，延边州1例。,吉林省 感染者 确诊,https://news.cctv.com/2022/05/27/ARTIvx6WzOtQ1jZUDhcNzcYk220527.shtml
2022-05-27 08:30:41,河南5月26日新增本土无症状感染者8例 其中许昌市7例、开封市1例,5月26日0—24时，河南省新增本土无症状感染者8例（许昌市7例、开封市1例），无新增本土确诊病例和疑似病例。,感染者 无症状 本土,https://news.cctv.com/2022/05/27/ARTI3wxhRkxgUJLbW5XdgnST220527.shtml
2022-05-27 08:07:21,辽宁5月26日新增9例本土无症状感染者，均为丹东市报告,5月26日0—24时，辽宁省无新增新冠肺炎确诊病例；新增9例本土无症状感染者，均为丹东市报告。,感染者 无症状 确诊病例,https://news.cctv.com/2022/05/27/ARTIgvFdNL2K5qr6v2xRmeOt220527.shtml
2022-05-27 08:06:33,天津5月26日新增本土确诊病例6例、本土无症状感染者3例,5月26日0时至24时，天津市疾控部门报告9名本土新冠病毒核酸检测阳性感染者。其中，确诊病例6例，无症状感染者3例。,感染者 无症状 确诊病例,https://news.cctv.com/2022/05/27/ARTIdlV0dntleyyyiXnjScZg220527.shtml
2022-05-27 08:00:13,【8点见】杂志社回应儿童绘本舔汗配图争议,杂志社回应儿童绘本舔汗配图争议：正了解具体情况。,杂志社 儿童绘本 舔汗配图,https://news.cctv.com/2022/05/27/ARTIg2wwJUz4mdNOMFgyAHOG220526.shtml
2022-05-27 07:27:36,遇见习近平丨他是一个爱国者，把自己的一生都献给了这个国家,近日，国家主席习近平回信美国艾奥瓦州友人。这封跨越太平洋的信件饱含着习近平与艾奥瓦州的老朋友们37年的深情厚谊。,习近平 回信,https://news.cctv.com/2022/05/27/ARTIpE7ulIsESRmmF0CrFT9T220527.shtml
2022-05-27 07:10:09,郑州地铁5号线全线车站今起恢复运营服务,根据《郑州市新冠肺炎疫情防控指挥部办公室关于调整封控管控区域及疫情防控措施的通告》（2022年107号）5月27日起，郑州地铁5号线冯庄站、京广南路站、齐礼阎站恢复正常运营服务。至此，5号线全线车站恢复正常运营服务。,运营服务 车站 地铁,https://news.cctv.com/2022/05/27/ARTIwMuHx8WPqsd5DicJW0FC220527.shtml
2022-05-27 04:13:55,中国检方对罪错未成年人最大限度“少捕慎诉慎押”,记者26日从中国最高人民检察院获悉，2021年，检察机关开展涉罪未成年人羁押必要性审查数是2020年的4.8倍，纠正混管混押人数是2020年的5.8倍。,未成年人 刑事执行,https://news.cctv.com/2022/05/27/ARTIEH6DwO6JmQM3ieSgcTD7220527.shtml
2022-05-26 23:41:57,国务院部署四方面13项举措，力促外贸保稳提质,外贸是拉动经济增长的“三驾马车”之一，对于稳经济促发展发挥着重要作用。近日，国务院办公厅印发《关于推动外贸保稳提质的意见》，明确四方面13项举措。这些举措传递出怎样的信号？外贸企业会如何受益？如何抓好落地实施？记者采访权威专家进行解读。,外贸政策 外贸业务,https://news.cctv.com/2022/05/26/ARTIvftIef4z2HFwm3rHoxVR220526.shtml
2022-05-26 23:29:27,焦点访谈：你的守护 我的平安,全国公安系统英雄模范立功集体表彰大会25日上午在北京举行，全国公安系统982个先进单位和1485名先进个人受到了表彰。他们中有在极端恶劣的自然环境里守护天路的交警，有隐姓埋名和毒贩勇敢周旋的缉毒警，也有用自己日复一日的细致工作服务群众的社区民警。今天我们就一起来看看他们的故事。,焦点访谈 人民公安,https://news.cctv.com/2022/05/26/ARTIChNmewr7nHYWYwNQK8Il220526.shtml
2022-05-26 21:58:29,李希当选为广东省委书记,5月26日，中国共产党广东省第十三届委员会第一次全体会议在广州召开。,李希 广东省委书记,https://news.cctv.com/2022/05/26/ARTIXjdrRLzkeutIxZvFo2kk220526.shtml
2022-05-26 21:15:04,时政现场说丨做好“送上门来的群众工作” 为人民群众排忧解难,第九次全国信访工作会议25日至26日在京召开。25日上午，习近平等来到人民大会堂北大厅，亲切会见会议代表，向受表彰的先进集体和先进个人表示热烈祝贺，向全国信访系统广大干部职工表示诚挚问候。,时政现场说 习近平,https://news.cctv.com/2022/05/26/ARTIikOzfruqoqr7x4dQOBX9220526.shtml
2022-05-26 20:32:21,市场监管总局点名月饼粽子过度包装问题 包装最多不得超三层,商品过度包装已偏离商品本质属性，不仅造成资源浪费，而且影响良好社会风尚。严格混装要求，规定月饼不应与其他产品混装，粽子不应与超过其价格的其他产品混装。,粽子 过度包装,https://news.cctv.com/2022/05/26/ARTIYrhG8yzibgw1vrNpHBuY220526.shtml
2022-05-26 20:28:59,三部门：完善汇率避险产品服务 提升人民币跨境结算便利性,据国家外汇管理局网站26日消息，商务部、中国人民银行、国家外汇管理局印发《关于支持外经贸企业提升汇率风险管理能力的通知》，要求完善汇率避险产品服务，进一步提升人民币跨境结算的便利性。,跨境 产品服务,https://news.cctv.com/2022/05/26/ARTILCe9MD6MOfrYIiieAqvu220526.shtml
2022-05-26 20:15:49,上海优化防控举措 有序复学复工,昨天（5月25日），上海本土确诊病例出院344例，解除医学观察的无症状感染者3926例。,上海市 疫情防控,https://news.cctv.com/2022/05/26/ARTIWX7waXCCyDg8RQ34uFl5220526.shtml
2022-05-26 20:13:15,全国交通网络总体通畅,今天（5月26日），交通运输部举行新闻发布会介绍物流保通保畅进展情况。目前，全国查验不劝返、检测不等待、核酸不重检、政策不加码等车辆通行要求总体落实到位。全国交通网络总体通畅。,全国 交通网络 总体通畅,https://news.cctv.com/2022/05/26/ARTIsZNANJdM3Z3K1aYS2ZdU220526.shtml
