version_date,title,brief,keyword,url
2022-05-13 20:45:30,人民论坛网评 | 踔厉奋发当好青春奋斗路上的“领跑者”,奋斗者正青春，只有不断追求进步，勇于努力奋斗，青春才能开出璀璨花朵。广大青年应在不断追求进步中彰显出青春特质，在青春的赛道上踔厉奋发，努力答好“领跑题”，交出“高分卷”。,领跑者 网评 人民论坛 人民利益 青春梦 理想信念 公心 戒尺 中国特色社会主义 赛道,https://news.cctv.com/2022/05/13/ARTIZpXCCdjISVkbHwvGkJy9220513.shtml
2022-05-13 20:44:46,辩证把握“四对”关系 科学推进“双碳”工作,当前我国已进入新发展阶段，必须充分认识实现“双碳”目标的紧迫性和艰巨性，既要坚定信心迎难而上，又要脚踏实地扎实推进，辩证把握好“四对”关系，确保如期实现“双碳”目标。,低碳 四对 双碳 碳排放 高碳 全局 双控 工作的意见 化石能源 经济结构,https://news.cctv.com/2022/05/13/ARTI7Tx0RIEj9l9Go97bA7wi220513.shtml
2022-05-13 20:43:49,广州白云机场常态化运行 南航大幅恢复在穗国内航班,广州白云国际机场5月13日通报，目前广州白云国际机场已实现常态化运行，当日机场计划起降航班300架次，总体运行平稳有序。中国南方航空13日也大幅恢复在穗国内航班，当天计划在广州白云国际机场保障国内进出港航班61班次。,广州白云国际机场 国内航班 常态化 南航 机场方面 广州白云机场 核酸检测 运行平稳 航站楼 大幅,https://news.cctv.com/2022/05/13/ARTI15VjaPkUhyrMnvYSiJUC220513.shtml
2022-05-13 20:42:48,把数字技术广泛应用于政府管理服务（评论员观察）,加强数字政府建设，是贯彻以人民为中心发展思想的必然要求，也是增强数字政府效能的必然选择。,数字政府 政府职能转变 服务人民 政府供给 政府治理理念 应用系统 数字技术 履职能力 广泛应用 东风,https://news.cctv.com/2022/05/13/ARTIirag6CJWEL5b32LrA8XK220513.shtml
2022-05-13 20:20:33,上海：淮海中路上的抗疫小分队,在上海，广大医护工作者奋战在抗疫一线，坚持坚守，助力打赢大上海保卫战。今天（5月13日）我们就去认识一支淮海中路上的抗疫小分队。,上海 淮海中路 抗疫小分队,https://news.cctv.com/2022/05/13/ARTINuIYk7gK9HO2pUo5d6fI220513.shtml
2022-05-13 20:05:29,4786亿！中国公布今年使用外资数据，有力驳斥“外资撤离”怪论,中国商务部12日发布的数据显示，今年前4个月，中国实际使用外资金额4786.1亿元人民币，同比增长20.5%。,SEB 外资银行 中国德国商会 环球时报 商报 定心丸 南德意志报 外商投资法 供应链 怪论,https://news.cctv.com/2022/05/13/ARTIueeX3ysLcAWBV2t4u7HC220513.shtml
2022-05-13 20:05:12,“把光荣镌刻在历史行进的史册里”——记习近平总书记出席庆祝中国共产主义青年团成立100周年大会,百年征程、百年跋涉。一脉相承的，是一代代青年对国家的爱始终炽热，是推动时代前行的青春脚步坚定而执着。庆祝大会上，习近平总书记语重心长：“千百年来，青春的力量，青春的涌动，青春的创造，始终是推动中华民族勇毅前行、屹立于世界民族之林的磅礴力量！”,习近平,https://news.cctv.com/2022/05/13/ARTIuSOrNMcPEmX8MTDa6MPw220513.shtml
2022-05-13 20:04:31,国家税务总局发布《2022年新的组合式税费支持政策指引》,国家税务总局发布《2022年新的组合式税费支持政策指引》。,国家税务总局,https://news.cctv.com/2022/05/13/ARTIAs3QV2Ykf2dwiy7zs1ox220513.shtml
2022-05-13 20:03:17,上海：毫不松懈 把各项防控措施落实到位,昨天（5月12日），上海本土确诊病例出院414例，解除医学观察的无症状感染者6360例。,防控措施 上海,https://news.cctv.com/2022/05/13/ARTIWCxXP9Uwk2SqpJHM5N8H220513.shtml
2022-05-13 20:02:02,上海：毫不松懈 把各项防控措施落实到位,昨天（5月12日），上海本土确诊病例出院414例，解除医学观察的无症状感染者6360例。,上海 防控措施,https://news.cctv.com/2022/05/13/ARTI0p2LAwOdkL0TKZAP7srm220513.shtml
2022-05-13 19:58:00,【新闻特写】淮海中路上的抗疫小分队,在上海，广大医护工作者奋战在抗疫一线，坚持坚守，助力打赢大上海保卫战。今天（5月13日）我们就去认识一支淮海中路上的抗疫小分队。,新闻特写 抗疫小分队,https://news.cctv.com/2022/05/13/ARTIyE8QrLBCF2Q99ppKl4RR220513.shtml
2022-05-13 19:54:06,自贸试验区带动高水平对外开放,今年以来，全国21个自贸试验区外资外贸实现快速增长，引领特色产业集聚，带动高水平对外开放。,自贸试验区 高水平对外开放,https://news.cctv.com/2022/05/13/ARTIpEqn15g5UcIGtLVMsvZj220513.shtml
2022-05-13 19:49:41,【稳中求进看开局·权威访谈】稳定宏观经济大盘 推动经济高质量发展,今年以来，我国内外环境复杂多变、挑战增多，中国经济顶住压力，实现平稳开局。如何看待当前及未来经济走势，实现经济稳中有进，来看本台记者对国家统计局党组成员、副局长盛来运的专访。,权威访谈 高质量发展,https://news.cctv.com/2022/05/13/ARTI2vna3RIe3Vjwxbrz7o54220513.shtml
2022-05-13 19:46:00,【奋进新征程 建功新时代·伟大变革】打造创新高地 加速迈向科技强国,习近平总书记指出，中国要强盛、要复兴，就一定要大力发展科学技术，努力成为世界主要科学中心和创新高地。党的十八大以来，在以习近平同志为核心的党中央坚强领导下，我国科技创新空间布局持续优化，创新高地加速崛起，创新成果竞相涌现，不断推动我国高质量发展。,创新高地 科技强国,https://news.cctv.com/2022/05/13/ARTIoTOuUiurrvcNmyiiWa7i220513.shtml
2022-05-13 19:30:38,证监会发布《证券公司科创板股票做市交易业务试点规定》,证监会发布《证券公司科创板股票做市交易业务试点规定》。,证券公司 证监会,https://news.cctv.com/2022/05/13/ARTIOin9JWatg1zhNySmhcKo220513.shtml
2022-05-13 19:13:49,湖南省常德市委原书记杨懿文严重违纪违法被开除党籍、开除公职,日前，经湖南省委批准，湖南省纪委监委对常德市委原书记杨懿文严重违纪违法问题进行了立案审查调查。,违纪违法 开除党籍,https://news.cctv.com/2022/05/13/ARTIhvW5ndjAEIBJobDyp7uo220513.shtml
2022-05-13 19:13:43,习近平同克罗地亚总统就中克建交30周年互致贺电 李克强同克罗地亚总理互致贺电,国家主席习近平5月13日同克罗地亚共和国总统米拉诺维奇互致贺电，庆祝两国建交30周年。,习近平,https://news.cctv.com/2022/05/13/ARTI2HxfORgiSQOPNyyDqBjg220513.shtml
2022-05-13 19:07:02,中国银保监会印发《关于银行业保险业支持城市建设和治理的指导意见》,为深入贯彻落实习近平总书记“人民城市人民建，人民城市为人民”重要理念，引导银行业保险业立足新发展阶段、完整、准确、全面贯彻新发展理念，服务新发展格局，更好支持城市建设和治理，近日中国银保监会印发《关于银行业保险业支持城市建设和治理的指导意见》（以下简称《指导意见》)，引导银行业保险业更好推动社会主义现代化城市建设。,中国银保监会,https://news.cctv.com/2022/05/13/ARTIn2aJc575nsOwmM70iv0h220513.shtml
2022-05-13 18:31:22,帮扶中小微企业 | 一系列政策“组合拳”助力减负稳岗,昨天（5月12日）国新办举行政策吹风会，人社部、国家税务总局相关负责人对近日发布的《关于做好失业保险稳岗位 提技能 防失业工作的通知》进行了详细解读。,中小微企业 组合拳,https://news.cctv.com/2022/05/13/ARTI19dw7vVCkOdk8oJCzF89220513.shtml
