version_date,title,brief,keyword,url
2022-04-15 17:32:53,上海：这里的“蓝色骑士”打通居民物资运输的“最后一百米”,在当前疫情管控下，居民按要求“足不出户”，但是居民们的生活物资该如何配送？近日，上海市普陀区长征镇象源丽都出现了一群“蓝色骑士”，他们骑着“小电驴”穿梭于社区的各个角落，打通居民物资运输的“最后一百米”。,蓝色骑士 物资运输 居民 最后一百米 物业 配送 长征镇 运力 核酸 楼栋,https://news.cctv.com/2022/04/15/ARTIx22yGm8hgUmrGMa5tXPK220415.shtml
2022-04-15 17:31:22,数据图解丨海南：加快建设具有世界影响力的中国特色自由贸易港,2018年4月13日，庆祝海南建省办经济特区30周年大会召开。大会指出，要赋予海南全面深化改革开放新的历史使命，支持海南逐步探索、稳步推进中国特色自由贸易港建设。,自由贸易 海南 中国特色 改革开放 全面推进 数据 历史使命 建设 影响力 2018年,https://news.cctv.com/2022/04/15/ARTIOTYRj7HgVUknmXa3xOV1220415.shtml
2022-04-15 17:29:05,把海南自由贸易港打造成展示中国风范的靓丽名片,4月10日至13日，中共中央总书记、国家主席、中央军委主席习近平来到海南，深入科研单位、国家公园、黎族村寨、港口码头等进行调研，对海南各项工作取得的成绩给予肯定，希望海南以“功成不必在我”的精神境界和“功成必定有我”的历史担当，把海南自由贸易港打造成展示中国风范的靓丽名片。,自由贸易 风险防控 一体化协调发展 生态立省 推进义务教育均衡发展 黄玉荣 推进党 港大 从严治党 优质教育资源,https://news.cctv.com/2022/04/15/ARTI6rN9yBxxnUOpTnpkJjWZ220415.shtml
2022-04-15 17:26:40,开启新时代高素质专业化创新型教师队伍建设新征程,日前，教育部等八部门联合印发《新时代基础教育强师计划》（以下简称《强师计划》），教育部教师工作司负责人就相关问题回答了记者提问。,高素质教师 教育强国 教师发展 师德师风建设 高质量教师 教育教学能力 教师专业发展 公共教育服务 教师队伍建设 教师教育,https://news.cctv.com/2022/04/15/ARTIaLPHfilfr0dpjpJwYX2F220415.shtml
2022-04-15 17:24:58,以数字技术赋能乡村振兴,数字乡村是乡村振兴的战略方向，也是建设数字中国的重要内容。“十四五”规划和2035年远景目标纲要提出“加快推进数字乡村建设”，2022年中央一号文件强调“大力推进数字乡村建设”。大力推进数字乡村建设，以数字技术赋能乡村振兴，有利于充分发挥信息化对乡村振兴的驱动作用，提升农业农村现代化水平。,乡村治理 乡村建设 中央一号文件 赋能 新媒体 数字技术 农民 新知 加快农村 十四五,https://news.cctv.com/2022/04/15/ARTIyennkJFoNH8fhlMkL0rn220415.shtml
2022-04-15 17:22:05,春耕备耕自动巡地·田长管地·托管用地——安徽探索耕地保护新举措观察,"耕地是粮食生产的""命根子""。高清摄像头24小时360度自动巡地、省市县乡村五级田长合力管地、土地集中托管让荒地变良田……记者近日在产粮大省安徽走访发现，该省积极探索耕地保护新举措，遏制乱占耕地现象，坚决守住耕地保护红线和粮食安全底线。",耕地保护 冬闲田 托管 长制 农业生产 麦苗 麦田 农技 高清摄像头 良田,https://news.cctv.com/2022/04/15/ARTIhUHSBWtJQZyZLeXQ76DP220415.shtml
2022-04-15 17:17:31,农业农村部：做好今年高素质农民培育工作，全面保障稳粮扩油和“菜篮子”产品稳定供给,全面保障稳粮扩油和“菜篮子”产品稳定供给。聚焦关键环节推进高质量发展。加强良种识别、选购和消费者权益保护等方面的培训，指导农民科学用种。支持农民提升受教育水平。,农民培育 稳粮扩油 稳定供给,https://news.cctv.com/2022/04/15/ARTIW9MYRYb1W2wZ5bxoRWhm220415.shtml
2022-04-15 17:15:54,“种业硅谷”拔节生 洞庭依然鱼米乡,湖南自古就是农业大省，素有“九州粮仓”“鱼米之乡”的美誉。是全国重要的粮食主产区、生猪养殖和调出大省、全国“米袋子”“菜篮子”“油罐子”的重要阵地。,茶学专业 食葵 拔节 种业企业 鱼米乡 教师评价 洞庭 隆平高科 生物智能 种业硅谷,https://news.cctv.com/2022/04/15/ARTInUaTjLfIrvrEngFNjc3J220415.shtml
2022-04-15 17:15:32,山西清徐韵达快递物流园排查出的密接、次密接人员已全部转运隔离,目前，太原市排查出的密接、次密接人员已全部转运隔离，并对全市快递物流从业人员开展全面摸排。,山西清徐 韵达快递 转动隔离,https://news.cctv.com/2022/04/15/ARTIvZL8nHEOPQ44gtGmgrdK220415.shtml
2022-04-15 17:12:15,农业农村部实施“耕耘者”振兴计划 将培训超百万新农人,日前，农业农村部办公厅印发《关于实施“耕耘者”振兴计划的通知》，决定自2022年起在全国启动实施“耕耘者”振兴计划。面向乡村治理骨干和新型农业经营主体带头人开展免费培训，计划在2022年至2024年，线上培训100万人、线下培训10万人。,耕耘者 振兴计划 通知 风险防控 乡村治理 农业农村 培训机构 农人 培训对象 新探索,https://news.cctv.com/2022/04/15/ARTIpDlFwXmuez1hzHoacaYm220415.shtml
2022-04-15 17:11:02,海报|抢抓农时，分品种春耕春管有序推进,又是一年农忙时。当下，多部门多地多措并举，分品种施策，提升种植意向，落实种植面积，毫不放松抓好春耕春管。,春耕 品种 农时 海报 种植面积 毫不 事业部 出品 科普 制作,https://news.cctv.com/2022/04/15/ARTIyB8jyDvKdhm785vUh9u4220415.shtml
2022-04-15 17:09:32,冬奥闭环内累计诊疗2.2万人次 疫情防控高效有温度,冬奥期间，北京为各国运动员及涉奥人员提供了国际化、高质量、有温度的医疗服务：闭环内累计诊疗2.2万人次，其中运动员557人次；累计核酸检测340万人次，93.4%的阳性者在入境7日内检出。,冬奥闭环 诊疗 疫情防控,https://news.cctv.com/2022/04/15/ARTIcvmQgqsXD0I20lmlXk6U220415.shtml
2022-04-15 17:08:46,准确把握总体国家安全观的科学内涵,国家安全是国家发展的最重要基石、人民福祉的最根本保障。今年4月15日，是我国第七个全民国家安全教育日。我们要从总体国家安全观提出的时代背景，以及总体国家安全的基本特征、发展演进、丰富内容等方面进一步学习总体国家安全观，把总体国家安全观学深悟透，并贯彻落实到各项国家安全工作中。,国家安全观 国家安全 科学内涵 科学概念 准确把握 总体性 群众史观 中华人民共和国宪法 非传统安全 时代背景,https://news.cctv.com/2022/04/15/ARTIwEVzKHuacHZRRpBZfKDn220415.shtml
2022-04-15 17:05:36,习近平同毛里求斯总统鲁蓬就中毛建交50周年互致贺电,国家主席习近平4月15日同毛里求斯总统鲁蓬互致贺电，庆祝两国建交50周年。,习近平 毛里求斯 中毛建交,https://news.cctv.com/2022/04/15/ARTIzj6AyM0hATaklU8Ohf7j220415.shtml
2022-04-15 16:59:32,广东佛山：4月18日起中小学、幼儿园师生分期、分批、错峰返校,经市新冠肺炎防控指挥办同意，佛山市符合返校（园）条件的中小学阶段学校、幼儿园（托育机构）可以安排师生返校（园），现将有关事项通告如下。,返校 托育 幼儿园,https://news.cctv.com/2022/04/15/ARTIV5iR49DR24xTvfXpXhna220415.shtml
2022-04-15 16:59:12,【上海战疫录】他们在上海送菜，从凌晨到凌晨，一天几万斤,凌晨仍在配送订单的沪郊蔬菜基地工作人员，从四面八方驶来载满物资的车辆……在这个特殊时刻，有无数人在为保障上海的“菜篮子”而努力。,海战 上海菜 送菜 蔬菜基地 超长待机 大动脉 绿色通道 微循环 专业合作社 菜篮子,https://news.cctv.com/2022/04/15/ARTIczUf9Lz008ELiuEYWqTf220415.shtml
2022-04-15 16:57:52,上海市级层面已建6个方舱，近两日逾2万市民回家,出舱，回家！全市最大的方舱医院——国家会展中心（上海）方舱医院昨天迎来首批322名解除集中隔离医学观察的市民。“想衷心对这里的医护人员们说声‘谢谢，你们辛苦了！’”王先生和大家一道，提着消杀过的行李，登上了回家的公交车。,方舱 出舱 大白 医学观察 集中隔离 患者 医务人员 感染者 新型冠状病毒肺炎诊疗方案 出院,https://news.cctv.com/2022/04/15/ARTI7ePLE3uLRmjFPilLsSIU220415.shtml
2022-04-15 16:56:07,2022年4月15日24时起国内成品油价格按机制下调,自2022年4月15日24时起，国内汽、柴油价格（标准品，下同）每吨分别降低545元和530元。调整后，各省（区、市）和中心城市汽、柴油最高零售价格见附表。相关价格联动及补贴政策按现行规定执行。,油价,https://news.cctv.com/2022/04/15/ARTICtPn4Xl0aGtlhc4ZKIlj220415.shtml
2022-04-15 16:55:27,上海推进零售药店“应开尽开”，加快建立药品配送“绿色通道”,随着上海开始实施分区分类差异化防控，街头的零售药店正快速恢复元气。截至前天，全市已开零售药店1105家，另有1033家正逐步恢复营业。与此同时，上海正加快建立药品配送绿色通道，尽快将药品送至居民手中。,零售药店 绿色通道 仓库配送 药品零售 药品保障 街镇 通知 开药店 第三方物流企业 药监局,https://news.cctv.com/2022/04/15/ARTIcj5OpsBsFeL7CD7WnGW7220415.shtml
2022-04-15 16:54:24,为了配药路的顺畅，他们在行动,就诊配药，封控期群众最现实的“急难愁”之一。由于疫情防控，诸多医院和药房目前无法正常线下接诊运营。如何急群众所急，想方设法打通难点堵点，让配药之路更顺畅？,配药 药罐子 用药 二码 掉线 非常时期 老年患者 点位 药房 危急重症,https://news.cctv.com/2022/04/15/ARTIqWmDyMft3LANSywUWeGc220415.shtml
2022-04-15 16:52:15,发改委：10个国家数据中心集群带动投资超1900亿,15日，在国家发展改革委新闻发布会上，发改委高技术司副司长、一级巡视员孙伟介绍，今年以来，全国10个国家数据中心集群，带动各方面投资超过1900亿元。,发改委 国家数据中心 投资,https://news.cctv.com/2022/04/15/ARTIZEPlNsJLwzLHYffecBlJ220415.shtml
2022-04-15 16:47:43,新冠病毒不是“大号流感”，感染后哪些人群更易重症化？,根据新冠肺炎诊疗指南第九版，老年人的年龄圈定为大于60岁，这比第八版“大于65岁”扩大了范围。,新冠 重症化 晚期妊娠 气道反应性 不稳定心绞痛 病毒会 C反应蛋白 诊疗 大号流感 晚期肿瘤,https://news.cctv.com/2022/04/15/ARTIrw1a7rJ9lud21f5iF5QH220415.shtml
2022-04-15 16:45:36,民警骑电瓶车，为养老院购来200多盒“救命药”,瑞信养老院有110多位老人，实行封控以来，所有老人在护理人员的精心照料下都安然无恙，但绝大多数老人因患有高血压、心脏病、糖尿病等基础疾病，日常用药一天也不能停，而如今配药却成了困扰他们的难题。,民警 电瓶车 派出所 养老院老人 药物 配药 药品 药店 瑞信 曲阳路,https://news.cctv.com/2022/04/15/ARTIE04uG6Pdo6E0TKSp8ERe220415.shtml
2022-04-15 16:45:29,江苏射阳发现5例核酸阳性人员，划定封控区、管控区、防范区,射阳县新冠疫情联防联控指挥部通告，4月15日，射阳县海河镇在“应检尽检”人群筛查中发现1例核酸检测阳性人员，疫情发生后，立即启动应急响应，经流调溯源，在其密切接触者中筛查发现4例阳性人员，均转运至市公共卫生临床中心隔离治疗。,射阳 管控 疫情,https://news.cctv.com/2022/04/15/ARTI8QYYTq9FVmDslAAUHsUJ220415.shtml
2022-04-15 16:43:20,国家卫健委发布《妇幼保健机构医用设备配备标准》,国家卫健委近日发布推荐性卫生行业标准《妇幼保健机构医用设备配备标准》，该标准自2022年6月1日起施行。,妇幼保健 医用设备,https://news.cctv.com/2022/04/15/ARTIsJ9QSfdpAAKcSFXMtlwx220415.shtml
2022-04-15 16:42:12,一份药香，一丝暖意，一份担当，尽己全力~来自青浦方舱的故事,当全城“背水一战，团结抗疫”之时，医务工作者更是这条战线上冲锋在前的“战士”！,方舱 患者 疫情防控 战士 故事 疗效 中药汤剂 病情 中医专业 肺炎,https://news.cctv.com/2022/04/15/ARTI0XCKUNMGQsStKJ1hg7wk220415.shtml
2022-04-15 16:39:23,“动态清零”，要尽全力护佑每一个生命,两年多的抗疫实践，从多个侧面给出过注脚。最基本的一组数据是，新冠大流行两年，世界上人口最多的中国，却是新冠患者人数最少的国家，发病率、病死率在全球都是最低的。去年的数据，中国新冠患病率是美国的1/1678，病死率则是美国的1/606。而同时，中国平均每10万人拥有的ICU床位数是3.6张，大约是美国的1/10。,动态清零 生命至上 风险群体 护佑 新冠 中国道路 不确定性 病死率 发病率 病毒变异,https://news.cctv.com/2022/04/15/ARTI3JTSrSJ4CPXUh6oXt6yG220415.shtml
2022-04-15 16:36:55,证监会发布《上市公司投资者关系管理工作指引》,为贯彻落实新《证券法》和《国务院关于进一步提高上市公司质量的意见》(国发〔2020〕14号)，进一步规范上市公司投资者关系管理，证监会发布《上市公司投资者关系管理工作指引》（下称《指引》），自2022年5月15日起施行。,上市公司 证监会 投资者,https://news.cctv.com/2022/04/15/ARTIBoIccKhfL4zHxKIcTLye220415.shtml
