version_date,title,brief,keyword,url
2022-04-11 10:19:19,上海：昨天出院和解除隔离人数超3000例,2022年4月11日，上海举行本市疫情防控工作新闻发布会，会上，上海市卫生健康委主任邬惊雷表示，4月10日，我市新增914例新冠肺炎本土确诊病例和25173例本土无症状感染者。,核酸 感染者 确诊,https://news.cctv.com/2022/04/11/ARTIyhgfXTsoY30L3Tr7BnZw220411.shtml
2022-04-11 10:14:46,邯郸主城区及周边完成第三轮全员核酸检测，检出阳性1例,邯郸市疫情防控工作领导小组办公室通报，截至4月11日6时，邯郸市主城区（环城高速公路以内）及周边完成第三轮全员核酸检测，本次核酸检测累计采样1815049人次，检出阳性1例，已落实管控措施。,核酸 检测 疫情,https://news.cctv.com/2022/04/11/ARTIaAVgjwNI53AEtQWf4u58220411.shtml
2022-04-11 10:04:19,上海：近两日启动核酸筛查共采样2512万人 其中结果异常25996人,截至4月11日上午8时，共采样2512万人，已完成检测2152万人，其中结果异常25996人，目前还有一部分混管阳性人员的复检工作正在进行中。,上海 核酸筛查,https://news.cctv.com/2022/04/11/ARTIHMzwd8SkW8RHzmDLeqSs220411.shtml
2022-04-11 09:52:54,吉林市4月10日新增本土确诊病例66例、本土无症状感染者46例,4月10日0-24时，全市新增本土确诊病例66例。新增病例中，轻型64例，普通型2例。,吉林市 新增 感染者 病例,https://news.cctv.com/2022/04/11/ARTI28TBGongalGiJP056IhK220411.shtml
2022-04-11 09:43:07,江西4月10日新增本土确诊病例1例、本土无症状感染者19例,2022年4月10日0-24时，江西省新增本土确诊病例1例，在南昌市（隔离观察人员中发现），临床分型为轻型。,江西 病例 隔离 确诊,https://news.cctv.com/2022/04/11/ARTIZc04Z8DDt1uxFbPafwff220411.shtml
2022-04-11 09:42:53,广西：命河两岸花如海,在“世界长寿之乡”广西巴马瑶族自治县，命河景区700多亩油菜花悄然绽放。,命河 两岸 花海 广西 巴马,https://photo.cctv.com/2022/04/11/PHOAUqqtawMbLvLgSdofbKHq220411.shtml
2022-04-11 09:40:50,河南洛阳：“武皇”巡游王城公园,4月10日，河南省洛阳市王城公园举行“武皇赏花巡游”。,河南 洛阳 武皇 巡游 王城公园,https://photo.cctv.com/2022/04/11/PHOA6EHvoq2dZ5tBm3YG8khg220411.shtml
2022-04-11 09:38:19,抗疫志愿者里多了“洋面孔”,近日来，在海口许多核酸采样便民服务点，都能看到志愿者忙碌的身影，其中有一些“洋面孔”。,抗疫 志愿者 洋面孔 海口,https://photo.cctv.com/2022/04/11/PHOAIXvinZSnQz07QvoETzCc220411.shtml
2022-04-11 09:36:37,西藏向上海、吉林发送抗疫物资,4月10日，西藏自治区向上海市和吉林省支援的首批抗疫生活物资通过铁路正式发运。,西藏 上海 吉林 发送 抗疫物资,https://photo.cctv.com/2022/04/11/PHOAl3hSyBzWHaWMmPRWJW74220411.shtml
2022-04-11 09:35:17,上海部分商业网点恢复经营,近日，上海市政府要求在防范区，有限允许商业网点恢复经营，按照预约、限流原则开展经营活动。,上海 部分 商业网点 恢复 经营,https://photo.cctv.com/2022/04/11/PHOAenmkCGnq7aXnNnv46N0c220411.shtml
2022-04-11 09:33:59,国家统计局：2022年3月份工业生产者出厂价格同比上涨8.3% 环比上涨1.1%,2022年3月份，全国工业生产者出厂价格同比上涨8.3%，环比上涨1.1%；工业生产者购进价格同比上涨10.7%，环比上涨1.3%。一季度，工业生产者出厂价格比去年同期上涨8.7%，工业生产者购进价格上涨11.3%。,国家统计局 工业 出厂,https://news.cctv.com/2022/04/11/ARTITGblOQsS4xUbG85evg9i220411.shtml
2022-04-11 09:32:20,国家统计局解读：3月份CPI同比涨幅扩大　PPI同比涨幅继续回落,国家统计局今天发布了2022年3月份全国CPI（居民消费价格指数）和PPI（工业生产者出厂价格指数）数据。对此，国家统计局城市司高级统计师董莉娟进行了解读。,居民消费价格 国家统计局,https://news.cctv.com/2022/04/11/ARTIa3f3BOzjENWBCedAx1Rd220411.shtml
2022-04-11 09:31:14,国家统计局：3月份CPI同比增加1.5% 环比持平,2022年3月份，全国居民消费价格同比上涨1.5%。其中，城市上涨1.6%，农村上涨1.2%；食品价格下降1.5%，非食品价格上涨2.2%；消费品价格上涨1.7%，服务价格上涨1.1%。1—3月平均，全国居民消费价格比上年同期上涨1.1%。,国家统计局 CPI,https://news.cctv.com/2022/04/11/ARTIUhjk3sPaXDC93KUExweV220411.shtml
2022-04-11 09:28:36,中国最冷小镇迎来入春以来最大降雪,10日，受冷空气影响，“中国最冷小镇”黑龙江省大兴安岭地区呼中区迎入春以来最大降雪。,中国 入春 最大降雪 呼中,https://photo.cctv.com/2022/04/11/PHOACbwQ5Cs0MHz1am6bX6Ex220411.shtml
2022-04-11 09:22:06,省政协召开主席会议 唐良智主持并讲话,4月8日，省政协主席唐良智主持召开省政协十二届七十二次主席会议，传达学习习近平总书记近期重要讲话指示精神，传达贯彻省委有关会议精神，听取省政协“一改两为”专题民主监督行动开展情况汇报，总结一季度工作，对二季度工作进行安排部署。,主席会议 孙云飞 省政协主席 会议精神 履职能力 民主监督 一改两为 总书记 党委 防范化解,https://news.cctv.com/2022/04/11/ARTIrHM7DAthqaPQrGwJtuEg220411.shtml
2022-04-11 09:21:56,三亚4月10日新增无症状感染者5例、无症状转确诊1例，详情公布,三亚市新型冠状病毒肺炎疫情防控工作指挥部通报，2022年4月10日0—24时，三亚市新增无症状感染者5例，无症状感染者转归新冠肺炎确诊病例（普通型）1例、（轻型）1例，分别为封控区筛查人员和集中隔离人员，均已分别转运至定点收治医院。,感染者 隔离 采样点,https://news.cctv.com/2022/04/11/ARTIWBDQcTCAGFNdBqVcDZmb220411.shtml
2022-04-11 09:21:08,全面排查和整治各类安全隐患,为落实国家及省委、省政府对抓好当前安全生产工作的部署，4月8日至9日，省长王清宪在池州市检查工作，督促推动安全生产工作落实。,王清宪 安全风险 安全生产工作 排查 安全生产责任 重特大事故 风险隐患 防范遏制 技防 安全隐患,https://news.cctv.com/2022/04/11/ARTIRKx8jUguK36t12NWJInU220411.shtml
2022-04-11 09:20:17,高质高效推进“数字安徽”建设 不断做强做优做大数字经济,4月8日上午，省委书记郑栅洁主持召开省委专题会议，讨论研究《“数字安徽”建设总体方案》《加快发展数字经济行动方案（2022—2024年）》。,数字经济 数字安徽 数字资源 做优 建设周期 做强 基础平台 流程再造 数据安全 统一思想,https://news.cctv.com/2022/04/11/ARTIecq6EojjwtCZsho4txWb220411.shtml
2022-04-11 09:17:47,省疫情防控指挥部召开专题会议,4月10日，省委副书记、省长李乐成继续主持召开省疫情防控指挥部专题会议，深入学习贯彻习近平总书记关于疫情防控工作的重要讲话和指示精神，按照省委工作要求，安排部署下步重点任务，强化各项工作落实落细。,疫情防控 防控机制 防控措施 指挥部 核酸检测 短板 常态化 总书记 风险点 加细,https://news.cctv.com/2022/04/11/ARTIXDAN1e0Qj6tJDeFPZFk6220411.shtml
2022-04-11 09:17:37,4月10日陕西新增7例本土确诊病例,4月10日0-24时，新增报告本土确诊病例7例（西安6例、渭南1例），出院2例。,病例 确诊 核酸,https://news.cctv.com/2022/04/11/ARTIG3somt7G2rQAtzmPzaFB220411.shtml
2022-04-11 09:16:57,巩固来之不易的疫情防控成果分区域分步骤有序恢复生产生活秩序,4月10日，省委书记、省疫情防控指挥部总指挥张国清来到沈阳市疫情防控指挥部，研判疫情情况，研究下步疫情防控措施。,疫情防控 恢复生产 生产生活 防控措施 方舱 巩固成果 生活保障 张国清 筛查 重要讲话,https://news.cctv.com/2022/04/11/ARTIiKjeq6DoB6c4gBufb5LU220411.shtml
2022-04-11 09:14:41,坚决贯彻总体国家安全观 筑牢国家安全的北方屏障,4月10日上午，在第七个“全民国家安全教育日”前夕，省委书记、省人大常委会主任、省委国家安全委员会主任许勤来到省国家安全厅调研。,国家安全观 国家安全委员会 全民国家 教育日 国家利益 牢固树立 国家安全工作 国家安全机关 政治责任 绝对领导,https://news.cctv.com/2022/04/11/ARTIfNeQ38GDOYfqSgZsnszO220411.shtml
2022-04-11 09:13:20,尽锐出战 以快制胜 以最短时间最小代价控制疫情,根据省委工作安排，4月10日上午，省委副书记、省长、省疫情防控指挥部指挥长王忠林到武汉市指导疫情防控工作，在省指挥部视频调度黄冈麻城市、鄂州市疫情处置工作。,疫情防控 控制疫情 核酸检测 流调 筛查 视频 商超 风险点 主阵地作用 物流园区,https://news.cctv.com/2022/04/11/ARTIGS84kqB4I7GKt3Xfi3qL220411.shtml
2022-04-11 09:13:08,江苏4月10日新增本土确诊病例7例、本土无症状感染者46例,4月10日0-24时，江苏新增本土确诊病例7例（南京市3例，徐州市1例，苏州市2例，连云港市1例，均在定点医院隔离治疗）。,无症状 确诊病例 定点医院,https://news.cctv.com/2022/04/11/ARTIhytfgdxBXHdDROow31kC220411.shtml
2022-04-11 09:12:43,江苏4月10日新增本土确诊病例7例、本土无症状感染者46例,2020年1月22日至今，全省累计报告新冠肺炎确诊病例2090例（其中境外输入220例）。,确诊 病例 江苏,https://news.cctv.com/2022/04/11/ARTIUUAHHv4KkFqlXAMzllHr220411.shtml
2022-04-11 09:11:26,在新发展阶段海洋强省建设中发挥更大作用,4月7日至8日，省政协主席黄莉新率队来到舟山，围绕推进海洋经济高质量发展开展专题调研。,黄莉新 海洋经济 船用燃料油 新发展 海洋产业 发展优势 践行 总书记 省中 市政协,https://news.cctv.com/2022/04/11/ARTIWfeclDoz5kejPoCz0bVT220411.shtml
2022-04-11 09:09:16,发扬历史主动精神 增强战略定力以高质量为引领深化推进京津冀协同发展,4月8日，市委书记李鸿忠深入滨海新区，就深入实施京津冀协同发展战略、推动我市经济社会高质量发展进行调研，并主持召开部分区和市有关部门主要负责同志座谈会，就市第十二次党代会报告议题征求意见建议。,李鸿忠 合成蛋白 捷创 我市 党代会 卡脖子 京津冀 协同发展 信创 奋斗目标,https://news.cctv.com/2022/04/11/ARTIQlCvOSZQ8oTJBrTtO55J220411.shtml
2022-04-11 09:04:28,三部门：到2025年废旧纺织品循环利用率达到25%,到2025年，废旧纺织品循环利用体系初步建立，循环利用能力大幅提升，废旧纺织品循环利用率达到25%，废旧纺织品再生纤维产量达到200万吨。,循环利用 纺织品 再生纤维,https://news.cctv.com/2022/04/11/ARTIwE08kVOtAIOb7Y9BOmNC220411.shtml
2022-04-11 09:03:10,国家卫健委：昨日新增本土确诊1164例、本土无症状26345例,4月10日0—24时，31个省（自治区、直辖市）和新疆生产建设兵团报告新增确诊病例1184例。,国家卫健委 病例 确诊,https://news.cctv.com/2022/04/11/ARTIsDb5Tin1ZILoDYnGykv0220411.shtml
2022-04-11 08:59:07,长春4月10日新增本地确诊病例102例、本地无症状感染者743例,4月10日0-24时，长春市新增本地确诊病例102例（含29例无症状感染者转为确诊病例）,感染者 长春市 确诊,https://news.cctv.com/2022/04/11/ARTIScdkxbz2kawtV1OOhG1m220411.shtml
2022-04-11 08:50:30,一图速览总书记总结表彰大会重要讲话,一图速览总书记总结表彰大会重要讲话。,习近平,https://news.cctv.com/2022/04/11/ARTI25UC1v4TfC5lkP7RHp9T220411.shtml
2022-04-11 08:49:53,吉林省新增本地确诊病例187例、本地无症状感染者797例,4月10日0-24时，全省新增本地确诊病例187例(轻型178例、普通型9例）。,感染者 长春市 吉林市,https://news.cctv.com/2022/04/11/ARTIoE2x6FAD44t7yR5J2ZKh220411.shtml
2022-04-11 08:42:47,湖北4月10日新增本土无症状感染者33例,4月10日0-24时，全省新增本土确诊病例0例，新增本土无症状感染者33例（其中武汉市12例，黄冈市10例，鄂州8例，恩施州2例，随州市1例）。,感染者 无症状 本土,https://news.cctv.com/2022/04/11/ARTI3siBJpitHZPK6mE96pO3220411.shtml
2022-04-11 08:31:16,河南4月10日新增本土无症状感染者4例,4月10日0—24时，河南省新增无症状感染者5例（本土4例，其中郑州市2例、永城市1例、安阳市1例；境外输入1例），无新增确诊病例和疑似病例。,河南 本土 输入,https://news.cctv.com/2022/04/11/ARTIUuojbvWTGf53PqXtY9DB220411.shtml
2022-04-11 08:20:05,时政微周刊丨总书记的一周（4月4日—4月10日）,总书记的一周（4月4日—4月10日）。,习近平,https://news.cctv.com/2022/04/11/ARTIi8tU8TiMlC3AxNiVjKx0220411.shtml
2022-04-11 08:18:31,沙尘暴蓝色预警：9省区市将现扬沙或浮尘，局地有沙尘暴,中央气象台4月11日06时发布沙尘暴蓝色预警：受冷空气大风和沙尘传输影响，预计11日白天，新疆南疆盆地、青海北部、甘肃中东部、内蒙古中西部、宁夏、陕西中北部、山西西部和北部、河北西部、北京西部等地有扬沙或浮尘天气，局地有沙尘暴。,沙尘暴 局地 浮尘天气,https://news.cctv.com/2022/04/11/ARTIL6PIilYN3YpUSAQZKdjN220411.shtml
2022-04-11 08:06:23,河北4月10日新增本土无症状感染者100例,2022年4月10日0—24时，河北省无新增本土新型冠状病毒肺炎确诊病例；新增本土无症状感染者100例，其中保定市67例、邯郸市31例、定州市2例（外省来冀人员）。,本土 感染者 河北省,https://news.cctv.com/2022/04/11/ARTIDZDiSpfmOLezOOpywAY8220411.shtml
2022-04-11 08:05:52,【8点见】北京某三甲医院收取“天价”殡葬费？通报来了！,每天8点，央视网为您梳理24小时内发生在咱们身边的大小事儿。,8点见,https://news.cctv.com/2022/04/11/ARTI9tboe49ngKzrGhm6pg6k220411.shtml
2022-04-11 07:54:26,北京4月10日新增1例境外输入确诊病例,4月10日0时至24时，无新增本土确诊病例、疑似病例和无症状感染者；新增1例境外输入确诊病例，无新增疑似病例和无症状感染者。治愈出院3例。,病例 确诊 感染者,https://news.cctv.com/2022/04/11/ARTIbaKLFfJuKyc8CdL6eesb220411.shtml
2022-04-11 07:48:05,上海昨日新增本土确诊病例914例、无症状感染者25173例,2022年4月10日0—24时，新增本土新冠肺炎确诊病例914例和无症状感染者25173例，其中47例确诊病例为此前无症状感染者转归，564例确诊病例和24230例无症状感染者在隔离管控中发现，其余在相关风险人群排查中发现。,感染者 确诊病例 无症状,https://news.cctv.com/2022/04/11/ARTIzrwg0NqID4MyeVgkNTZ5220411.shtml
2022-04-11 07:43:04,稳就业信号增强 减负稳岗扩就业齐发力,近日，从就业形势座谈会到经济形势专家和企业家座谈会，一系列部署释放出加强研判就业形势，加码稳住就业基本盘的强烈信号。,就业形势 就业市场 就业压力,https://news.cctv.com/2022/04/11/ARTIvYluFh3T7HTbL1Xwkxd9220411.shtml
2022-04-11 07:40:48,加快建设全国统一大市场明确六方面重点任务,意见强调，要加快建立全国统一的市场制度规则，打破地方保护和市场分割，打通制约经济循环的关键堵点，促进商品要素资源在更大范围内畅通流动，加快建设高效规范、公平竞争、充分开放的全国统一大市场。,加快推进 市场运行 市场制度,https://news.cctv.com/2022/04/11/ARTIkybNJIo34jdF0HenhBco220411.shtml
2022-04-11 07:38:34,8000亿元水利工程投资敲定 多路资金组合发力,水利建设资金需求大，需要充分发挥政府和市场作用。财政部农业农村司负责人姜大峪表示，今年通过一般公共预算安排了1507亿元，其中水利发展资金达到606亿元；政府性基金安排572亿元，为今年扩大水利投资创造了有利条件。,水利工程建设 引调水工程,https://news.cctv.com/2022/04/11/ARTIUWO6NTOniXBPWAE2mwiZ220411.shtml
2022-04-11 07:29:40,武汉地铁：4月11日起，乘地铁需凭48小时核酸阴性证明或核酸采样凭证,自4月11日起，武汉轨道交通执行“健康码绿码、48小时核酸阴性证明（或核酸采样凭证）、测温、戴口罩、扫车厢码”措施，保障公共交通疫情防控安全。,核酸 武汉 测温 采样,https://news.cctv.com/2022/04/11/ARTIM9CkKvcNBUTJeax1BfPI220411.shtml
2022-04-11 06:34:09,3月CPI今日公布：受这个因素影响 涨幅或有所回升,4月11日，国家统计局将公布3月份全国居民消费价格指数(CPI)，受非食品价格上升等影响，3月份CPI涨幅或有所扩大。,CPI 涨幅 通胀 环比 猪肉价格 周均价 PPI,https://news.cctv.com/2022/04/11/ARTIFAJa9KH1zc11AZlOTP0d220411.shtml
2022-04-10 22:07:26,焦点访谈：并肩战“疫” 同心守“沪”,一个个闭环管理的社区里，居民需求千头万绪，现实难题一个接一个。怎么帮助居民解决这些难题，维持正常生活呢？有许许多多的人这些天一直在奔忙着，守护着这座城市，守护着一个个社区、一个个家庭。,焦点访谈 上海 疫情防控,https://news.cctv.com/2022/04/10/ARTI4egQUDMRNAUij2XU8RbW220410.shtml
2022-04-10 22:05:46,北京某三甲医院收取天价殡葬费？市监部门：将立案调查,4月8日，媒体曝出“北京某三甲医院收取天价殡葬费”舆情后，市市场监管执法总队会同海淀区执法大队立即出击，当天上午即赴北京大学第三医院太平间实地检查，对殡仪服务收费情况进行核实，现场调取了殡仪服务相关收费证据材料。,殡仪服务 北京大学第三医院 核查 太平间 执法总队 三甲医院 北京某三甲医院收天价殡葬费 收费情况 证据材料 维护群众,https://news.cctv.com/2022/04/11/ARTIFEQWP4a9cKyrGJYbvsRb220410.shtml
2022-04-10 21:54:45,确诊29例 无症状12例！太原发布病例36-41活动轨迹,2022年4月10日晚9时许，山西太原市疫情防控领导小组办公室发布2022年第37号通告。截止4月9日24:00，我市本轮疫情报告本土确诊病例29例，无症状感染者12例。,太原,https://news.cctv.com/2022/04/10/ARTIY4nTBgB7moFenvggdIA6220410.shtml
2022-04-10 21:11:30,面对只有1例重症，上海对感染者的救治策略是什么？,从症状上来看，上海本轮疫情中绝大多数的感染者为轻症和无症状感染者，目前只有1例重型病例。面对这种情况，当前上海主要的救治策略是什么？,感染者 方舱 重症患者 上海交通大学 新冠 新华视点 肺炎 老年患者 疾病,https://news.cctv.com/2022/04/10/ARTIqAiWffyVdb8WkSeDwMGC220410.shtml
2022-04-10 21:00:18,【央视短评】坚守才能胜利,当前，上海疫情处于高位流行，形势严峻，抗疫进入“最吃劲、最关键”的阶段。越是在这样的时候，越要咬紧牙关，坚持不懈，坚守向前。,胜利 动态清零 疫情防控,https://news.cctv.com/2022/04/10/ARTIHr1pfvKgM812YEi7Siqn220410.shtml
2022-04-10 20:56:36,国际人士高度评价习近平总书记在北京冬奥会冬残奥会总结表彰大会上重要讲话,国际人士表示，习近平主席在北京冬奥会冬残奥会总结表彰大会上的讲话深刻阐述了北京冬奥精神，在新冠疫情持续、世界变局加速演进的形势下，向世界发出了“一起向未来”的时代强音。,残奥会 冬奥会 重要讲话,https://news.cctv.com/2022/04/10/ARTIeTWT2wCUPeoPTPr4HHaZ220410.shtml
2022-04-10 20:50:04,坚持“动态清零”总方针 吉林有序恢复生产生活秩序,自3月初疫情暴发以来，吉林省坚持“动态清零”总方针，之前疫情较为严重的吉林市和长春市九台区这两天已先后实现社会面清零，生产生活秩序正分区分类分梯次有序恢复。,总方针 恢复生产 动态清零,https://news.cctv.com/2022/04/10/ARTIBV1RTB8JttRARn8AOtG2220410.shtml
2022-04-10 20:42:23,习近平的人民情怀,来自人民、为了人民、依靠人民。人民赋予了人民领袖宽广的视野、博大的胸怀、奋进的力量，人民领袖团结带领人民开创新时代历史伟业。,习近平 总书记 人民群众,https://news.cctv.com/2022/04/10/ARTIggk2VCSkILpbfNi0zM5y220410.shtml
2022-04-10 20:36:37,【新闻特写】同心协力 共同战“疫”,当前，在上海防控一线，由党员干部带头，很多群众自发加入其中，冲锋在前。他们活跃在各个社区、各条战线，积极帮助群众排忧解难，大家守望相助，共同战“疫”。,团队 配送 燃气费,https://news.cctv.com/2022/04/10/ARTI4RKdwiDKUgGT6xGn78jR220410.shtml
2022-04-10 20:14:27,上海从严落实防控举措 各地驰援抗击疫情,在疫情防控的关键时刻，上海从严从紧落实防控举措，加快打通物资供应堵点难点。全国多地紧急驰援，医护人员连续奋战开展救治，遏制疫情蔓延势头。,疫情防控 方舱 上海,https://news.cctv.com/2022/04/10/ARTIA2dxj9P4NKtchsY7kHkD220410.shtml
2022-04-10 20:09:09,十九届中央第九轮巡视完成进驻,根据党中央关于巡视工作的统一部署，截至4月9日，十九届中央第九轮巡视的进驻工作全部完成。15个中央巡视组将在被巡视单位开展为期2个月左右的巡视工作。,国家机关 从严治党 党中央,https://news.cctv.com/2022/04/10/ARTIklgg40bX707x10nDpuob220410.shtml
2022-04-10 20:06:30,中共中央 国务院关于加快建设全国统一大市场的意见,日前，《中共中央 国务院关于加快建设全国统一大市场的意见》正式发布。,中共中央 市场制度 市场体系,https://news.cctv.com/2022/04/10/ARTI2bHg53trTBtR72H9WJyu220410.shtml
2022-04-10 20:02:04,【奋进新征程 建功新时代·伟大变革】基础设施补短板 山乡巨变焕新颜,习近平总书记指出，要继续完善农村公共基础设施，改善农村人居环境，把乡村建设得更加美丽。,总书记 村容村貌 基础设施,https://news.cctv.com/2022/04/10/ARTIMXwqgJXneG3MMxUrnZnN220410.shtml
2022-04-10 18:31:11,人民币储备货币地位提升彰显中国经济实力与魅力,国际货币基金组织日前发布的“官方外汇储备货币构成(COFER)”数据显示，2021年第四季度人民币在COFER中占比创五年以来新高。观察人士认为，人民币国际影响力持续提升，折射出中国经济在国际社会赢得更多“信任票”。,人民币国际化,https://news.cctv.com/2022/04/10/ARTIgbip5754OLjQ9eQ7JwcN220410.shtml
2022-04-10 18:18:08,过紧日子！这个省要求文件印双面，开会不发笔,日前，安徽省财政厅出台12条措施，要求进一步厉行节约，坚持过紧日子，措施规定之细致，引来舆论关注。,政府 过紧日子,https://news.cctv.com/2022/04/10/ARTIenELe5Qw1PKJOB6Rv4TY220410.shtml
2022-04-10 18:06:17,广州：正在推进建设方舱医院,4月10日下午，广州召开疫情防控新闻发布会，广州市政府副秘书长吴林波在会上介绍，近期，根据国家疫情防控的有关要求，各省要准备两到三家方舱医院。,广州 方舱医院,https://news.cctv.com/2022/04/10/ARTItiuIDbb8IBRHEKPeWnBp220410.shtml
2022-04-10 17:42:19,广州：本次疫情不排除社区隐匿性传播的可能,4月10日下午，广州召开疫情防控新闻发布会，会上介绍，4月9日8时至10日14时，广州新增密接1039人，次密接1081人，重点人员3522人，目前针对疫情涉及的重点场所和各类管控区域，全市共开设3624个核酸采样点，15771个采样单元。,广州,https://news.cctv.com/2022/04/10/ARTIy5LkwmhxTVQRVfjNNr8T220410.shtml
2022-04-10 17:42:07,广州越秀区发现2例新冠肺炎确诊病例,据“广州越秀发布”微信公众号10日消息，4月9日，越秀区发现2例新冠病毒核酸检测结果阳性人员。,广州越秀区 确诊病例,https://news.cctv.com/2022/04/10/ARTIDKIXZk8AmDU4hH7Eyz02220410.shtml
2022-04-10 17:39:56,广州：4月11日起全市中小学校暂停线下教学,4月10日下午，广州召开疫情防控新闻发布会，会上介绍，自4月11日起，广州全市中小学阶段学校（有住宿条件和全封闭管理条件的高三除外）暂停线下教学，采取线上教学；高三年级有住宿条件的，在校实施全封闭管理，没有住宿条件的，居家开展线上教学。,广州 中小学,https://news.cctv.com/2022/04/10/ARTIFCZHM01s4MDFPGwdtSSY220410.shtml
2022-04-10 17:29:53,冬奥成果 人民共享,在北京冬奥会、冬残奥会总结表彰大会上，习近平总书记指出，我们坚持冬奥成果人民共享，通过推广普及冰雪运动带动全民健身走向纵深，通过产业发展助力脱贫攻坚，通过提升公共服务水平改善人民生活品质，让人民身心更健康、就业更充分、生活更美好，实现共同参与、共同尽力、共同享有。,冰雪运动 人民群众 冬奥会,https://news.cctv.com/2022/04/10/ARTIeWkobQNnLtcXKvqwM02H220410.shtml
2022-04-10 17:26:12,为烈士寻亲，帮烈属圆梦：“焦像田”烈士亲属找到了！,4月8日，从山东省成武县退役军人事务局传来好消息，退役军人事务部联合人民日报新媒体发起的“今年清明，请帮这40位烈士寻亲！”,寻亲 亲属 今年清明,https://news.cctv.com/2022/04/10/ARTIEN5StHMbFOWTFUYa59EI220410.shtml
