version_date,title,brief,keyword,url
2022-04-15 21:03:41,中央网信办等三部门：开展“清朗·整治网络直播、短视频领域乱象”专项行动,按照2022年“清朗”系列专项行动安排，中央网信办、国家税务总局、国家市场监督管理总局自即日起，开展为期两个月的“清朗·整治网络直播、短视频领域乱象”专项行动。,网络直播 短视频,https://news.cctv.com/2022/04/15/ARTIrYGM90sIKHPylsQyAB1O220415.shtml
2022-04-15 21:02:04,“探索试验蹚出来一条路子”——记习近平总书记赴海南考察调研,彼时，中国开放的大门刚刚打开。今天，改革开放不断向纵深推进。时与势，将建设自由贸易港的任务交到了海南手中。习近平总书记饱含期待：“由海南来完成这项历史性任务，这也是中国特色社会主义经济特区建设的一个战略安排，不断摸索、大胆试验，现在蹚出来一条路子。”,习近平 海南,https://news.cctv.com/2022/04/15/ARTI4OnE7oSsSIs1LItAtV49220415.shtml
2022-04-15 21:00:36,吉林省四平市新增本土确诊病例3例,4月15日0—16时，四平市新增本地确诊病例3例（轻型），其中铁西区1例、铁东区2例，以上病例都在隔离管控中发现。现将主要活动轨迹公布如下（未公布的时间段尚未发现有公共场所活动轨迹）。,吉林省 疫情,https://news.cctv.com/2022/04/15/ARTIrRrWYC5kxC3nOgcPUM0E220415.shtml
2022-04-15 20:55:41,呵护特殊人群，是一道必答题,一场涉及整个上海的疫情防控，也在提醒我们看见社会的角角落落。15日上午，上海市疫情防控工作新闻发布会提到，针对独居老人，特别是高龄独居老人，或家人被隔离收治而暂时无人照料的老人等，开展摸底排查，掌握实际需求，组织力量给予帮扶。,快评 独居老人 方舱 亲子舱 特殊人群 疫情防控 病人 特殊群体 养老护理员 社区养老,https://news.cctv.com/2022/04/15/ARTIWI4VEJSTNV6FtHGK8Ghx220415.shtml
2022-04-15 20:44:59,上海现280元一份蔬菜套餐？立案调查！,近日，上海市崇明区市场监管局执法人员在日常巡查中发现，有商家通过某视频平台以280元每份的价格在线销售蔬菜套餐，该套餐内含芹菜、西红柿、红薯、莴笋、草头、卷心菜、大蒜、西葫芦、青菜、甜菜10种蔬菜共计5千克。,监管部门 蔬菜 支付宝 违法所得 套餐 立案调查 中华人民共和国价格法 团购 责令改正 禁止价格欺诈行为的规定,https://news.cctv.com/2022/04/15/ARTI5VFGJqejGbE5dsMiax9P220415.shtml
2022-04-15 20:42:44,稳供应、保民生 上海民政部门加强救助供养独居老人、特困家庭,4月15日，上海市民政局局长蒋蕊在上海市疫情防控工作新闻发布会上表示，在当前疫情防控最吃劲的关头，社区里的独居老人、特困家庭受到的影响相对更大，尤其需要得到关心、关爱和帮助。对此，民政等相关部门迅速出台并落实相应举措，进一步筑牢疫情防控下的民生底线。,独居老人 特困家庭 救助对象 疫情防控 一事一议 民政部门 蔬菜价格 街镇 社区养老 农副食品,https://news.cctv.com/2022/04/15/ARTI6tyudJZw22flblmc7T8Z220415.shtml
2022-04-15 20:40:08,上海：本轮疫情防控社会捐赠收入已达3.37亿元,今日（4月15日）上午，上海市举行新冠肺炎疫情防控工作第154场新闻发布会。上海市副市长彭沉雷在会上表示，本轮疫情发生以来，上海社会各界爱心涌动、积极行动，尤其是基金会、行业协会商会、社会服务机构等各类社会组织发挥各自优势，通过各种方式对接爱的资源。,疫情防控 志愿服务 社会组织 社会捐赠 社会服务机构 社会力量 慈善法 心理咨询 肺炎 新冠,https://news.cctv.com/2022/04/15/ARTIrEu2R97iocojAbTiT818220415.shtml
2022-04-15 20:39:03,【组图】“守沪者联盟”丨国家会展中心（上海）方舱医院首批患者出舱,2022年4月14日，国家会展中心（上海）方舱医院首批322名患者解除隔离医学观察，顺利出舱。,医学观察 视觉中国 殷立勤 方舱 图片 出舱 患者 执勤民警 集中隔离 瑞金医院,https://news.cctv.com/2022/04/15/ARTIEhM5q2gMe8ALXZY3P8We220415.shtml
2022-04-15 20:37:04,第1视点｜情牵琼州大地,暖心的问候、热情的鼓励、殷切的嘱托，与习近平总书记面对面交流的场景深深铭刻在海南广大干部群众的脑海中。大家纷纷表示，要解放思想、开拓创新，团结奋斗、攻坚克难，加快建设具有世界影响力的中国特色自由贸易港，让海南成为新时代中国改革开放的示范，以实际行动迎接党的二十大胜利召开。,习近平 总书记 琼州 情牵 制片人 开拓创新 国家公园 编导 解放思想 出品人,https://news.cctv.com/2022/04/15/ARTI138dHE0LtvBWk0dKbpQQ220415.shtml
2022-04-15 20:34:57,农业农村部：绝不能因病虫防治不到位 导致小麦减产减收,据农业农村部网站消息，农业农村部15日召开小麦穗期重大病虫防控工作视频会。会议要求各地把防控小麦赤霉病、条锈病等作为保障夏粮丰收的关键一仗，迅速行动，因地制宜落实防控措施，全力以赴“虫口夺粮”保丰收。,病虫防治 保丰收,https://news.cctv.com/2022/04/15/ARTIUw926TeuLtHjOGIA92c3220415.shtml
2022-04-15 20:34:11,云南姚安：发展有机蔬菜种植助农增收,近年来，云南楚雄彝族自治州姚安县持续加大有机蔬菜品牌培育扶持力度，让当地生产的有机蔬菜走出“深闺”，出现在了许多城市的餐桌上。目前，姚安全县绿色有机蔬菜基地认定面积约1万亩，已获得有机产品认证31个，带动23000多户农户实现增收。,有机蔬菜 助农增收 云南姚安 种植 深闺 农户 音视频 姚安县 品牌培育 产品认证,https://news.cctv.com/2022/04/15/ARTIvVYJyJtGycvxZAQV8dDP220415.shtml
2022-04-15 20:33:32,学习图说丨安而不忘危,2022年4月10日，习近平总书记在海南省三亚市崖州湾种子实验室考察调研。进入新时代，我国面临更为严峻的国家安全形势：外部压力前所未有；传统安全威胁和非传统安全威胁相互交织；“黑天鹅”“灰犀牛”事件时有发生。,习近平,https://news.cctv.com/2022/04/15/ARTIQ98WZQUBcqKeicwF9pID220415.shtml
2022-04-15 20:32:51,致星辰里的你,神舟十三号乘组即将返回地球，为期半年的“太空出差”，航天员们圆满完成。,航天员 星辰 制片人 神舟 出品人 王雪冰 飞行任务 外太空 出舱 女性舱,https://news.cctv.com/2022/04/15/ARTIisdexKVJeb5K7ciPn1Nh220415.shtml
2022-04-15 20:30:46,生态环境部：4月下半月全国大部空气质量以优良为主,据生态环境部官方微信消息，4月下半月全国空气质量预报会商结果显示，4月下半月，全国大部扩散条件较好，空气质量以优良为主，局部地区可能出现轻度污染过程。,空气质量 扩散条件,https://news.cctv.com/2022/04/15/ARTIveGNz4pgd38K7zDRNsps220415.shtml
2022-04-15 20:29:18,习言道 | “始终绷紧疫情防控这根弦”,4月13日，习近平总书记在海南考察时强调，坚持科学精准、动态清零，抓细抓实疫情防控各项举措。面对世纪疫情跌宕反复，习近平牵挂着人民群众的身体健康和生命安全，今年以来，多次就疫情防控提出明确要求。,疫情防控 习言道 习近平 坚持科学 总书记 人民群众 清零 明确要求 身体健康 生命安全,https://news.cctv.com/2022/04/15/ARTIxLQqx4WSyM2n99hbCvvz220415.shtml
2022-04-15 20:24:41,流动的温暖筑成众志成城的抗疫防线,近日，上海某小区的一场暖心“接龙”引发网络关注。据报道，一位居民自发将消过毒的12罐可乐放在一楼大厅免费供人取用，“没想到大家就开始以物换物”，物资不减反增。辣酱、蔬菜、化妆品、小绿植……不到半天，大家主动贡献的各种生活物资就攒成了“小超市”，还有热心邻居给“小超市”定期消杀清理，不给防疫工作添麻烦。全民抗疫中，小小善举漾起真情涟漪、推动温情循环，邻里互助暖人心。,敲门 破防 通风换气 楼长 接龙 疫情 温情 摆渡 辣酱 蔬菜,https://news.cctv.com/2022/04/15/ARTI1NhQZNYjZgZfU996KFMj220415.shtml
2022-04-15 20:23:02,“老区新貌”“大美边疆”行进式采访报道即将启动,4月中旬起，中央主要媒体将深入革命老区和边疆地区，开展行进式、互动式采访报道，生动讲述新时代“老区新貌”“大美边疆”的精彩故事。,大美 边疆地区 湘鄂渝黔 革命老区 新貌 陕甘宁 中央苏区 左右江 琼崖革命 湘赣,https://news.cctv.com/2022/04/15/ARTINQ4PddxLM5Kt6PzRfLda220415.shtml
2022-04-15 20:17:05,助力稳增长 一季度金融政策持续发力,国务院新闻办今天（4月15日）举行新闻发布会，银保监会相关负责人介绍，一季度，我国银行业境内口径总资产351.1万亿元，同比增长8.9%；保险业总资产25.5万亿元，同比增长2.6%。,保险业 金融政策,https://news.cctv.com/2022/04/15/ARTIjhoeBlUDafy6b9JgwuYd220415.shtml
2022-04-15 20:16:38,业内人士：开辟“绿色通道” 将为物流行业打通金融堵点,4月15日，人民银行召开会议，传达国务院专题会议精神，研究部署统筹疫情防控和经济发展，加大对物流通畅和产业链供应链稳定的金融支持。人民银行将运用再贷款、再贴现等多种货币政策工具，支持和引导金融机构加大金融支持力度，对运输物流企业和货运司机开辟“绿色通道”，合理给予贷款展期和续贷安排，增加民航运输信贷投放，建立信贷、债券融资对接机制，发挥应收账款服务平台作用，支持产业链供应链稳定循环。接受中国证券报记者采访的专家表示，暖风频吹开辟“绿色通道”，将为物流行业打通金融堵点。,绿色通道 物流行业 堵点 物流企业 金融支持 金融证券 招商证券 供应链 货运司机 业内人士,https://news.cctv.com/2022/04/15/ARTIDxKn8lKGhEh5kHqHwGs8220415.shtml
2022-04-15 20:15:36,工信部、交通部、央行齐发声：全力保障物流畅通和产业链供应链稳定,工业和信息化部召开专题会议，传达国务院副总理刘鹤主持召开的保障物流畅通和产业链供应链稳定专题会议精神，研究落实工作举措。会议强调，要把思想和行动统一到党中央、国务院决策部署上来，坚持稳中求进工作总基调，统筹推进疫情防控和经济社会发展，全力以赴抓好疫情精准防控、保障物流畅通和稳定产业链供应链各项工作。,物流有序 供应链 产业链 物流行业 央行 工信 物流企业 交通部 疫情防控 绿色通道,https://news.cctv.com/2022/04/15/ARTIQHPHluUEEcSS9y1e2UiF220415.shtml
2022-04-15 20:15:29,第七个全民国家安全教育日 各地多种形式普及国家安全知识,今天（4月15日）是第七个全民国家安全教育日，各地组织开展了丰富多彩的宣传教育活动，普及国家安全知识。,全民国家安全教育日,https://news.cctv.com/2022/04/15/ARTI2GVVrNVForxpFo69lTIg220415.shtml
2022-04-15 19:57:58,交通运输部贯彻国务院专题会议精神落实保通保畅工作,据交通运输部4月15日消息，交通运输部贯彻落实国务院专题会议精神，要求坚决把思想和行动统一到党中央、国务院决策部署上来，统筹疫情防控和经济社会发展、统筹疫情防控和保通保畅、统筹发展和安全，确保抓防控、保畅通、促产业的有机统一。,运输部 物流有序 交通 贯彻落实 经济社会发展 国务院 疫情防控 部署 证券时报 统筹发展,https://news.cctv.com/2022/04/15/ARTINekBXpj9TkNSohTNUdtx220415.shtml
2022-04-15 19:54:58,“出差三人组”，准备回家！,记者14日从中国载人航天工程办公室了解到，神舟十三号载人飞船已完成全部既定任务，将于近日择机撤离空间站核心舱组合体，返回东风着陆场。,神舟 着陆场 航天员 空间站 载人飞船 载人航天工程 弹唱 组合体 科学试验 出舱,https://news.cctv.com/2022/04/15/ARTI7a8VaW9OqcxmvIYmad6A220415.shtml
2022-04-15 19:49:19,国家烟草总局发布《关于电子烟零售点布局和许可管理工作的指导意见》,依法履行电子烟零售市场主体准入与退出的监管职责，落实控烟履约要求，合理布局电子烟零售点，防止无序竞争。贯彻落实“放管服”改革要求，提升政务服务水平。处理好市场与政府关系，促进产业治理法治化、规范化，维护国家利益和消费者利益。,电子烟 零售点 烟草,https://news.cctv.com/2022/04/15/ARTIZ5mYva1BwUajVjDxx8aJ220415.shtml
2022-04-15 19:49:02,一起守“沪”|齐心战“疫” 连云港医疗队支援上海核酸检测,2022年4月14日，上海，连云港医疗队支援徐汇长桥街道的封控社区做防疫核酸筛查，负责检测的大白医务人员与维护秩序的本地志愿者合作，为封控小区居民一户户家庭做核酸检测，现场秩序井然，还为腿脚不便的老人和病人提供人性化的上门服务，临走还不忘用消毒水帮居民家杀毒。,核酸检测 医疗队 连云港 筛查 医务人员 长桥 徐汇 病人 支援 杀毒,https://news.cctv.com/2022/04/15/ARTIGHnrSBB5ffB8MKdZ4gjD220415.shtml
2022-04-15 19:47:58,一起守“沪”|快递员、志愿者通力合作，打通物资配送最后一公里！,2022年4月14日，电商巨头京东物流的快递员开着面包车为长宁区的封闭社区送货，小区志愿者耐心为网购居民清点蔬菜水果等物资。,快递员 物资配送 志愿者 网购 物流 京东 摄影师 电商 图片,https://news.cctv.com/2022/04/15/ARTImgof52lvFvgH5vuofzDP220415.shtml
2022-04-15 19:45:48,【海报】“动态清零”是现阶段最佳选择,【海报】“动态清零”是现阶段最佳选择。,海报 动态清零 最佳选择 现阶段,https://news.cctv.com/2022/04/15/ARTI6rlZ6uUT1dMJjETbCeYJ220415.shtml
2022-04-15 19:45:24,国家烟草总局发布《关于电子烟批发企业布局的指导意见》,尊重市场规律，结合消费群体、人口规模、经济水平、地理交通、企业成本等综合状况，统筹考虑批发企业数量，实现高效运行、供需匹配、资源优化的目的。,电子烟 批发 烟草,https://news.cctv.com/2022/04/15/ARTI5yZVmrSbbPVAVQVi0U1o220415.shtml
2022-04-15 19:43:45,习近平同毛里求斯总统就中毛建交50周年互致贺电,国家主席习近平4月15日同毛里求斯总统鲁蓬互致贺电，庆祝两国建交50周年。,习近平,https://news.cctv.com/2022/04/15/ARTI76vWXVTxiYJCDZ4ZoIVh220415.shtml
2022-04-15 19:43:41,【海报】@老年人，新冠疫苗要“应接尽接”,【海报】@老年人，新冠疫苗要“应接尽接”。,新冠 疫苗 海报 老年人 应接尽接,https://news.cctv.com/2022/04/15/ARTIAkLSA42zppsZdU9xWVsa220415.shtml
2022-04-15 19:41:08,无症状感染者需要治疗吗？能否居家隔离？专家解读,无症状感染者需要治疗吗？能否居家隔离？专家解读。,无症状 感染者 治疗 居家 张文婷 姜越 翟巧红 隔离 专家解读 封面,https://news.cctv.com/2022/04/15/ARTIjtDA4FllScubk347g25Q220415.shtml
2022-04-15 19:39:25,习近平同沙特王储通电话,国家主席习近平4月15日上午同沙特王储穆罕默德通电话。,习近平,https://news.cctv.com/2022/04/15/ARTIMIS0ryvAr41r5EHSOTCM220415.shtml
2022-04-15 19:29:57,【凡人微光】保供专列开行 驰援上海“菜篮子”,连日来，江苏海安、盐城等地开通“绿色通道”，一批批农副产品陆续运往上海。,菜篮子 保供专列,https://news.cctv.com/2022/04/15/ARTI6DurV1OdbkDNNyXTUxht220415.shtml
2022-04-15 19:22:09,第七个全民国家安全教育日 | 国家安全教育活动走进各地高校,今天（4月15日）是第七个全民国家安全教育日，在湖南省长沙市，检察官走进当地高校，与在校学生开展了以国家安全教育为主题的座谈会，通过多种方式进一步提升大学生群体的国家安全意识，树牢总体国家安全观。,国家安全教育日,https://news.cctv.com/2022/04/15/ARTIoCekNBY89jsBZLDYO0MR220415.shtml
2022-04-15 19:14:17,国家邮政局：一季度邮政行业业务收入累计完成3268.8亿元，同比增长10.0%,4月15日，国家邮政局公布2022年一季度邮政行业运行情况。一季度，邮政行业业务收入（不包括邮政储蓄银行直接营业收入）累计完成3268.8亿元，同比增长10.0%；业务总量累计完成3354.3亿元，同比增长10.7%。,邮政 业务量 寄递,https://news.cctv.com/2022/04/15/ARTIel80u7OtASo8TsFeUsDx220415.shtml
2022-04-15 18:50:08,辽宁沈阳市四地区调整为低风险地区,自4月15日0时起，将大东区惠民家园、中体奥林匹克花园新城、钢花小区及辽中区茨榆坨街道调整为低风险地区，调整后，按照现阶段大东区、辽中区全域疫情防控政策继续落实各项防控措施。,沈阳市 低风险地区,https://news.cctv.com/2022/04/15/ARTIFIbTEQA2IgcxYTwcSfWf220415.shtml
2022-04-15 18:30:43,吉林市5个区域调整为低风险地区,自2022年4月15日20时起将吉林市丰满区前二道乡王相村5组、吉林市丰满区小白山乡大兰旗村4社、吉林市昌邑区站前街道桃花源小区1号楼1单元、吉林市昌邑区莲花街道卢瓦尔小镇D38号楼、吉林市龙潭区山前街道万兴家和小区1号楼2单元5个区域调整为低风险地区，其他区域风险等级不变。,吉林市 风险等级 区域,https://news.cctv.com/2022/04/15/ARTIKkABMXKXeAI19gXOZ91x220415.shtml
2022-04-15 18:18:03,央行：此次降准共计释放长期资金约5300亿元,中国人民银行有关负责人就下调金融机构存款准备金率答记者问，此次降准共计释放长期资金约5300亿元。,金融机构 存款准备金率,https://news.cctv.com/2022/04/15/ARTIPGRreMWYkg0FbBy78eyg220415.shtml
2022-04-15 18:17:20,央行决定于2022年4月25日下调金融机构存款准备金率,央行4月15日消息，中国人民银行决定于2022年4月25日下调金融机构存款准备金率0.25个百分点（不含已执行5%存款准备金率的金融机构）。,准备金率 存款 下调,https://news.cctv.com/2022/04/15/ARTIMlWfdHkaHlwnXgkBfgHF220415.shtml
2022-04-15 18:12:57,长春：南关区明珠街道长春大学等3个区域调为低风险区,长春市新冠肺炎疫情防控工作领导小组办公室通告，根据国务院联防联控机制有关规定，结合当前长春市疫情处置情况，经研究决定，自2022年4月15日18时起，将以下3个区域调为低风险区。,长春市 疫情防控,https://news.cctv.com/2022/04/15/ARTISBLmzN1maoa7qEU7Nsae220415.shtml
2022-04-15 18:00:50,全力保障援沪物资运输 上海铁路部门推出“五优先”,记者4月14日从中国铁路上海局集团公司获悉，4月14日16时30分，载有41车农副产品和生活物资的42844次集装箱直达专列从铁路海安物流基地启程，紧急驶往铁路上海闵行站。3月30日至4月13日，铁路运抵上海的各类保供物资已达1497车、47386吨，其中生活保障物资1400车、46327吨，防疫物资97车、1059吨。,五优先 运输需求 物资运输 铁路部门 运输方式 运输产品 运输组织 运输生产 班列 海铁联运,https://news.cctv.com/2022/04/15/ARTIOSlacDqwhVMWMOu2xIu4220415.shtml
2022-04-15 17:58:46,山西运城：调整寄递业务相关人员管控措施，对7日以来接收过韵达快递人员赋黄码管理,对全市所有韵达快递从业人员实行“14+7”集中隔离，对韵达快递从业人员共同居住者实行“7+5”居家隔离，赋红码管理。,管控 从业 隔离,https://news.cctv.com/2022/04/15/ARTIcgBQJUt1DAay7gMBKvbP220415.shtml
2022-04-15 17:57:08,访上海产业链应急保供杭州中转站：“无接触”下货通浙沪,为保障上海民生物资和重要产业链应急保供工作，近日浙江在嘉兴平湖、嘉善，杭州，宁波四地建设中转站点，以“无接触”模式助保供货物畅通浙沪。14日，记者来到位于杭州市钱塘区的上海产业链应急保供杭州中转站(下称杭州站)，道路“硬隔离”与站内“软设施”等皆准备完毕，随时可开启使用。,杭州站 无接触 嘉善站 浙沪 产业链 污染区 硬隔离 平湖站 上海 投运,https://news.cctv.com/2022/04/15/ARTIY3oGNuhdj5mT22dS44W2220415.shtml
2022-04-15 17:52:29,时习之 筑牢国家安全基石 习近平指明方向,备豫不虞，为国常道。实现中华民族伟大复兴的中国梦，保证人民安居乐业，国家安全是头等大事。2022年4月15日是第七个全民国家安全教育日，让我们一起回顾习近平总书记在不同场合就维护、筑牢国家安全观发表的一系列重要论述，增强维护国家安全的责任感、使命感、紧迫感。,习近平 教育日 伟大复兴 论述 国家安全观 全民国家 总书记 使命感 基石 中华民族,https://news.cctv.com/2022/04/15/ARTItYCmPziyXtl4vPj3umkF220415.shtml
2022-04-15 17:48:47,全球连线｜中国西北基层干部为抗疫添暖意,宁夏吴忠市同心县李岗子村近日因发现区外返宁阳性检出人员，成为当地疫情防控“重地”。因隔离在外，李岗子村4户村民无法喂养家中的20多头牛和100多只羊，对此，除了繁忙的防疫工作，李岗子村的村干部和志愿者每天两班准时准点上门为隔离村民饲喂牛羊，解群众燃眉之急。,岗子村 融合平台 基层干部 重地 村民 大白 灌溉 春灌 农时 疫情防控,https://news.cctv.com/2022/04/15/ARTI2u6HaDApeC7APLGZ0MWT220415.shtml
2022-04-15 17:47:53,乡村振兴在行动|茶园春意浓 云岭采茶忙,一季生机，一季春华，蛰伏一冬，茶树新芽嫩叶已迫不及待地冒了出来，茶山焕发着蓬勃生机。从3月份开始，云南许多茶园春茶鲜叶已陆续开始采摘，古树春茶也在3月20日左右进入采摘季。茶农忙采茶、茶商忙收茶、游客忙寻茶，热闹非凡。,茶农 采茶 茶产业 春茶 滇红 采摘 初制 云岭 增收 专业合作社,https://news.cctv.com/2022/04/15/ARTIwh3pjRbeMiFkxLcVsq1s220415.shtml
2022-04-15 17:45:07,全民国家安全教育日知识，你能答出多少？,今年4月15日是第七个全民国家安全教育日。“总体国家安全观”都包含哪些内容？离我们的生活有多远？身边与国家安全有关的大事小情有哪些？小新出了份“考题”，走上街头看看大家的安全意识有多强？还请来北京总体国家安全观生态安全主题公园专职讲解员贺金鑫答疑解惑。如果是你，能答出多少？,教育日 全民国家 考题 百万庄 课堂 国家安全观 小新 生态安全 安全意识 主题公园,https://news.cctv.com/2022/04/15/ARTI8H4cIbmNz0t4IYkCxuSH220415.shtml
2022-04-15 17:43:33,上海浦东成立临时血透中心：最多可同时服务150人,4曰5日，浦东新区卫健委组织浦东医院建立临时血透中心，旨在解决核酸检测结果阴性且无固定透析点的尿毒症病人的血透问题。临时血透中心定点曹路，浦东医院院长余波召开紧急会议制定方案。次日7点，医务人员及物资车赶至曹路某社区卫生服务中心。12点左右，第一批病人进院血透。,曹路 病人 社区卫生服务中心 医务人员 病房 阴性 海战 医院院长 卫健 尿毒症,https://news.cctv.com/2022/04/15/ARTIyYVEVn2gpOHmU3qP9yOn220415.shtml
2022-04-15 17:38:39,一见·从海南，透视总书记的人才观,4月的海南，海阔天空，碧波荡漾。习近平总书记来到这里，一路上与科研工作者、作业人员、挂职干部代表等亲切交流。,习近平 海南,https://news.cctv.com/2022/04/15/ARTIdT3YgCZuSHNMwXUzweDe220415.shtml
2022-04-15 17:36:45,上海的这抹绿色成保民生保供给主力军,一辆辆绿色的邮政车，一个个绿衣投递员，穿梭在上海前所未见的空旷的城市道路上。在上海疫情防控的关键时期，上海邮政与相关企业共同组成上海市保民生保供给“ 托底主力军”，全力投入民生保障工作中。,配送 套餐 华润万家 新鲜蔬菜 患者 大场镇 小区 疫情防控 商超 送药,https://news.cctv.com/2022/04/15/ARTIBrvUgvjRm16D1uL4N2lR220415.shtml
2022-04-15 17:35:01,上海科技馆线上科普助力市民战“疫”,疫情防控期间，如何让市民及时掌握疫情防控知识，树立战“疫”信心和决心？近日，上海科技馆联动科研机构专家，成立线上科普工作团队，科普疫情热点话题，权威解读市民关心问题，奏响科普抗疫“最强音”。,线上活动 上海科技馆 科普文章 科普工作 市民 助力 疫情防控 最强音 视频号 三馆,https://news.cctv.com/2022/04/15/ARTIV3E98LP7QRBh4aEK3Dum220415.shtml
2022-04-15 17:33:55,在抖音里寻找书记模糊的身影,社区核酸的现场、转运小区病人的现场、大雨中小区封控大门的现场……20秒的短视频中，吕淑林用小区居民拍摄的短视频资料，拼凑出她的丈夫——普陀区桃浦镇阳光威尼斯第一居民区鲍捷在抗疫工作中的忙碌身影。吕淑林说，自从疫情爆发至今，丈夫就一直在居民区工作，没有回过家。,鲍捷 核酸 书记 半日工作团 身影 就医 视频资料 物资发放 党员 病人,https://news.cctv.com/2022/04/15/ARTIXdbq12KRfV1R87qH7fFP220415.shtml
