version_date,title,brief,keyword,url
2022-04-23 15:22:44,奋楫扬帆再出发——写在退役军人事务部成立四周年之际,这是百年变局的一个缩影。在时间维度上，一个民族的奋进之路，总是由一些令人瞩目的时刻标注。,退役军人 退役军人事务部,https://news.cctv.com/2022/04/23/ARTIZ5KL0Wre9gOJLGt8aLXy220423.shtml
2022-04-23 15:18:42,读书之美|不负每一份热爱,我只爱书作为书，而不是作为书架上的装饰品；我爱书被翻得皱皱巴巴，胜过它页页如新。,读书之美 热爱,https://news.cctv.com/2022/04/23/ARTIF2nru2p8h5gMQtnhtWZd220423.shtml
2022-04-23 15:03:10,全民阅读大会推广歌曲：用书香奏响心灵的音符（中),首届全民阅读大会，即将在本周末隆重举行。以“阅读新时代，奋进新征程”为中心主题，许多词曲作家和音乐人积极展开创作，用美好的旋律和歌声，反映当代人民爱读书，读好书的新风尚。,全民阅读大会 推广歌曲 书香,https://news.cctv.com/2022/04/23/ARTICHSQRfRY34c6zLPzevDv220423.shtml
2022-04-23 14:52:35,国家卫健委：全国累计报告接种新冠病毒疫苗332761.6万剂次,截至2022年4月22日，31个省（自治区、直辖市）和新疆生产建设兵团累计报告接种新冠病毒疫苗332761.6万剂次。,接种 病毒疫苗,https://news.cctv.com/2022/04/23/ARTIwUMfaywpZlc7v792pZHH220423.shtml
2022-04-23 14:40:28,2021年我国成年国民综合阅读率81.6%,第十九次全国国民阅读调查结果23日在京发布。,成年国民 综合阅读率,https://news.cctv.com/2022/04/23/ARTI9ad4qfFo28PZCnOEqXhS220423.shtml
2022-04-23 14:39:07,呼伦贝尔：四月飞雪,4月23日，在内蒙古呼伦贝尔牙克石市街头，行人冒雪出行。,内蒙古 呼伦贝尔 四月 降雪天气,https://photo.cctv.com/2022/04/23/PHOAH6isRCTI6OYAPw3NR11b220423.shtml
2022-04-23 14:27:15,三亚：4月24日起恢复市内学生类公交、班线,三亚市交通运输局发布关于恢复学生类公交、班线的通告。,三亚市 交通运输 公交,https://news.cctv.com/2022/04/23/ARTIpRNjX4lvscyhkbWpzZib220423.shtml
2022-04-23 14:22:39,吉林白城23日0-9时新增初筛阳性感染者12例,2022年4月23日0-9时，白城师范学院新增初筛阳性感染者12例，均为隔离管控学生和封闭管理学生，现已转至定点医疗机构隔离治疗，对其密切接触者、次密切接触者均已开展追踪排查，并落实管控措施。,隔离治疗 密切接触者 管控措施,https://news.cctv.com/2022/04/23/ARTIlsDOEiJYqzPoR8cX2BQM220423.shtml
2022-04-23 13:54:50,4月22日12时至23日12时，安徽利辛县在集中隔离点发现6名感染者,4月22日12时-4月23日12时，利辛县在集中隔离点检测发现6名感染者，为昨日公布的初筛阳性人员王**的密接、次密接接触者，均在第一时间送至集中隔离点，现已转运至定点医院医学观察，并依规有序开展溯源流调、核酸检测、隔离管控、环境消杀等处置工作。,安徽 利辛县 感染者,https://news.cctv.com/2022/04/23/ARTIgQwioR9iP92Wv7QUEYE5220423.shtml
2022-04-23 13:52:46,生态环境部：2025年全国农村生活污水治理率将达40%,我国农村生活污水治理的市场广阔，但农村污水处理厂也面临着投资成本高，回报周期长，缺少技术人员维护的短板。,农村 生活污水 污水处理,https://news.cctv.com/2022/04/23/ARTIUjK1BKIU1CMXQLSCyd3M220423.shtml
2022-04-23 13:50:51,地名管理更科学、更明确 新修订的《地名管理条例》5月1日起将施行,国务院日前公布了新修订的《地名管理条例》，这是原《地名管理条例》自1986年颁布以来首次修订。新修订的条例自今年5月1日起施行。,地名管理 科学,https://news.cctv.com/2022/04/23/ARTI3P9xBPauYgGj1U3JzYrU220423.shtml
2022-04-23 13:47:36,世界领先新型复兴号高速综合检测列车上线运行,日前，由我国自主研发、世界领先新型复兴号高速综合检测列车上线运行。该车作为高速动车组新技术验证平台参与CR450动车组研制先期试验，4月12日，在郑州至重庆高速铁路巴东至万州段成功实现隧道内单列时速403公里、相对交会时速达806公里。,复兴号 世界领先,https://news.cctv.com/2022/04/23/ARTI5VLrhu9T73jpQjuf5Nuj220423.shtml
2022-04-23 13:33:44,银保监会：从十个方面增强融资供给 促进国民经济良性循环,银保监会党委22日召开会议，深入学习贯彻党中央指示精神，落实国务院金融委专题会议要求，研究分析当前经济金融形势，安排部署下一阶段重点工作。,银保监会 融资供给 国民经济,https://news.cctv.com/2022/04/23/ARTIJc4ko8E1L11tLspe2yhg220423.shtml
2022-04-23 13:32:40,上海市消毒专班、市爱卫办提示：不要往下水道倒消毒液、投消毒片,清洁消毒行动是疫情社会面清零攻坚九大行动之一，上海市环境整治消杀工作专班、市爱卫办发出提示：在全社会做好环境清洁消杀工作的同时，更要注意以下7个重点场所、重要环节的消毒。,上海市 消毒专班 消毒液,https://news.cctv.com/2022/04/23/ARTICZ3PM4FtwpQDHSnexRTO220423.shtml
2022-04-23 13:29:32,这支“火焰蓝”特勤支队在上海浦东执行环境消杀任务,12个小区、695栋居民楼、3家隔离酒店、10个村宅、超过300万㎡消杀面积……在抗击疫情关键时期，为配合上海全市“环境消杀突击行动”，上海市消防救援总队特勤支队组建了一支17人的疫情消杀党员突击队，赴浦东新区重点涉疫区域执行一线消杀任务。,火焰蓝 特勤支队 上海浦东,https://news.cctv.com/2022/04/23/ARTIxVR35kQ1jVM0TNctvCNj220423.shtml
