version_date,title,brief,keyword,url
2022-05-29 07:50:45,上海新增本土确诊病例29例和本土无症状感染者93例,2022年5月28日0—24时，上海新增本土新冠肺炎确诊病例29例和无症状感染者93例，其中18例确诊病例为既往无症状感染者转归，10例确诊病例和93例无症状感染者在隔离管控中发现。新增境外输入性新冠肺炎确诊病例3例和无症状感染者3例，均在闭环管控中发现。,确诊病例 感染者 无症状 本土 肺炎 卫健 新冠 转归 隔离 93例,https://news.cctv.com/2022/05/29/ARTI8yx2JSVWfT8H35lptdY3220529.shtml
2022-05-29 07:11:02,山东5月28日新增本土无症状感染者2例，系省外入鲁人员,据山东卫健委，2022年5月28日0时至24时，山东省报告无新增本土确诊病例。新增本土无症状感染者2例（系省外入鲁人员，乘坐列车抵达后均闭环转运至相关市集中隔离点，隔离期间检测发现）。无新增境外输入确诊病例。无新增境外输入无症状感染者。,感染者 确诊 病例,https://news.cctv.com/2022/05/29/ARTIIOfPqWdKWZUqcSOtsYHX220529.shtml
2022-05-29 06:57:40,云南5月28日新增无症状感染者6例，均为境外输入,5月28日0-24时，云南全省无新增确诊病例。现有境外输入确诊病例12例。累计确诊病例1512例，累计治愈出院病例1500例，无死亡病例。,确诊病例 死亡病例,https://news.cctv.com/2022/05/29/ARTIM22nn9nMN43Gfzz0AihD220529.shtml
2022-05-29 06:48:48,2021年人口数据背后：哈尔滨跌落千万人口序列 武汉成增量王者,5月28日，郑州人口流失200多万的新闻引发关注，后郑州市统计部门回应，2021年郑州市常住人口相较上一年增加了12.5万，总数达1274.2万，人口流失百万的消息是谣言。极目新闻记者梳理2021年国内多个城市发布的人口数据发现，事实上2021年，千万人口城市中常住人口减少最多的是天津和哈尔滨，其中哈尔滨2021年减少11.6万常住人口后，直接跌出了千万人口大城的行列，常住人口降至988.5万人。这也是哈尔滨常住人口首次跌破千万。,常住人口 人口变动 成都商报 十四五 黑龙江日报 人口自然增长率 预判 跌破 黑龙江省委书记 城市系统,https://news.cctv.com/2022/05/29/ARTI0cU7UUN5cnhf7potSbtD220529.shtml
2022-05-29 06:06:37,四川明确3个省域副中心，7城竞争最终哪几个胜出？,绵阳、德阳、乐山、宜宾、泸州、南充和达州等7个城市争创四川省域经济副中心的竞赛终于尘埃落定。四川为其中几个城市带上了“副中心”的桂冠。,副中心 域内经济 省域经济 经济区经济 四川省委书记 建设 组团 建成 挂牌 党代会,https://news.cctv.com/2022/05/29/ARTI2a65lp5fAdbMV8lwmKtk220529.shtml
2022-05-29 05:50:17,今年能产多少粮？农技专家麦田“体检”护丰收,作为全省率先开展夏收作业的地区之一，河南省邓州市的农技人员来到金色的麦田中，采集小麦预产的各项“体检”数据，为小麦即将开展的大规模收获做准备。,农技专家 麦田 体检,https://news.cctv.com/2022/05/29/ARTILgvy2rwn0ZmLLeVDY40L220529.shtml
2022-05-28 22:47:02,焦点访谈: “大食物观”让百姓餐桌更丰富,2022年的全国两会上，习近平总书记指出，要树立“大食物观”，从更好满足人民美好生活需要出发，掌握人民群众食物结构变化趋势。通过科技创新的手段提高食物产量，提升质量和多样性，同时开辟新的获取食物的途径，丰富老百姓的“菜篮子”，让老百姓从吃得饱到吃得好，再到吃得健康，这正是“大食物观”的出发点和落脚点。,大食物观 百姓餐桌 丰富,https://news.cctv.com/2022/05/28/ARTIle16xsuwl8pXgwXUG2CB220528.shtml
2022-05-28 21:18:23,星火成炬｜这精气神，赞！,幼儿园小朋友上演精彩篮球操、男孩参加平衡车挑战赛出发就摔倒却不服输逆袭夺得第一名、萌娃气场十足踢正步……中国儿童的精气神，赞！,星火成炬 精气神,https://news.cctv.com/2022/05/28/ARTIknav6VuEVxe3dGL3tErE220528.shtml
2022-05-28 20:26:39,江苏省公安厅原副厅长程建东接受纪律审查和监察调查,江苏省公安厅原副厅长程建东涉嫌严重违纪违法，目前正在接受江苏省纪委监委纪律审查和监察调查。,江苏省,https://news.cctv.com/2022/05/28/ARTIBlDo8kfG2oqzAbDcYlVm220528.shtml
2022-05-28 20:23:33,北京市体育局：5月29日起有序恢复体育健身场所开放经营活动,本市连续7日无新增社会面病例的区，各体育健身场所（位于地下空间的除外）在严格落实本市疫情防控部署要求和测温扫码、查证和查验48小时内核酸阴性证明等常态化防控措施基础上，按照50%限流开放。封管控区的体育健身场所应按照属地防控要求暂缓开放。,防控,https://news.cctv.com/2022/05/28/ARTIqRrn3H3N1mQdIDxxZglH220528.shtml
2022-05-28 20:22:13,【奋进新征程 建功新时代·走进老区看新貌】弘扬老区精神 推动治蜀兴川再上新台阶,党的十八大以来，在以习近平同志为核心的党中央坚强领导下，老区精神在四川薪火相传，激励着广大干部群众在新时代建功立业，推动治蜀兴川再上新台阶。,新征程 新时代 走进老区,https://news.cctv.com/2022/05/28/ARTIP631MtmwD13gydqi4KJg220528.shtml
2022-05-28 20:18:33,【奋斗者正青春】孟原召：择一事终一生 逐梦水下考古,今天（5月28日）的《奋斗者正青春》系列报道，我们来认识一位走遍祖国的五湖四海，十余年专注水下考古调查的年轻人——孟原召。,奋斗者 正青春 孟原召,https://news.cctv.com/2022/05/28/ARTIQASL2U28GENZTzHG11zR220528.shtml
2022-05-28 20:14:21,三部门联合推进中国债券市场统一对外开放,人民银行、证监会、国家外汇局27日发布公告，进一步便利境外机构投资者投资中国债券市场。据介绍，获准入市的境外机构投资者投资程序进一步简化，可投资范围从此前的银行间债券市场扩展到交易所债券市场，境外机构投资者可以直接或通过互联互通方式投资交易所债券市场，两种方式均无须另行办理备案或审批手续。,债券市场 对外开放,https://news.cctv.com/2022/05/28/ARTIOpUq9b25t8b0qMivN9dH220528.shtml
2022-05-28 20:13:23,上海稳妥有序恢复生产生活正常秩序,昨天（5月27日），上海本土确诊病例出院161例，解除医学观察的无症状感染者1737例。,上海 稳妥有序 恢复生产,https://news.cctv.com/2022/05/28/ARTIoLySOs4O57ng7CuXgrDE220528.shtml
2022-05-28 20:12:00,【奋进新征程 建功新时代·走进老区看新貌】弘扬老区精神 推动治蜀兴川再上新台阶,川陕革命老区在四川主要覆盖巴中、达州、广元、南充、绵阳等地区。党的十八大以来，在以习近平同志为核心的党中央坚强领导下，老区精神在四川薪火相传，激励着广大干部群众在新时代建功立业，推动治蜀兴川再上新台阶。,老区精神 治蜀兴川,https://news.cctv.com/2022/05/28/ARTIU8sTURnU5kZAolrRtjPR220528.shtml
2022-05-28 20:06:58,人民教育出版社关于小学数学教材插图问题的整改说明,近期，我社小学数学教材插图在网上受到批评和质疑，引起了社会各界对教材质量的担心。我们进行了认真反思，深感自责和内疚，在此表示深深的歉意。对于大家对我社中小学教材的关心表示真诚的感谢。,教材质量,https://news.cctv.com/2022/05/28/ARTIF1tIEw1a2jOrbcZolIGn220528.shtml
2022-05-28 19:57:04,【在希望的田野上·三夏时节】我国春播接近尾声 粮食生产形势良好,三夏时节，在夏粮主产区陆续开镰的同时，我国春播生产接近尾声。最新农情调度显示，春播面积增加，进度快、长势好，粮食生产形势良好。,春播 粮食生产,https://news.cctv.com/2022/05/28/ARTI8cve2X2rtDdlGsX651lF220528.shtml
2022-05-28 19:46:55,教育部关于人教版小学数学教材插图问题的回应,近期，人教版小学数学教材插图受到社会广泛关注，教育部高度重视。,小学数学,https://news.cctv.com/2022/05/28/ARTIWezmNWsqYDbcMpx4vq9D220528.shtml
2022-05-28 19:23:55,习近平在中共中央政治局第三十九次集体学习时强调 把中国文明历史研究引向深入 推动增强历史自觉坚定文化自信,推动全党全社会增强历史自觉、坚定文化自信，坚定不移走中国特色社会主义道路，为全面建设社会主义现代化国家、实现中华民族伟大复兴而团结奋斗。,习近平,https://news.cctv.com/2022/05/28/ARTIaIK9iKJhUv3NyOsZfrhq220528.shtml
2022-05-28 18:40:23,江西省宜春市人大常委会原党组成员、副主任胡江萍严重违纪违法被开除党籍和公职,日前，经中共江西省委批准，江西省纪委监委对宜春市人大常委会党组成员、副主任胡江萍严重违纪违法问题进行了立案审查调查。,党组成员 常委会 江西省,https://news.cctv.com/2022/05/28/ARTIaaPu7N2T5O8RwAZKwPVG220528.shtml
