version_date,title,brief,keyword,url
2022-05-29 22:41:24,4月全国共查处违反中央八项规定精神问题7441起,中央纪委国家监委网站29日公布全国查处违反中央八项规定精神问题情况月报数据。通报显示，今年4月，全国共查处违反中央八项规定精神问题7441起，批评教育帮助和处理11351人（包括33名地厅级干部、650名县处级干部），给予党纪政务处分7603人。,享乐主义 官僚主义 形式主义 奢靡之风,https://news.cctv.com/2022/05/29/ARTI79LdcMhSuhFrYsKuuZlW220529.shtml
2022-05-29 22:23:45,焦点访谈：新疆人民的幸福生活,党的十八大以来，以习近平同志为核心的党中央高度重视新疆工作，形成了新时代党的治疆方略，新疆经济社会发展和民生改善取得了前所未有的成就。,焦点访谈 幸福生活,https://news.cctv.com/2022/05/29/ARTIm35CV2YTeglMH3n9cK5c220529.shtml
2022-05-29 21:43:34,星火成炬｜中国的，也是世界的,外国人眼中的中国文化有多惊艳？来看看他们是怎么被“征服”的吧～,星火成炬 中国,https://news.cctv.com/2022/05/29/ARTIW8FceI8R78lF16sAHH7N220529.shtml
2022-05-29 20:57:59,习近平总书记关切事丨这些暖心故事，温暖了天山南北,要以铸牢中华民族共同体意识为主线，不断巩固各民族大团结。,习近平,https://news.cctv.com/2022/05/29/ARTI5Nud5KAtbU2Zf5Bck4cR220529.shtml
2022-05-29 20:54:50,【习声回响】幸福是奋斗出来的 你们都在奋斗，很好！,要探索建立稳定脱贫长效机制，强化产业扶贫，组织消费扶贫，加大培训力度，促进转移就业，让贫困群众有稳定的工作岗位。,习近平,https://news.cctv.com/2022/05/29/ARTIgdHbbSJLlwmJqAK3oJEI220529.shtml
2022-05-29 20:47:21,第一报道 | 构建人类卫生健康共同体 中国贡献获赞誉,第75届世界卫生大会5月28日在瑞士日内瓦落幕。两年前，中国国家主席习近平在第73届世界卫生大会视频会议开幕式致辞中呼吁，共同构建人类卫生健康共同体。,习近平,https://news.cctv.com/2022/05/29/ARTIJNJdoEITu1Ou0lPljrx5220529.shtml
2022-05-29 20:38:47,毛伟明在江西萍乡考察学习时强调 一声“老表” 道出湘赣渊源亲情 一方“热土” 成就老区振兴新业,28日，省委副书记、省长毛伟明率队赴江西省萍乡市考察学习，深入对接湘赣边区域合作。,湘赣 区域合作 城市更新 毛伟明,https://news.cctv.com/2022/05/29/ARTIBMZME8xxjSl6BpCLjXjS220529.shtml
2022-05-29 20:33:59,【奋进新征程 建功新时代·走进老区看新貌】山东：传承沂蒙精神 谱写发展新篇,山东有18个县市区属于沂蒙革命老区。党的十八大以来，在以习近平同志为核心的党中央坚强领导下，山东弘扬沂蒙精神，锐意改革，敢创新路，全面推进乡村振兴，开创新时代社会主义现代化强省建设新局面。,走进老区看新貌,https://news.cctv.com/2022/05/29/ARTIhCul1NOgamh3an7gedog220529.shtml
2022-05-29 20:25:39,上海出台加快经济恢复和重振行动方案,昨天（5月28日），上海本土确诊病例出院114例，解除医学观察的无症状感染者1324例。,上海 经济恢复和重振,https://news.cctv.com/2022/05/29/ARTIzW7yG4q0NKYc9eImVI9i220529.shtml
2022-05-29 20:21:45,上海出台加快经济恢复和重振行动方案,昨天（5月28日），上海本土确诊病例出院114例，解除医学观察的无症状感染者1324例。,上海 同心抗疫,https://news.cctv.com/2022/05/29/ARTIaaCBdPAkhTpROHV0XpPD220529.shtml
2022-05-29 20:20:15,北京分区分级动态实施社会面防控措施,北京本轮疫情已得到有效控制，今天（5月29日）开始分区分级动态实施全市社会面防控措施。,北京 分区分级 社会面,https://news.cctv.com/2022/05/29/ARTIkiCLAvE3iOrax1Cg5Uxb220529.shtml
2022-05-29 20:12:06,河北三河：今日23时起全域实施静态管理，继续开展筛查性全员核酸检测,近日，廊坊市已累计发现10例以上阳性病例，且传播链条尚在流调溯源中，按照上级统一安排部署，将在廊坊全域内开展全员核酸检测，期间全市整体实施静态管理。,核酸检测 采样 社区,https://news.cctv.com/2022/05/29/ARTIzZTGo23It8WgEPWbwd7R220529.shtml
2022-05-29 20:10:16,叶建春毛伟明在萍乡调研推进湘赣边区域合作 红色和绿色交相辉映 发展与民生比翼齐飞 齐心协力书写湘赣边区域合作新篇章,5月28日，省长叶建春和湖南省省长毛伟明在萍乡共同调研推进湘赣边区域合作。,湘赣 区域合作 生态立省 安源路矿工人运动纪念馆 示范区建设 红色文化 罗霄山 互联互通 红色旅游 互鉴,https://news.cctv.com/2022/05/29/ARTImlrLZZqU8koiBlnxcxue220529.shtml
2022-05-29 20:08:57,【党旗在基层一线高高飘扬】仙林街道：“小网格”绘就“同心圆”,南京市栖霞区仙林街道集高校、商业区、高档商品房和拆迁安置房小区于一体，外来人口多，群众诉求复杂、各种矛盾叠加。面对基层治理的新难题，当地通过“网格化”党建的新做法绘就出共建美好社区的“同心圆”。,党旗 基层 仙林街道,https://news.cctv.com/2022/05/29/ARTIwihonBG9l1XSB5ObihUJ220529.shtml
2022-05-29 20:04:18,全面入汛在即！水利部对水库安全度汛和山洪灾害防御进行再部署再落实,水利部向各省、自治区、直辖市水利（水务）厅（局）、新疆生产建设兵团水利局和各流域管理机构发出通知，有针对性对水库安全度汛和山洪灾害防御进行再部署再落实，全面压紧压实责任，确保防汛安全。,灾害防御 水利部,https://news.cctv.com/2022/05/29/ARTITQ3gezrQgNR4XfPsIjRW220529.shtml
2022-05-29 20:02:33,一线调研：为了2280家就业工厂一个都不少,今年以来，多点散发的疫情让这些工厂和车间遇到了前所未有的挑战，如何稳住脱贫劳动力的岗位，让他们有活干、有钱挣？来看记者在甘肃临夏的一线调研。,一线调研 就业工厂,https://news.cctv.com/2022/05/29/ARTI2ShzxkaKfjBa9hHcwPPu220529.shtml
2022-05-29 19:59:04,省政府召开全省稳经济工作电视电话会议,5月28日上午，省政府召开全省稳经济工作电视电话会议，贯彻落实全国稳住经济大盘电视电话会议精神，按照省委部署要求，动员各地各部门以分秒必争的状态抓好当前稳经济工作。省长王清宪出席会议并讲话。,经济工作 王清宪 经济社会发展 全省 经济运行 经济措施 工作机制 电视电话会议 省政府,https://news.cctv.com/2022/05/29/ARTIjNxOtqd1UaFPT8UYfFj2220529.shtml
2022-05-29 19:53:43,贵州壮大数字经济 培育发展动力,作为全国首个大数据综合试验区，贵州抢抓机遇，实施数字产业强链行动，培育壮大数字经济，推动高质量发展。,贵州 数字经济 发展动力,https://news.cctv.com/2022/05/29/ARTIqMwHbggtQ2sQ16mUaqVE220529.shtml
2022-05-29 19:50:09,我国能源供需总体平稳有序,记者从国家发展改革委了解到，目前，我国能源供给能力持续提升，能源供需总体平稳有序。,能源 供需 平衡有序,https://news.cctv.com/2022/05/29/ARTIoKtlEDWYE4CFRV7eKW5d220529.shtml
2022-05-29 19:44:37,【在希望的田野上·三夏时节】我国夏粮大面积开镰收获,今天（5月29日），全国冬小麦日机收面积连续三天超过500万亩，夏粮主产区河南、安徽进入集中收获期，标志着夏粮大面积收割全面展开。,夏粮 大面积 开镰收获,https://news.cctv.com/2022/05/29/ARTIELTSNS6YFLAAXmjgGYXT220529.shtml
2022-05-29 19:42:05,【奋进新征程 建功新时代·走进老区看新貌】山东：传承沂蒙精神 谱写发展新篇,山东有18个县市区属于沂蒙革命老区。党的十八大以来，在以习近平同志为核心的党中央坚强领导下，山东弘扬沂蒙精神，锐意改革，敢创新路，全面推进乡村振兴，开创新时代社会主义现代化强省建设新局面。,新征程 新时代 山东,https://news.cctv.com/2022/05/29/ARTIBlsJITWReI4beO3VZinK220529.shtml
2022-05-29 19:41:19,我省年轻干部政治教育研究中心成立大会暨中青班政治辅导员工作研讨会举行,5月28日，我省年轻干部政治教育研究中心成立大会暨中青班政治辅导员工作研讨会在南京举行。省委书记吴政隆作出批示。省委常委、省委组织部部长、省委党校校长赵世勇出席成立大会并讲话。,吴政隆 中青班 政治教育 党校,https://news.cctv.com/2022/05/29/ARTI7CxvkM2fz0Chw67kBdrL220529.shtml
2022-05-29 19:36:42,范扬推出《渡水罗汉》祈愿吉祥安康抗疫必胜,近日，我国著名书画大家、中国国家画院和中国艺术研究院研究员范扬先生，精心绘制了一幅中国画精品力作《渡水罗汉》，祈愿国泰民安、抗疫必胜。,范扬 渡水罗汉,https://news.cctv.com/2022/05/29/ARTImaFjEthntcDyAmR05shH220529.shtml
2022-05-29 19:22:21,合肥：暂停中同蓝博在肥检测服务，待全面检查完成后视情况恢复,“合肥发布”微信公众号5月29日通报，5月28日，北京通报发现“北京中同蓝博医学检验实验室”在核酸检测过程中涉嫌违法犯罪。北京警方已对该实验室立案侦查，将法定代表人张某某（男，52岁）等人查获，案件正在进一步工作中。信息发布后，合肥市快速行动，对该公司在合肥的核酸检测机构启动检查工作，对其留存的样本进行全面排查复核。截至17:50，暂未发现异常情况。据了解，为更细致稳妥的做好相关工作，将暂停该公司在合肥的检测服务。待全面检查完成后，视情况恢复，敬请市民放心。,合肥 北京 核酸,https://news.cctv.com/2022/05/29/ARTIJwWaUGyYav6ohD6BE1Pg220529.shtml
2022-05-29 18:06:39,交通运输部：5月28日全国高速公路货车通行701.06万辆 环比下降5%,国务院物流保通保畅工作领导小组办公室监测汇总数据显示，5月28日，全国货运物流总体有序运行，持续恢复。,环比 全国高速公路 货车通行,https://news.cctv.com/2022/05/29/ARTI2Ih5dkDnXbvzXPShgdib220529.shtml
2022-05-29 18:05:54,宏观布局 精巧写实——《艺术里的奥林匹克》带您赏析油画《桌球》,《艺术里的奥林匹克》第五十六期总台央视奥林匹克频道5月29日20:10首播。,艺术里的奥林匹克,https://news.cctv.com/2022/05/29/ARTIS7KvrvUYDsIAV8taijhT220529.shtml
2022-05-29 18:04:45,水利部和中国气象局5月29日18时联合发布橙色山洪灾害气象预警,预计，5月29日20时至5月30日20时，浙江西南部、福建北部、江西东北部、新疆西部等地部分地区发生山洪灾害可能性较大（黄色预警），局地发生山洪灾害可能性大（橙色预警）。,水利部 中国气象 山洪灾害,https://news.cctv.com/2022/05/29/ARTI4bifcNQR4XqOXJ9tbIUb220529.shtml
2022-05-29 18:00:24,习近平“典”明科技工作者前进方向,坚定创新自信，紧抓创新机遇。,习近平,https://news.cctv.com/2022/05/29/ARTIUTpYEHjnK2ac0JFuhhA0220529.shtml
2022-05-29 17:56:32,习言道 | 中华文明是维系全世界华人的精神纽带,中华文明源远流长、博大精深。,习近平,https://news.cctv.com/2022/05/29/ARTIsy5gzTjfl6XdcLw02rZX220529.shtml
2022-05-29 17:43:11,长征五号B遥三运载火箭安全运抵文昌航天发射场,据中国载人航天工程办公室消息，执行问天实验舱发射任务的长征五号B遥三运载火箭已完成出厂前所有研制工作，于2022年5月29日安全运抵文昌航天发射场。,长征五号 运载火箭,https://news.cctv.com/2022/05/29/ARTI615NMG7d7za7CxnLCFYP220529.shtml
2022-05-29 17:41:44,国家防总：各级责任人要靠前指挥 下沉一线组织灾害防范和抢险救灾,近日，我国南方遭遇强降雨，多条河流发生超警、超保洪水，多地发生山洪和地质灾害。国家防总今天继续维持防汛Ⅳ级应急响应，工作组和专家组继续在福建省、江西省协助指导地方做好强降雨防范应对工作。,抢险救灾 救灾资金,https://news.cctv.com/2022/05/29/ARTI75JLxaZ8IVuqs6kMtHly220529.shtml
2022-05-29 17:40:56,江南水乡“庆端午 划菱桶”,5月28日，浙江省湖州市吴兴区东林镇举办第九届“庆端午 划菱桶”趣味活动。,江南水乡 庆端午 划菱桶 湖州,https://photo.cctv.com/2022/05/29/PHOA1BNhPGgwpBSjQJeWVzUW220529.shtml
2022-05-29 17:31:00,北京已连续7天新增病例数明显下降 连续2天无新增社会面病例,今天（29日），北京市召开第349场新冠肺炎疫情防控工作新闻发布会。发布会上通报，今天（5月29日）0时至15时，新增本土新冠肺炎病毒感染者7例，其中海淀区6例，西城区1例；均为隔离观察人员，社会面筛查人员为零。均已转至定点医院隔离治疗，相关风险点位及人员已管控落位。目前，北京已连续7天新增病例数明显下降，连续2天无新增社会面病例。,北京 新增病例数 明显下降,https://news.cctv.com/2022/05/29/ARTIlTabQFpoT1FZKGzFj4qx220529.shtml
2022-05-29 17:16:32,北京：考务人员全部落实三个100%,市委教育工委副书记、市教委新闻发言人李奕介绍，本市考务人员全部落实三个百分之百，即100%接种疫苗，100%进行考前14天的健康监测，100%持48小时内核酸检测的阴性证明。“届时只有满足这三个条件，考务人员才能够上岗。”,考场 北京高考 考点,https://news.cctv.com/2022/05/29/ARTIVMlopfrMzb4P4cI53XmG220529.shtml
2022-05-29 17:07:31,2022年北京市高考将于6月7日至10日进行,5月29日，在北京市新型冠状病毒肺炎疫情防控工作第349场新闻发布会上，市委教育工委副书记、市教委新闻发言人李奕介绍，2022年全市高考报名考生共5.4万人，考试将于6月7日至10日进行。,北京市 高考,https://news.cctv.com/2022/05/29/ARTIXADB30FsSG81vkC94DVM220529.shtml
2022-05-29 17:03:01,北京：外卖人员每日一核酸，持近三日三次阴性证明方可接单,5月29日，在北京市新型冠状病毒肺炎疫情防控工作第349场新闻发布会上，市委宣传部副部长、市政府新闻办主任、市政府新闻发言人徐和建介绍，本市多措并举做好电商平台和外卖人员的防疫和保供工作。,阴性 核酸检测 外卖,https://news.cctv.com/2022/05/29/ARTIsQNFKKZ9wZbposYhdkQB220529.shtml
2022-05-29 17:00:11,北京：封管控区等重点涉疫区域在充分评估基础上将及时解封,5月29日，在北京市新型冠状病毒肺炎疫情防控工作第349场新闻发布会上，市委宣传部副部长、市政府新闻办主任、市政府新闻发言人徐和建介绍，本市分区分级动态实施全市社会面防控措施，对封管控区等重点涉疫区域，在充分评估基础上符合条件的及时解封。,北京市 疫情防控,https://news.cctv.com/2022/05/29/ARTIhuQNQpxijPHZepqrc1Wk220529.shtml
2022-05-29 16:50:17,北京两地调整为低风险地区,北京召开新冠疫情防控第349场新闻发布会，通报疫情最新情况。,北京市 疫情防控,https://news.cctv.com/2022/05/29/ARTIOY3X58QKk4MUTZ7Gd9fx220529.shtml
2022-05-29 16:47:16,北京：东方广场已完成消杀，将有序分步分区解封,5月29日，在北京市新型冠状病毒肺炎疫情防控工作第349场新闻发布会上，市委宣传部副部长、市政府新闻办主任、市政府新闻发言人徐和建介绍，东方广场已经完成消杀任务，经专家评估后，有序分步分区解封，尽快恢复营业。,解封 消杀 东方广场,https://news.cctv.com/2022/05/29/ARTIX5j9WF180DONd36TMOUf220529.shtml
2022-05-29 16:46:27,4月22日至今天15时，北京累计报告1730例感染者,北京召开新冠疫情防控第349场新闻发布会，通报疫情最新情况。,北京市 疫情防控,https://news.cctv.com/2022/05/29/ARTIXbugZq3UjTYKyUriVN0s220529.shtml
2022-05-29 16:45:17,29日0时至15时，北京新增本土新冠肺炎病毒感染者7例,北京召开新冠疫情防控第349场新闻发布会，通报疫情最新情况。,北京市 疫情防控,https://news.cctv.com/2022/05/29/ARTIjBVUpY7ZeEEkHqYOjUZ4220529.shtml
2022-05-29 16:41:02,北京已连续两天无新增社会面病例,北京召开新冠疫情防控第349场新闻发布会，通报疫情最新情况。,北京市 疫情防控,https://news.cctv.com/2022/05/29/ARTIO2iKq0q5P2mz6gNIoyaR220529.shtml
2022-05-29 16:34:18,防范暴雨 郑州京广路隧道加装逃生梯,5月28日，郑州京广路隧道现“生命之梯”，借助该梯可从隧道底部攀爬至上方路面。,防范 暴雨 郑州 京广路隧道 加装 逃生梯,https://photo.cctv.com/2022/05/29/PHOAyGn0A3BOGVQCEDrGOYwd220529.shtml
2022-05-29 16:33:17,北京：六旬母亲与植物人女儿的4000个日夜,根据流行病学统计数据显示，植物人的平均生存时间不到3年。多年来，潘云妹用常人难以想象的付出打破了无数个不可能。,植物人 北京 母亲 母爱 坚守,https://photo.cctv.com/2022/05/29/PHOAaci9FEcPf0MFmnIw7ppV220529.shtml
2022-05-29 16:32:00,中国“蓝盔”成为联合国维护和平的关键力量,今天（5月29日）是第20个“国际维和人员日”，这一纪念日是为了缅怀为联合国维和任务而献身的国际维和人员。今年的主题为“人民、和平、进步：伙伴关系的力量”。自1990年开始，一批又一批中国维和军人前赴后继，向险而行，为世界和平英勇出征，用行动彰显担当。近日，中国维和官兵们在维和一线开展不同形式的纪念活动。,国际维和人员日 中国维和军人 纪念活动,https://news.cctv.com/2022/05/29/ARTIgRDqw4pZRdJbMjfw4pJk220529.shtml
2022-05-29 16:23:21,奋进新征程 建功新时代·伟大变革丨让东北虎乡“虎虎生威”,吉林省延边朝鲜族自治州珲春市刚下过几场雨，市郊山林里崎岖的小路泥泞不堪。37岁的赵岩深一脚浅一脚地在山里巡护，一边寻找合适位置架设新的红外相机。这片山林位于东北虎豹国家公园辖区之内，现在正是雌虎带着幼崽学习野外生存技能的时节，赵岩特别期待能监测到新的“虎娃”。,生态因子 东北虎乡 国家公园 虎豹 巡护 征程 虎娃 虎虎生威 约会 红外相机,https://news.cctv.com/2022/05/29/ARTIpHh2120xlqyMW3VNczqP220529.shtml
2022-05-29 16:19:29,上海6月1日入汛，中高考考点、方舱医院等地预置抢险队伍,上海即将进入汛期，防汛部门会有什么应急处置预案？,上海市防汛办 中高考 方舱医院,https://news.cctv.com/2022/05/29/ARTIhlgCaFjic0TNDXw14N43220529.shtml
2022-05-29 16:17:19,山西：抓住发展“金钥匙”  开启转型“新篇章”,2017年6月、2020年5月、2022年1月，习近平总书记5年3次来到山西视察调研，为山西转型发展掌舵，为百姓幸福生活领航。三晋儿女牢记嘱托、踔厉笃行，凝心聚力开启山西发展新篇章。,山西 转型 新篇章 金钥匙 绿色开采,https://news.cctv.com/2022/05/29/ARTIgH0NHhnDjuTgJic6a8pl220529.shtml
2022-05-29 16:07:01,【每日一习话】为维护世界和平贡献更多中国力量,中国人民热爱和平、渴望和平，坚定不移走和平发展道路。,习近平,https://news.cctv.com/2022/05/29/ARTIz1oNzsK3YoNFiGb3dU6q220529.shtml
2022-05-29 16:04:42,上海超1.4万户新设企业疫情期间“全程网办”取得营业执照,疫情期间，上海市市场监管局借助一窗通网上服务平台，为投资者提供互联网在线申办、在线签署、在线领照，企业登记等政务服务，做到全程网办“不打烊”，保障上海开办企业“不断档”。,上海 市场监管局 疫情 全程网办 营业执照,https://news.cctv.com/2022/05/29/ARTIOlGhUIawqAwU5KDqEXmu220529.shtml
2022-05-29 16:04:37,全国“三夏”大规模小麦机收全面展开,截至5月28日，全国已收获冬小麦面积3798万亩，日机收面积678万亩，四川麦收进入尾声，湖北进度过八成，河南、安徽进入集中收获期、进度过一成，江苏、陕西、山西等省陆续开镰，标志着全国“三夏”大规模小麦机收全面展开。,全国 三夏,https://news.cctv.com/2022/05/29/ARTICiTJDOccMIlKCPamoAzY220529.shtml
2022-05-29 15:57:19,553个免费采样点一键可查，北京朝阳打造15分钟核酸检测服务圈,为最大限度方便市民就近进行常态化核酸检测，朝阳区进一步优化核酸采样点布局，按照“科学规划、便民利民、距离合理”的原则，全力打造“15分钟核酸检测服务圈”。,核酸 采样点 常态化 便民,https://news.cctv.com/2022/05/29/ARTId9WU7oEVNAoxIWt432DD220529.shtml
2022-05-29 15:41:36,广西梧州：黄金水道云雾飘渺,5月29日，广西梧州市西江黄金水道两岸云雾缥缈，如梦如幻。,广西 梧州 黄金水道 云雾飘渺,https://photo.cctv.com/2022/05/29/PHOANuUDuothKhfhGMfXqRig220529.shtml
2022-05-29 15:35:06,前4月国企营业总收入同比增9.8%,1—4月，国有企业营业总收入保持增长；受去年同期基数较高、近期疫情多点散发等影响，利润总额同比下降，国有经济下行压力加大。,同比增长 国有企业 国企 中央企业 总收入 国有控股企业 国有经济 利润总额 下行压力 资产负债率,https://news.cctv.com/2022/05/29/ARTIdswlo4PKiy0uwrNIwfgD220529.shtml
2022-05-29 15:34:44,自然资源部派出66名专家支持基层地质灾害防御,针对南方地区陆续进入主汛期的情况，自然资源部派出66名专家分赴各地，加强基层地质灾害防御技术支持，指导趋势研判、监测预警和避险转移。,自然资源部 专家 支持 基层地质灾害防御,https://news.cctv.com/2022/05/29/ARTIc2PiqMz1y73WDj2eoNIK220529.shtml
2022-05-29 15:31:51,【奋进新征程 建功新时代•老区新貌】湘鄂渝黔革命老区 茶香果甜滋味长,阳光明媚的五月，湘鄂渝黔革命老区煦风和畅。当年播撒革命火种的一片片红色沃土，如今正演绎着乡村振兴的绿色传奇。,湘鄂渝黔 革命老区 茶香果甜,https://news.cctv.com/2022/05/29/ARTILOEZPGncARPzSiu0EhQN220529.shtml
2022-05-29 15:29:51,奋进新征程 建功新时代·老区新貌丨“红岭公路”串起大别山区振兴新希望,通过红岭公路的三条路线，不仅将沿线的村落、景区景点连成一体，还把金寨县丰富的红色旅游资源融入其中，打造红色旅游体系，助力当地乡村旅游发展。,中国红 金寨县 绿色食品 景区,https://news.cctv.com/2022/05/29/ARTIQySBT527LnjfTRtJih3L220529.shtml
2022-05-29 15:18:36,【走进老区看新貌】多种产业同发展 家乡门口把钱赚,今天的沂蒙老区不仅是产业兴、活力足，发展也更具智慧。接下来，让我们一起去整个老区海拔最高的区域——山东沂源，这里是沂蒙革命老区重要组成部分。革命战争年代，全县有2.3万人参军参战，1800多人壮烈牺牲。这里森里覆盖率很高，林果业也很发达。这些年，随着当地产业结构调整，一二三产共同发展，老区人民用勤劳和智慧绘就了一幅老区新貌图。现在的沂源有什么特色？,走进老区看新貌 产业发展,https://news.cctv.com/2022/05/29/ARTInOstSoES4w6KF4lb64Bm220529.shtml
2022-05-29 15:17:11,【走进老区看新貌】小地摊到大市场 老区商贸迭代变迁,依托国家对革命老区的政策支持，临沂目前已成为闻名全国的物流之都，拥有约6万个商铺摊位，成为我国贸易往来的枢纽之一。刚才我们记者也提到了，这里有120多个专业市场，商品创新也是层出不穷。众多商品，不仅产自临沂商城，而且通过临沂繁荣的商贸物流业，把他们卖到了全国，甚至全世界。,走进老区看新貌 地摊,https://news.cctv.com/2022/05/29/ARTINyoOKBTAC2AcWRkR3KZk220529.shtml
2022-05-29 15:13:17,上海全年将为市场主体减负3000亿元,上海市政府副秘书长、市发改委主任华源介绍，经初步测算，这一轮的行动方案所提出的政策措施，叠加3月底市政府出台的上一轮的21条政策，预计全年将为市场主体减负各类资金规模达到3000亿元以上。,市场主体 全年 资金规模,https://news.cctv.com/2022/05/29/ARTIr7rD8gI6odONPQv3Z1Tm220529.shtml
2022-05-29 14:59:47,上海：招录本市2022届高校毕业生的用人单位 按每人补贴2000元,上海市政府发布《上海市加快经济恢复和重振行动方案》。对招录登记失业三个月以上人员或我市2022届高校毕业生，签订一年以上劳动合同并按规定缴纳社会保险费的用人单位，按每人2000元给予一次性吸纳就业补贴。,高校毕业生 用人单位 招录,https://news.cctv.com/2022/05/29/ARTILh7S1Osf0lBtP0zgOTtq220529.shtml
2022-05-29 14:58:53,【走进老区看新貌】物畅其流 “物流之都”释放澎湃活力,作为革命老区的临沂，因为交通闭塞，曾被形容为“四塞之固，舟车不通，内货不出，外货不入”；这十年来，临沂市场迎来跨越式发展，这其中离不开一个关键词——“物流”。,走进老区看新貌 物流之都,https://news.cctv.com/2022/05/29/ARTIQRkPCKFi8EdoqE5GLONh220529.shtml
2022-05-29 14:58:07,【走进老区看新貌】小红薯串起大产业 种植加工全链条,这里是济宁市泗水县。在抗日战争时期，当地群众多次英勇抗击日军的进攻。,山东泗水 走进老区看新貌 红薯,https://news.cctv.com/2022/05/29/ARTInxUcgehTl7xgMMMMvpTd220529.shtml
