version_date,title,brief,keyword,url
2022-05-27 13:38:57,国务院第十一督查组来川开展专项督查并召开视频见面暨工作情况汇报会 黄强俞家栋讲话,按照国务院统一部署，国务院第十一督查组来川开展稳增长稳市场主体保就业专项督查。,黄强,https://news.cctv.com/2022/05/27/ARTIUIipB9aBG5tSSGZrRxCX220527.shtml
2022-05-27 13:37:22,郑州：明日在金水区等8个城区开展核酸筛查,为切实保障人民群众身体健康和生命安全，着力破解隐匿传播风险，牢牢掌握疫情防控主动权，建立常态化重点筛查、定期筛查、全员筛查核酸检测机制，经市新冠肺炎疫情防控指挥部研究，决定在金水区等8个城区（含开发区）开展核酸筛查。,采样 核酸 采样点,https://news.cctv.com/2022/05/27/ARTIsxZrqkCkLLztUtdRHqy4220527.shtml
2022-05-27 13:37:11,中共四川省委召开党外人士座谈会 征求对省第十二次党代会《报告》稿的意见建议 王晓晖主持并讲话 黄强田向利出席,中国共产党四川省第十二次代表大会召开前夕，中共四川省委在成都召开党外人士座谈会，听取各民主党派省委、省工商联负责人和无党派人士代表对省第十二次党代会《报告》稿的意见建议。,王晓晖 黄强 田向利,https://news.cctv.com/2022/05/27/ARTInaGqecsINdg0DA0L6ryW220527.shtml
2022-05-27 13:35:04,中国共产党四川省第十二次代表大会举行预备会议 王晓晖主持并讲话,5月26日下午，中国共产党四川省第十二次代表大会预备会议在成都举行。王晓晖主持会议并讲话。,王晓晖,https://news.cctv.com/2022/05/27/ARTItqQTSyipoVK2YErsBLXl220527.shtml
2022-05-27 13:33:30,中国共产党四川省第十二次代表大会主席团举行第一次会议,5月26日下午，中国共产党四川省第十二次代表大会主席团举行第一次会议。,四川,https://news.cctv.com/2022/05/27/ARTIfe8DXFgMbit579yjnszb220527.shtml
2022-05-27 13:30:38,数字经济法治论坛开幕 周强致辞表示 推动数字经济法治建设 为完善全球数字治理体系贡献智慧和力量 袁家军出席并致辞,26日下午，由中国最高人民法院主办、浙江省高级人民法院承办的数字经济法治论坛开幕。,周强 袁家军,https://news.cctv.com/2022/05/27/ARTIUyKqnS3DoKL31nuUgadV220527.shtml
2022-05-27 13:28:24,黄莉新在杭州调研历史文化遗产保护利用时强调 保护传承好历史文脉 擦亮浙江文化金名片,5月24日，省政协主席黄莉新率队在杭围绕加强历史文化遗产保护利用开展专题调研。,黄莉新,https://news.cctv.com/2022/05/27/ARTIjJJLqSU9xx7aJzvSRBTc220527.shtml
2022-05-27 13:26:46,全省职业教育大会召开 加快构建具有浙江特色的现代职业教育体系 袁家军王浩批示 黄建发讲话,26日，全省职业教育大会在杭召开。会议深入贯彻习近平总书记关于职业教育的重要指示精神，全面落实全国职业教育大会精神，总结工作、交流经验，研究部署下一阶段工作。省委书记袁家军，省委副书记、省长王浩作出批示。省委副书记黄建发讲话。,袁家军 王浩,https://news.cctv.com/2022/05/27/ARTIaHnyjl0YB2cqeJEzbOmu220527.shtml
2022-05-27 13:23:48,国务院第一督查组来辽开展 稳增长稳市场主体保就业专项督查 梁涛李乐成出席有关会议,按照国务院统一安排，督查组组长、中国银行保险监督管理委员会副主席梁涛率领国务院第一督查组到辽宁开展为期6天的实地督查。5月26日，督查组与省政府举行工作衔接会。梁涛主持会议并讲话，省委副书记、省长李乐成汇报有关工作并作表态发言。,李乐成,https://news.cctv.com/2022/05/27/ARTIjluOhBxHxRaV6J9SCvNE220527.shtml
2022-05-27 13:21:30,省委常委会召开会议 深入学习贯彻习近平总书记重要讲话和指示精神 张国清主持会议,5月26日，省委常委会召开会议，深入学习习近平总书记重要讲话和指示精神，研究部署我省贯彻落实工作。省委书记张国清主持会议。,张国清,https://news.cctv.com/2022/05/27/ARTIEBwASCof1Gtt3BFfZ3r1220527.shtml
2022-05-27 12:43:07,明日起，北京地铁西二旗站、火器营站封站,据@北京地铁 微博消息，根据疫情防控工作需要，自2022年5月28日（周六）首班车起，地铁10号线火器营站、13号线西二旗站、昌平线西二旗站封站，乘客可在西二旗站进行站内换乘。,北京,https://news.cctv.com/2022/05/27/ARTIeC5VPK5nMEkMemq7HsSP220527.shtml
2022-05-27 12:39:29,江西省委教育工委原副书记肖志华受贿案一审开庭，将择期宣判,据“江西法院”微信公众号消息，2022年5月27日上午，新余市中级人民法院一审公开开庭审理了江西省委教育工委原副书记肖志华受贿一案。新余市人民检察院派员出庭支持公诉，被告人肖志华及其辩护人到庭参加诉讼。,肖志华 江西省委教育工委,https://news.cctv.com/2022/05/27/ARTIXKMMtdwXA3SFeqcdDCyk220527.shtml
2022-05-27 12:37:11,把祖国北疆这道风景线建设得更加亮丽（沿着总书记的足迹·内蒙古篇）,内蒙古是我国最早成立民族自治区、党的民族区域自治制度最早付诸实施的地方，地处祖国北疆，战略地位十分重要。,祖国 北疆 风景线 亮丽 内蒙古,https://news.cctv.com/2022/05/27/ARTI5bS7B6fGaDizHgtBh0Iu220527.shtml
2022-05-27 12:35:15,“不能把手里吃饭的家伙先扔了”,作为国家重要能源和战略资源基地，内蒙古在保障我国能源安全中担负重任。,能源发展 煤炭 十四五 能源企业,https://news.cctv.com/2022/05/27/ARTI2OyXrsGSRMPAK7oyfjVB220527.shtml
2022-05-27 12:32:56,银保监会：目标到2025年保险标准化工作机制进一步完善,银保监会5月27日发布《保险业标准化“十四五”规划的通知》。,银保监会,https://news.cctv.com/2022/05/27/ARTIeI5XPK69SWRyMlPVAm73220527.shtml
2022-05-27 12:06:18,重大工程建设 | 国内最大跨度单层悬索桥全桥主塔封顶,26日，随着最后一方混凝土在200多米高空注入主塔，位于江苏南京的南京仙新路长江大桥实现全桥主塔封顶。,国内最大 跨度单层悬索桥 全桥主塔封顶,https://news.cctv.com/2022/05/27/ARTI1lAadtJS47QtmRES3sje220527.shtml
2022-05-27 12:05:47,“一湾一策”推进“美丽海湾”建设 七里海潟湖湿地将达7.6平方公里,近年来，河北大力实施陆源污染防治、海洋污染防治、生态保护修复等措施，使得渤海近岸海域生态环境明显改善。目前，秦皇岛13条入海河流水质全部达到地表Ⅲ类水质标准，秦皇岛湾北戴河段还被生态环境部正式定为“2021美丽海湾优秀案例”。,渤海近岸海域 生态环境 改善 七里海潟湖湿地,https://news.cctv.com/2022/05/27/ARTI8bNnq44j6fejdALYvRtp220527.shtml
