version_date,title,brief,keyword,url
2022-04-24 13:13:28,北京通州区发现1例新冠病毒核酸检测阳性人员,4月24日，通州区疾病预防控制中心接第三方检测机构报告1件混采样本初筛新冠病毒核酸阳性。,核酸 通州区 采样,https://news.cctv.com/2022/04/24/ARTIwm3w7RMHErc813seGLz5220424.shtml
2022-04-24 13:11:57,专家解读：核酸检测和抗原检测有什么特点和不同？,日前，总台记者对国务院联防联控机制综合组上海工作组专家、国家卫生健康委医疗管理服务指导中心处长赵靖进行了采访，他介绍了核酸检测和抗原检测的特点和不同。,抗原 核酸检测,https://news.cctv.com/2022/04/24/ARTI4JdfW2uZd4MKPlsrqKy5220424.shtml
2022-04-24 13:10:00,专家解读：为什么核酸检测如此重要？,日前，总台记者对国务院联防联控机制综合组上海工作组专家、国家卫生健康委医疗管理服务指导中心处长赵靖进行了采访，他表示在与病毒赛跑时核酸检测至关重要。,核酸检测 指导中心,https://news.cctv.com/2022/04/24/ARTI0hj7uXTTbFQwhpiLylQI220424.shtml
2022-04-24 12:53:55,北京西城区发现一名密接者核酸阳性,4月24日，西城区发现一名密切接触者核酸检测结果为阳性。该人员在对位于其他区的住所进行装修的过程中，于4月22日与北京市通报的第145号感染者有过接触。当日返回西城区大栅栏街道百顺社区的暂住地后未外出。,核酸 西城区 检测,https://news.cctv.com/2022/04/24/ARTIHsARmynyaYfXDX5Zcxne220424.shtml
2022-04-24 12:40:31,“大同小异——曾来德小楷展”在京展出,近日，北京杏坛美术馆推出“大同小异——曾来德小楷展”，通过50余件（套）小楷书法精品，让书法爱好者共享传统文化的魅力。,曾来德小楷展 在京展出,https://news.cctv.com/2022/04/24/ARTIJGKhbSqX6aW9vi1ssdT2220424.shtml
2022-04-24 12:33:00,4月24日0-12时，青岛新增本土无症状感染者1例，系外省入青人员,2022年4月24日0时至12时，全市报告无新增本土确诊病例。新增本土无症状感染者1例，系城阳区报告。,感染者 症状 本土,https://news.cctv.com/2022/04/24/ARTI1dR8WI8jn0XJJivfdfAI220424.shtml
2022-04-24 12:32:49,辽宁：“4·23”森林火灾明火已全部扑灭，无人员伤亡报告,4月23日15时30分许，沈阳、抚顺、铁岭市交界处发生山火。,辽宁 山火 沈阳,https://news.cctv.com/2022/04/24/ARTIKccPnMabiHliqQSa5bJ8220424.shtml
2022-04-24 12:30:35,仅差130米，神舟十三号返回预测为何如此精确？,飞船返回主要靠制动，制动控制量需要精确计算，计算时要充分考虑开伞以后高空风对返回舱运动的影响，制动后要根据测量数据，择机对预报落点进行修订，从而逐渐逼近最终落点。,神舟 返回舱,https://news.cctv.com/2022/04/24/ARTIyXFfL9KNcogZL3HdGlgr220424.shtml
2022-04-24 12:27:11,【英雄归来】习言道 | “太空探索永无止境，航天攻关任重道远”,4月24日是“中国航天日”，今年的主题是“航天点亮梦想”。习近平总书记多次强调建设航天强国，鼓励广大青年崇尚科学、探索未知、敢于创新。,习近平,https://news.cctv.com/2022/04/24/ARTIuPdLqMZXy4Iixjz6fhit220424.shtml
2022-04-24 12:25:47,中国航天日主题微视频：星空,星空浩瀚无比，探索永无止境。第七个中国航天日，向每一位中国航天人致敬。心之所向，星河万里！,中国航天日 微视频 星空,https://news.cctv.com/2022/04/24/ARTItDnr41ccqbOURLLChB02220424.shtml
2022-04-24 12:21:56,雄劲刚健 铿锵有力——《艺术里的奥林匹克》奏响《运动员进行曲》深入人心的激越旋律,《艺术里的奥林匹克》奏响《运动员进行曲》深入人心的激越旋律。,艺术里的奥林匹克,https://news.cctv.com/2022/04/24/ARTIHugJ9jdHZkBCBzBIEAzE220424.shtml
2022-04-24 12:09:51,北京顺义区通报新增2例核酸检测阳性人员行程轨迹,4月23日晚，顺义区新增2例核酸检测阳性人员，均为4月23日白天通报的顺义区确诊病例的家庭成员，作为密接人员已于4月22日进行了集中隔离，昨晚已转运至定点医院。,顺义区 阳性 行程轨迹,https://news.cctv.com/2022/04/24/ARTISUB1XwpFD6yEQK5H99aI220424.shtml
2022-04-24 11:58:52,4月24日0-9时，白城师范学院新增初筛阳性感染者6例，均为隔离管控学生和封闭管理学生,2022年4月24日0-9时，白城师范学院新增初筛阳性感染者6例，均为隔离管控学生和封闭管理学生，已转至定点医疗机构隔离治疗，对其密切接触者、次密切接触者均已开展追踪排查，并落实管控措施。,白城师范学院 感染者 管控,https://news.cctv.com/2022/04/24/ARTI8zU6ohmhVqT348DAagMK220424.shtml
2022-04-24 11:55:08,湖北省2022年 全民读书月活动启动,4月23日，“书香迎盛会·荆楚谱新篇”湖北省2022年4·23全民读书月启动仪式在汉举行。2012年1月，省委办公厅、省政府办公厅印发《关于开展全民阅读活动建设学习型湖北的意见》，提出打造“书香荆楚·文化湖北”奋斗目标。,读书月 全民,https://news.cctv.com/2022/04/24/ARTIlzKxMxPNu8Ip7oCbXyMB220424.shtml
