version_date,title,brief,keyword,url
2022-04-12 09:35:53,哈尔滨商业综合体、百货商场等场所有序恢复经营,哈尔滨市应对新冠病毒感染肺炎疫情工作指挥部发布公告：自2022年4月11日零时起，对部分社会面管控措施作出相应调整。,哈尔滨 商业综合体 百货商场 恢复经营,https://photo.cctv.com/2022/04/12/PHOAxsPq59a1Ya3nNmbxN1ED220412.shtml
2022-04-12 09:32:48,三亚新增确诊病例2例、无症状感染者1例，详情公布,4月11日0—24时，三亚市新增新冠肺炎确诊病例（轻型）2例和无症状感染者1例，无症状感染者转归新冠肺炎确诊病例（普通型）5例、（轻型）13例，为集中隔离人员，均已分别转运至定点收治医院。,三亚 感染者 确诊,https://news.cctv.com/2022/04/12/ARTItfidlQsnxVnr6KnprdoJ220412.shtml
2022-04-12 09:19:50,中国海警舰艇编队4月12日在我钓鱼岛领海巡航,2022年4月12日，中国海警2302舰艇编队在我钓鱼岛领海内巡航。,中国海警 巡航,https://news.cctv.com/2022/04/12/ARTIaoNiaYHOrlax6uHT5Etk220412.shtml
2022-04-12 09:19:14,南京玄武湖畔繁花满枝,4月11日，南京玄武湖畔木香花盛放，团团簇簇的花朵从高处“倾泻”而下犹如“瀑布”。,江苏 南京 玄武湖 繁花满枝,https://photo.cctv.com/2022/04/12/PHOAzZAFOBVFsY2QhMNG2rex220412.shtml
2022-04-12 09:16:52,江苏4月11日新增本土确诊病例14例、本土无症状感染者62例,4月11日0-24时，江苏新增本土确诊病例14例（南京市7例，徐州市1例，苏州市1例，连云港市1例，盐城市2例，宿迁市2例，其中1例由无症状感染者转为确诊病例，均在定点医院隔离治疗）。,确诊 病例 感染者,https://news.cctv.com/2022/04/12/ARTIsUrevh0tQhDtTCTV8Lsi220412.shtml
2022-04-12 09:15:58,4月12日，中国海警2302舰艇编队在我钓鱼岛领海内巡航,2022年4月12日，中国海警2302舰艇编队在我钓鱼岛领海内巡航。 ​​​,中国海警 舰艇编队 钓鱼岛,https://news.cctv.com/2022/04/12/ARTIqGXch6eaRz39IMFYViCd220412.shtml
2022-04-12 09:15:10,吉林长春昨日新增本土确诊病例81例、无症状感染者570例,4月11日0-24时，长春市新增本地确诊病例81例（含28例无症状感染者转为确诊病例），其中宽城区34例、朝阳区7例、长春新区7例、绿园区6例、净月区6例、南关区5例、经开区4例、二道区4例、九台区4例、德惠市3例、榆树市1例。,感染者 确诊 病例 长春市,https://news.cctv.com/2022/04/12/ARTIeXx2f7EA0CgDOBNjmT0O220412.shtml
2022-04-12 09:10:52,四川4月11日新增本土确诊病例2例，在成都市,4月11日0时至24时，四川新增本土确诊病例2例（在成都市），无新增本土无症状感染者。,确诊 病例 感染者,https://news.cctv.com/2022/04/12/ARTIsYUGY22BX12yF9ffZvOC220412.shtml
2022-04-12 09:06:59,国家卫健委：昨日新增1251例本土确诊病例,4月11日0—24时，31个省（自治区、直辖市）和新疆生产建设兵团报告新增确诊病例1272例。,国家卫健委,https://news.cctv.com/2022/04/12/ARTI8TOedN3Es8yyKZBANynx220412.shtml
2022-04-12 09:06:20,吉林省4月11日新增本土确诊病例171例、无症状感染者598例,4月11日0-24时，吉林省新增本地确诊病例171例(轻型169例、普通型2例）。,感染者 吉林市 确诊,https://news.cctv.com/2022/04/12/ARTI0q4ri9i5Ap4TpED0jpfU220412.shtml
2022-04-12 09:04:54,福建4月11日新增本土确诊病例4例、本土无症状感染者24例,4月11日0～24时，福建省报告新增本土确诊病例4例（泉州3例，宁德1例；其中无症状转确诊2例）。,确诊 福建省 病例,https://news.cctv.com/2022/04/12/ARTIf4lTXSfYrZJ3TacRd3Mg220412.shtml
2022-04-12 09:02:48,内蒙古4月11日新增本土确诊病例1例，在赤峰市,4月11日0—24时，内蒙古自治区报告新增本土确诊病例1例（在赤峰市）。本土确诊病例治愈出院1例（在通辽市）。本土无症状感染者解除医学观察3例（均在呼和浩特市）。,内蒙古 本土 确诊 病例,https://news.cctv.com/2022/04/12/ARTIdFLdbAMy9KeCd2XNK1wD220412.shtml
2022-04-12 08:58:33,中国银保监会要求金融机构要全力支持货运物流保通保畅工作,近日，银保监会专题研究金融支持货运物流保通保畅工作，要求银行业保险业提高政治站位，深刻认识金融工作的政治性、人民性，主动采取精准有效措施，全力以赴帮助货运物流行业纾困解难。,中国银保监会 货运物流,https://news.cctv.com/2022/04/12/ARTIgyFe3p3Y7qnJCsdU5DLC220412.shtml
2022-04-12 08:56:57,湖北4月11日新增本土确诊病例1例，新增本土无症状感染者36例,4月11日0—24时，湖北省新增本土确诊病例1例（为黄冈市确诊病例），新增本土无症状感染者36例（其中武汉市12例，鄂州市12例，黄冈市7例，十堰市3例，荆门市1例，恩施州1例）。,湖北 确诊病例 感染者,https://news.cctv.com/2022/04/12/ARTItvQmP6aWqSNxQy5QK3xc220412.shtml
2022-04-12 08:42:09,广东4月11日新增本土确诊病例16例、本土无症状感染者19例,4月11日0-24时，广东省新增本土确诊病例16例（其中6例为无症状感染者转确诊），均为广州报告。,广东,https://news.cctv.com/2022/04/12/ARTILJl1bcVvChsCvls62E7g220412.shtml
2022-04-12 08:41:25,河南新增3例本土确诊病例和11例本土无症状感染者,4月11日0—24时，河南全省新增本土确诊病例3例（郑州市2例、信阳市1例）。,河南,https://news.cctv.com/2022/04/12/ARTI1Y5MrcFKfjkgL272VpKV220412.shtml
2022-04-12 08:34:42,南京：全市符合条件的小学四、五、六年级师生员工4月14日返校复学,经市疫情防控应急指挥体系批准，全市符合条件的小学四、五、六年级师生员工，于4月14日（星期四）返校复学。,防控 疫情 复学,https://news.cctv.com/2022/04/12/ARTIvNzagWwtMqjZQWgdXvPq220412.shtml
2022-04-12 08:34:38,第1视点｜这就是南繁,4月10日下午，习近平总书记在海南省三亚市考察了崖州湾种子实验室，了解海南支持种业创新情况。,这就是南繁,https://news.cctv.com/2022/04/12/ARTIGHQDTYVBFLWfyk2SaEFz220412.shtml
2022-04-12 08:33:10,广西新增本土无症状感染者6例,据广西卫健委，4月11日0-24时，广西无新增本土确诊病例，新增本土无症状感染者6例（防城港市5例，均在闭环管理人员中发现；崇左市1例，在隔离人员中发现）。当日治愈出院本土确诊病例3例（均在防城港市），解除隔离医学观察本土无症状感染者6例（防城港市2例，南宁市1例，桂林市1例，北海市1例，钦州市1例）。截至4月11日24时，全区现有本土确诊病例10例（百色市4例，钦州市3例，桂林市1例，玉林市1例，防城港市1例），本土无症状感染者197例（防城港市86例，钦州市44例，百色市41例，崇左市19例，桂林市4例，北海市2例，南宁市1例）。,感染者 无症状,https://news.cctv.com/2022/04/12/ARTIUSWqO6jBokREvumv5Ba0220412.shtml
