version_date,title,brief,keyword,url
2022-04-11 17:03:42,“高原仙鹤”大量迁徙 西藏加强保护工作,连日来，在雅鲁藏布江中游河谷等地越冬的黑颈鹤，正成群结队从越冬地迁徙到藏北繁殖区。为保障黑颈鹤等候鸟迁飞安全，西藏自治区林草局正全面加强春季候鸟保护工作。,黑颈鹤 越冬 候鸟 高原 平措 林草 迁飞 藏北 河谷 雅鲁藏布江中游,https://news.cctv.com/2022/04/11/ARTIfuG6amxrocwogFXfcBEf220411.shtml
2022-04-11 17:01:14,新华全媒+丨新疆棉花春播陆续启幕,随着天气渐暖、气温攀升，新疆由南至北的广大棉田陆续启动春播，各族农民群众抢抓农时，在田间地头开展生产。智慧农机也在棉田里大显身手，尽显“科技范儿”。,棉田 春播 棉花播种 新疆乌苏市 新疆棉花 新疆巴音郭楞蒙古自治州 科技范儿 农时 黄万里 大马力拖拉机,https://news.cctv.com/2022/04/11/ARTIJrYXvN4QmluGuf6oYRbS220411.shtml
2022-04-11 17:00:47,10日20时-11日16时，浙江平湖在集中隔离点检出2例阳性感染者,平湖市新冠病毒肺炎疫情防控工作领导小组办公室11日通报，4月10日20时-4月11日16时，平湖市新增2例新冠肺炎阳性感染者，均为集中隔离点检出，已闭环转运至定点医院隔离治疗。,核酸 隔离 感染者,https://news.cctv.com/2022/04/11/ARTIub9naIQJ2QUjTIa6ZXyN220411.shtml
2022-04-11 16:58:40,新疆已完成春播500余万亩 进度总体快于去年同期,记者从新疆维吾尔自治区农业农村厅获悉：当前，新疆春季农业生产正有序推进。截至4月6日，全区（不含兵团）已完成播种505.5万亩，同比增加50.19万亩，春播进度总体快于上年同期。,冬小麦 春播 苗情 春小麦 返青期 农业生产 播种面积 农业农村 播期 科学施肥,https://news.cctv.com/2022/04/11/ARTIVn5nRoHzBI6t7jUvWuRP220411.shtml
2022-04-11 16:58:08,安徽六安将开展第六轮区域核酸检测,根据六安市疫情防控应急处置指挥部统一部署，决定于4月11日18时始开展第六轮区域核酸检测工作。覆盖范围包括：金安区、裕安区、市开发区全域居民。,核酸 采样点 六安市,https://news.cctv.com/2022/04/11/ARTI7mi1CRiWVArEC1ivYPim220411.shtml
2022-04-11 16:57:48,万人说新疆 | 农民罕克孜·月山靠创收过上好日子,在阿克苏地区新和县，罕克孜·月山正在马不停蹄签合同、收购辣椒。罕克孜·月山家住在沙雅县英买力镇，每年光收购辣椒这一项，就能收入10多万元。,孜·月山 农民 辣椒 女儿 养殖 新和县 力镇 沙雅县 初中 喂养,https://news.cctv.com/2022/04/11/ARTI9fpqWLRacWyuZYK8tDdd220411.shtml
2022-04-11 16:48:56,长征七号遥五运载火箭安全运抵文昌航天发射场,执行天舟四号货运飞船发射任务的长征七号遥五运载火箭于4月11日安全运抵文昌航天发射场。,长征七号 遥五运载火箭 文昌,https://photo.cctv.com/2022/04/11/PHOAiTZKlW5IB0EB0UIcqyAr220411.shtml
2022-04-11 16:37:33,10日0时至11日12时，江苏宿迁新增1例确诊病例、2例无症状感染者,联防联控指挥部办公室11日发布通告，4月10日0时至11日12时，宿迁市新增1例新冠肺炎确诊病例、2例无症状感染者，均已闭环转运至市传染病医院治疗或隔离管理。,感染者 确诊 病例,https://news.cctv.com/2022/04/11/ARTIddS0HQFQl7uERIYw1FWP220411.shtml
2022-04-11 16:14:35,北京疾控：谨慎购买疫情高发国家及地区商品，减少不必要的聚餐聚会,广大市民朋友近期非必要不出京，不去中高风险地区旅行或出差，谨慎购买疫情高发国家及地区的商品，减少不必要的聚餐聚会，继续坚持规范戴口罩、勤洗手、常通风、少聚集等常态化防控措施。,北京市 疫情防控,https://news.cctv.com/2022/04/11/ARTIbuQ5YVien82K2XTTEJMM220411.shtml
2022-04-11 16:07:40,4月9日16时至11日16时北京新增4例本土确诊 详情公布,4月9日16时至11日16时，本市新增本土新冠肺炎病毒感染者4例，均为确诊病例。,北京,https://news.cctv.com/2022/04/11/ARTI1fXEfT9Ep9uVYNa3s12M220411.shtml
2022-04-11 16:05:29,央行：一季度人民币贷款增加8.34万亿元，外币贷款增加305亿美元,4月11日，央行发布2022年一季度金融统计数据报告。,广义货币 净投放现金,https://news.cctv.com/2022/04/11/ARTICphowCGmSi1iKZEsvkpm220411.shtml
2022-04-11 16:03:54,证监会：研究制定新一轮提高上市公司质量行动计划,《中国证券报》11日刊发文章《证监会：研究制定新一轮提高上市公司质量行动计划》。文章称，4月9日，证监会主席易会满在中国上市公司协会第三届会员代表大会上表示，证监会将抓紧研究推出新一轮自主开放务实举措，全面提升资本市场制度竞争力。,资本市场 新发展,https://news.cctv.com/2022/04/11/ARTIgjYtAwN0GXxkwbpGOqLH220411.shtml
2022-04-11 16:02:57,4月9日16时至11日16时，北京新增4例确诊病例,4月11日，在北京市新型冠状病毒肺炎疫情防控工作第305场新闻发布会上，市委宣传部对外新闻处处长田伟介绍，4月9日16时至11日16时，本市新增本土新冠肺炎病毒感染者4例，均为确诊病例。,北京 确诊病例,https://news.cctv.com/2022/04/11/ARTI9VvdUtEkTy7641JI9t7H220411.shtml
2022-04-11 16:01:44,4月11日0-15时 浙江报告新增本土确诊5例 无症状感染者12例,4月11日，浙江省新冠肺炎疫情防控工作第112场新闻发布会召开，省卫生健康委副主任孙黎明通报疫情最新情况。,浙江 无症状感染者,https://news.cctv.com/2022/04/11/ARTIdB2HInDgZ9AyqP5UQnPX220411.shtml
2022-04-11 16:00:29,新华全媒+｜坚持“动态清零”不动摇 吉林疫情出现三个积极变化,吉林省本轮疫情已持续40余天，累计阳性感染者超6万例。面对严峻形势，吉林省坚持“动态清零”总方针不犹豫不动摇，坚决抗击疫情，努力推动社会面动态清零。目前，吉林省的疫情防控进展如何，救治、保供最新情况怎样？记者进行了采访。,疫情防控 危重型 动态更新 方舱 出院 感染者 蔬菜 阳性 医学观察 动态清零,https://news.cctv.com/2022/04/11/ARTIdBR0qrjhc6j0YxeMT47e220411.shtml
