version_date,title,brief,keyword,url
2022-04-06 15:26:00,斯德哥尔摩迎来4月春雪,瑞典首都斯德哥尔摩4日夜间迎来4月春雪。,斯德哥尔摩 4月 春雪 瑞典,https://photo.cctv.com/2022/04/06/PHOAWoOg0UP0QFHNPeRIUdOF220406.shtml
2022-04-06 10:26:43,医护人员短缺！英议员警告：英国未来几年数十万癌症患者得不到及时治疗,由于医护人员短缺，英国议员警告称，未来几年该国会有数十万癌症患者得不到及时治疗。,英国 医护人员,https://news.cctv.com/2022/04/06/ARTIbYIwf4Y4vjPwX3qydO6n220406.shtml
2022-04-06 10:24:18,净资产2190亿美元 马斯克登顶福布斯全球亿万富豪榜,美国财富杂志《福布斯》(Forbes)当地时间5日公布2022年全球亿万富豪榜，美国太空探索技术公司创始人、特斯拉首席执行官埃隆·马斯克(Elon Musk)以2190亿美元净资产，取代亚马逊创始人贝索斯(Jeff Bezos)，成为全球首富。这也是贝索斯四年来，首次跌至排行榜第二。,马斯克 首富,https://news.cctv.com/2022/04/06/ARTIKRSTTkwiVkDcFNln8SCV220406.shtml
2022-04-06 10:11:09,冷战思维再现！北约外长会将讨论新战略构想，秘书长声称要首次考虑中国挑战,俄罗斯卫星通讯社消息，北约秘书长斯托尔滕贝格5日称，北约各国外长将在4月6日至7日的会议上讨论北约新的战略构想，该构想将首次考虑来自中国方面的挑战。,北约 冷战思维,https://news.cctv.com/2022/04/06/ARTIekRzYspqwjFuebbSPTAU220406.shtml
2022-04-06 10:08:47,美国前总统奥巴马卸任后首次回白宫聊“医改”,路透社最新消息，当地时间4月5日，美国前总统奥巴马自2017年卸任以来首次回到白宫，宣传其“奥巴马医改”方案的益处，同时对现任总统拜登表示支持。同日，拜登签署了《平价医疗法案》扩展法案。,奥巴马 医改,https://news.cctv.com/2022/04/06/ARTIfu9pTGHmpZvmkhrPBzox220406.shtml
2022-04-06 09:58:18,失窃的达尔文笔记被匿名归还剑桥大学,4月5日，英国剑桥大学图书馆宣布，查尔斯·达尔文的两本笔记在失踪21年后被匿名归还。,失窃 达尔文笔记 匿名 归还 剑桥大学,https://photo.cctv.com/2022/04/06/PHOAMA3WGj80vb7ulfrlqXoq220406.shtml
2022-04-06 09:53:39,俄罗斯河流防凌爆破形成“炸冰”景观,4月5日，俄罗斯鞑靼斯坦，为防止发生凌汛灾害，当地工程人员实施人工防凌爆破。,俄罗斯 河流 防凌 爆破 炸冰 景观,https://photo.cctv.com/2022/04/06/PHOAeLG8Pk0OpgzlVLmEDkiZ220406.shtml
2022-04-06 09:51:20,波兰与美国签署价值47.4亿美元的军购合同,据波兰国防部4月5日消息，波兰国防部长布瓦什恰克当天签署了一笔军购合同，总价值约47.4亿美元。,波兰 美国 签署 军购合同,https://photo.cctv.com/2022/04/06/PHOArX1sxP2WbG7fPddAahCD220406.shtml
2022-04-06 09:48:51,匈牙利再现塔皮欧比奇凯战役场面,4月4日，在匈牙利佩斯州，人们再现1849年4月4日发生在这里的塔皮欧比奇凯战役场面。,匈牙利 再现 塔皮欧比奇凯战役 场面,https://photo.cctv.com/2022/04/06/PHOAJ3jq1QC4jMoppOELyzvX220406.shtml
2022-04-06 09:22:43,美疾控中心宣布全面自我审查 因抗疫措施不明确饱受批评,美媒报道称，美国疾控中心(CDC)主任瓦伦斯基当地时间4日在一封内部电子邮件中宣布对该机构进行全面审查。报道称，在新冠肺炎疫情发生的两年里，该机构曾多次因发布的抗疫措施含混不明而饱受各方批评。,美国 CDC 自我审查,https://news.cctv.com/2022/04/06/ARTIaLLMMMKaGBesoYydq9HW220406.shtml
2022-04-06 07:34:08,加拿大东西部两个主要省份决定为老年人接种第四剂新冠疫苗,加拿大全国免疫咨询委员会当地时间4月5日发布指导意见，建议为全国80岁及以上人口接种第四剂新冠疫苗。,新冠 疫苗的接种 肺炎 住院病例 住院治疗 亨利 病毒检测 Chiristine Elliott Horgan,https://news.cctv.com/2022/04/06/ARTIOvvGfvynEjsxqYMX6Sdc220406.shtml
2022-04-06 07:23:49,中国代表：在乌克兰尽早停火止战是中方强烈愿望,联合国安理会5日就乌克兰局势举行公开会。中国常驻联合国代表张军在会上阐述中方关于当前乌克兰局势的立场主张，强调推动乌克兰局势降级，尽早停火止战，是国际社会的迫切期待，也是中方的强烈愿望。,中方 大国博弈 乌克兰总统 乌克兰人 平民 国际社会 人道主义 国际人道法 局势 地缘政治,https://news.cctv.com/2022/04/06/ARTI6bqtS0he6GgxSCSnVw8e220406.shtml
2022-04-05 20:53:26,我驻外机构举行活动 悼念英烈,连日来，我驻外机构举行祭扫活动，悼念在海外牺牲的英烈。,悼念 志愿军 驻外机构,https://news.cctv.com/2022/04/05/ARTILsjwqDx9HPqWHOWfJTv1220405.shtml
