version_date,title,brief,keyword,url
2022-04-08 15:36:28,卢旺达举行活动纪念大屠杀28周年,卢旺达全国各地7日举行活动纪念大屠杀28周年。卢旺达总统卡加梅发表讲话指出一些种族灭绝肇事者依然在逃，并谴责那些对嫌疑犯提供保护以及掩盖的行为。,卢旺达 大屠杀纪念馆,https://news.cctv.com/2022/04/08/ARTITfeKcEdDbHVw3RAuDjH1220408.shtml
2022-04-08 15:32:20,黎巴嫩与IMF初步达成30亿美元救助协议,黎巴嫩7日与国际货币基金组织（IMF）达成一项初步协议，IMF将在46个月内向黎巴嫩提供约30亿美元资金，以帮助该国摆脱经济和金融危机。,黎巴嫩 救助协议,https://news.cctv.com/2022/04/08/ARTIctZiGXp1Uwtfht3mYFSE220408.shtml
2022-04-08 15:09:27,新华国际时评：推动中医药为全球抗疫作出更大贡献,世界卫生组织官网日前发布《世界卫生组织中医药救治新冠肺炎专家评估会报告》。,中医药救治 国际社会 中医药产品 中医药治疗 新冠 肺炎 十四五 一带一路 中方 病例,https://news.cctv.com/2022/04/08/ARTIHtywl4I667IRWVJFhRD8220408.shtml
2022-04-08 14:31:46,SpaceX“龙”飞船将搭载4名游客前往国际空间站,美国太空探索技术公司(SpaceX)宣布，4名太空游客组成的机组将于当地时间8日乘坐载人“龙”飞船前往国际空间站。,游客 国际空间站 飞船,https://news.cctv.com/2022/04/08/ARTIFVJRXgyH9KWdfdgZ7uMn220408.shtml
2022-04-08 14:03:59,韩国国防部开始搬迁 为防机密文件外泄进行销毁工作,当地时间8日，韩国国防部开始搬迁，为候任总统尹锡悦腾出办公空间。,韩国 国防部 机密文件,https://news.cctv.com/2022/04/08/ARTIQjVFGxQHepAHJmmHERD4220408.shtml
2022-04-08 12:50:04,俄罗斯卢布汇率回升至俄乌冲突前水平,俄罗斯莫斯科交易所数据显示，7日俄罗斯卢布对美元和欧元汇率继续上涨，已回升至俄乌冲突之前水平。,卢布 汇率,https://news.cctv.com/2022/04/08/ARTI7njoNgqk6Rbmje1fCqL1220408.shtml
2022-04-08 11:34:12,刚果（金）东北部一军营内发生爆炸致6人死亡,刚果（金）政府7日说，该国东北部北基伍省首府戈马市一军营内的一家酒馆当晚发生爆炸，目前已造成至少6人死亡、15人受伤。,刚果 军营 爆炸,https://news.cctv.com/2022/04/08/ARTI9n5W9NfLjsFObagJWRII220408.shtml
2022-04-08 11:19:17,加拿大政府提交联邦预算案 本财年赤字规模达1138亿加元,当地时间4月7日，加拿大联邦政府向议会众议院提交2022年的预算案。其中，解决住房紧张问题、增加国防开支、为土著人提供支持是这份预算案最引人注目的几项内容。,加拿大 联邦预算案,https://news.cctv.com/2022/04/08/ARTIZD4GqWgFMcHAye1XMZ2k220408.shtml
2022-04-08 11:15:29,美国累计超1284万儿童感染新冠,美国儿科学会和儿童医院协会本周发布的最新报告显示，自新冠疫情暴发以来，美国累计已有超过1284万名儿童确诊感染新冠病毒。,新冠 儿童健康 感染 美国 确诊病例 儿科 儿童医院 病毒 疾病 变异,https://news.cctv.com/2022/04/08/ARTIP7g7EDGORtADYwT64nQZ220408.shtml
2022-04-08 11:14:45,英国著名社会学家阿尔布劳：期待中国提出更多全球治理新理念,英国著名社会学家马丁·阿尔布劳6日在伦敦接受新华社记者专访时表示，期待中国提出更多有关全球治理的新理念，从而在遵守联合国宪章、尊重国家主权等原则基础上增添新思想和新观点，以解决更多全球问题。,全球问题 全球治理 新观点 新冠 新思想 人类命运 关键词 社会学家 联合国宪章 减贫,https://news.cctv.com/2022/04/08/ARTIGrLNYtTEbgx5E3VK3eGd220408.shtml
2022-04-08 11:14:08,新华国际时评：推动中医药为全球抗疫作出更大贡献,这份报告明确肯定了中医药救治新冠肺炎的安全性和有效性，充分肯定了中医药抗击新冠肺炎疫情的重要贡献，有助于推动包括中医药在内的世界传统医学更深入地参与新冠肺炎疫情防控，更好保护世界各国人民健康。,中医药救治 国际社会 中医药产品 中医药治疗 新冠 肺炎 十四五 一带一路 中方 病例,https://news.cctv.com/2022/04/08/ARTIuLiuwFz0NuqV6Yc3IxYW220408.shtml
2022-04-08 11:12:25,美国霸权主义的多重根源,自20世纪初以来，向全球进行利益扩张和意识形态输出，成为美国内外政策和霸权体系的两个方面并互为补充。为了维护全球霸权地位，美国不惜采用任何手段，其行为逻辑具有多重根源和严重影响。,身份政治 美国利益 美国霸权主义 美国联邦储备系统 美国经济 美国政府 根基 美国民众 国际垄断资本 美国宪法,https://news.cctv.com/2022/04/08/ARTIQ3KRZVHI4jGDwFe63IT9220408.shtml
2022-04-08 11:11:50,“美国使用贫铀弹是危害人类的致命罪行”（深度观察）,2003年，美国以“伊拉克拥有大规模杀伤性武器”为由入侵伊拉克。根据美国沃森国际与公共事务研究所统计，在这场长达7年多的战争中，至少有18万到20万伊拉克平民死亡。,贫铀弹 罪行 塞尔维亚 轰炸 白磷 人类 海湾战争 哈佛国际评论 垃圾填埋场 联军,https://news.cctv.com/2022/04/08/ARTIwPdrKImwPs5sRSe9Ni5W220408.shtml
2022-04-08 11:10:54,人权“卫道士”其实是“伪道士”（钟声）——从乌克兰危机看美式霸权⑧,霸权高于主权、人权的逻辑，始终主导着美国的外交政策。美国对打着“人权”幌子维护霸权的把戏驾轻就熟，且越发没有底线。,人权 卫道士 9·11 人道主义 伪道士 张开双臂 新闻周刊 人权卫士 叙利亚 主权,https://news.cctv.com/2022/04/08/ARTIZ5nRmyVvQtLkD9VfHbZm220408.shtml
2022-04-08 11:01:48,"2021年美预期寿命仍维持下降 专家称美国存在诸多""健康劣势""",一项最新研究结果显示，美国的预期寿命在2020年因新冠病毒肆虐而急剧下降，且这种下降状态仍在2021年维持。美媒称，尽管有效的新冠疫苗已问世，但美国预期寿命的曲线仍未实现反弹。,预期寿命 美国,https://news.cctv.com/2022/04/08/ARTIA0frrVFOQyvrp5by2hAL220408.shtml
