version_date,title,brief,keyword,url
2022-05-22 04:16:26,欧洲确诊和疑似猴痘病例已超100例,欧洲近期出现的猴痘确诊或疑似病例持续增加。世界卫生组织方面担忧，多国出现猴痘病例或暗示猴痘病毒已经在社区隐匿传播，今后感染人数可能进一步增加。,欧洲 猴痘病毒,https://news.cctv.com/2022/05/22/ARTIehLKYu1PbaAPDeosOx7S220522.shtml
2022-05-22 03:29:26,拜登访韩日意在中国 精心“织网”也难逃铩羽而归,美国总统拜登目前正在韩国访问，这是其上任以来的首次亚洲之行。有分析指出，尽管拜登直奔韩国和日本，但其此次出访的重点却是针对中国。,拜登 印太战略,https://news.cctv.com/2022/05/22/ARTIi7uUpDL1BVhTW9kZLA9a220522.shtml
2022-05-22 03:25:09,恶劣天气袭击印度比哈尔邦造成33人死亡,印度媒体21日报道说，印度比哈尔邦多地日前遭遇恶劣天气，目前已导致至少33人死亡。,印度比哈尔邦 恶劣天气,https://news.cctv.com/2022/05/22/ARTIJrtEhejzuYNdNj79dGSy220522.shtml
2022-05-21 20:42:09,乌境内约30万平方公里或埋有地雷,当地时间21日，乌克兰内务部副部长表示，按最乐观估计，乌克兰需5至7年时间完成境内排雷工作。根据评估，目前乌克兰境内大约有30万平方公里的区域可能被埋设了地雷。,境内 排雷,https://news.cctv.com/2022/05/21/ARTI6E6lRfZV8UTd6mmr14xu220521.shtml
2022-05-21 20:09:30,葡萄牙总理科斯塔访问乌克兰,当地时间21日，葡萄牙总理科斯塔抵达乌克兰基辅进行访问。,科斯塔 葡萄牙,https://news.cctv.com/2022/05/21/ARTIVL3uaUIO37xSyjTsAv7s220521.shtml
2022-05-21 19:52:54,俄外交部公布永久禁止入境的美国公民名单 涉及963人,当地时间21日，俄罗斯外交部公布永久禁止入境的美国公民名单，名单上共有963人。,外交部 禁止入境 美国,https://news.cctv.com/2022/05/21/ARTIKa1YxVRuWECE8mw10e7w220521.shtml
2022-05-21 19:02:27,俄研发猴痘病毒检测盒 已完成实验室测试,俄罗斯“矢量”病毒学与生物技术国家科学中心科研人员研制出了一种自动操作的检测试剂盒（下称检测盒），可用于检测包括猴痘病毒在内的正痘病毒。,检测盒 矢量,https://news.cctv.com/2022/05/21/ARTIJrmE2CgEw2j3QVI7FSnT220521.shtml
2022-05-21 16:52:14,全美单日确诊新冠病例再达10万例 专家敦促美国会拨款防疫,美媒报道称，全美新冠疫情又现反弹，单日新增确诊病例再次达到10万例；卫生官员与专家警告称，若美国国会不尽快拨付数十亿美元的防疫援助款项，全美或再现单日百万确诊病例的景象。,新冠 新疫苗 美媒 病例数 全美 确诊病例数 防疫 国会参议院 纽约时报 华盛顿邮报,https://news.cctv.com/2022/05/21/ARTITP5h48ov60SSpljWsURg220521.shtml
2022-05-21 16:50:50,海外网评：直面风浪！金砖合作为世界注入正能量,5月19日，习近平主席在金砖国家外长会晤开幕式上发表视频致辞时强调：作为国际社会积极、向上、建设性力量，金砖国家应该坚定信念，直面风浪，以实际行动促进和平发展，维护公平正义，倡导民主自由，为处于动荡变革期的国际关系注入稳定性和正能量。,网评 合作机制 世界和平与发展 合作研究 金砖+ 政治互信 互利合作 外长 视频 表率,https://news.cctv.com/2022/05/21/ARTIjhnMcY9kjBNeqHRDNPV2220521.shtml
2022-05-21 16:48:42,真相·漫评｜美国给亚太带来的旧伤未愈，还想搞事情？,5月20日，美国总统拜登开启他上任以来的首次亚洲之行，并将在此行期间宣布启动“印太经济框架”。,未爆弹 漫评 美国总统 亚太国家 小圈子 老挝 轰炸 东盟 生化武器 PBS,https://news.cctv.com/2022/05/21/ARTIOhyETXCOtf6uFzJksRjY220521.shtml
2022-05-21 16:48:32,美媒：美政府已订购数百万剂猴痘疫苗,18日，美国马萨诸塞州举行发布会，介绍当地猴痘病例情况。18日，丹麦疫苗公司巴伐利亚北欧（Bavarian Nordic）发表声明称，该公司与美国生物医学高级研究和发展局（BARDA）签署了价值数亿美元的合同。,猴痘 冻干疫苗,https://news.cctv.com/2022/05/21/ARTI3ijY1ynbJCIzlIbyFLYY220521.shtml
2022-05-21 16:46:28,印媒刊文：美国遭遇40年来最高通胀是自作自受,印度媒体《政治家》（The Statesman）19日刊发题为《美国遭遇40年来最高通胀是自作自受》的文章，批评美国一系列内政外交措施导致能源和食品价格上涨，消费者价格指数飙升至40年来最高的6.5%；通货膨胀率加速至8.5%，达到1981年12月以来的最高水平。,美国 基准利率 政治家 经济制裁 美联储主席 通货膨胀率 印度媒体 资料图 对俄 食品价格,https://news.cctv.com/2022/05/21/ARTIhpLo9Y4z4Ezi1UGMNXET220521.shtml
2022-05-21 16:41:27,美国政府据悉考虑邀请古巴代表参加美洲峰会,路透社5月20日消息，知情人士称，美国政府正考虑邀请一名古巴代表参加美洲峰会的可能性。知情人士称，美方讨论的重点是邀请一名“低于国家元首和外交部长级别”的古巴官员的可能性。,美国政府 古巴,https://news.cctv.com/2022/05/21/ARTI6EVO3BguuOfhoARvYWhp220521.shtml
2022-05-21 16:37:28,乌方称战争正进入最后阶段,乌总统办公室主任顾问波多利亚克21日表示，战争正进入最后阶段，问题是持续多长时间。他认为，俄方想通过阵地战方式使战争进入持久阶段，这对乌方不利。,乌克兰,https://news.cctv.com/2022/05/21/ARTIxQWQDscrMvXleUsMjlAk220521.shtml
