version_date,title,brief,keyword,url
2022-04-15 12:05:27,法国大选攸关欧盟未来 两候选人对欧洲愿景截然相反,据美联社法国斯特拉斯堡4月12日报道，法国总统埃马纽埃尔·马克龙和极右翼政客玛丽娜·勒庞周二表达了两种截然相反的欧洲愿景：一种是坚决支持欧盟27国集团，另一种是捍卫其法国民族主义座右铭。,法国 大选,https://news.cctv.com/2022/04/15/ARTIKSnE0it6EhwJpfjzpVht220415.shtml
2022-04-15 11:57:34,巴西政府支持建设比SWIFT更灵活的新支付系统,巴西经济部国际经济事务司司长戈梅斯14日表示，巴西政府支持建设一个比环球银行间金融通信协会（SWIFT）系统更灵活的新支付系统。,巴西政府 SWIFT 新支付系统,https://news.cctv.com/2022/04/15/ARTIOw9pBdVpMCzwLJ470psP220415.shtml
2022-04-15 11:56:59,马克龙：法国将坚持核能和可再生能源的开发与利用,争取连任的法国总统马克龙当地时间14日在访问法国西北部城市勒阿弗尔时重申自己在生态方面的竞选计划，表示法国将坚持核能和可再生能源的开发与利用。,法国 可再生能源,https://news.cctv.com/2022/04/15/ARTIHT5RcE3iTCqIvs2kcPU6220415.shtml
2022-04-15 11:48:37,热带风暴“鲇鱼”已致菲律宾148人死亡 多人失踪,据法新社报道，菲律宾官方表示，当地时间14日，热带风暴“鲇鱼”自10日登陆菲律宾以来，其引发的山体滑坡和洪水的致死人数已升至148人。,菲律宾 热带风暴,https://news.cctv.com/2022/04/15/ARTISlBY16qjAlikhqeA3AoC220415.shtml
2022-04-15 11:38:53,经济下行担忧加剧 欧洲央行“收水”趋谨慎,欧洲中央银行14日决定，维持三大关键利率不变。分析人士认为，俄乌冲突给欧元区经济带来巨大不确定性，加重欧洲央行对经济下行的担忧，预计欧洲央行将继续坚持审慎、渐进的货币正常化进程。,经济下行 欧洲央行 放水,https://news.cctv.com/2022/04/15/ARTI8YOTbnKPb3XVvIOioUI7220415.shtml
2022-04-15 11:36:37,热带风暴“鲇鱼”在菲律宾致死人数升至137人,当地时间4月15日，菲律宾国家减灾委发布消息表示，热带风暴“鲇鱼”已造成菲律宾137人死亡，另有28人失踪，8人受伤，1689436人受灾，218310人被疏散到避难中心。,菲律宾 热带风暴,https://news.cctv.com/2022/04/15/ARTIuKH0jKr2A6Kfq8M9C93U220415.shtml
2022-04-15 11:15:30,英国首次批准使用灭活新冠疫苗,英国药品与保健品管理局14日批准在英使用法国瓦尔内瓦公司研制的新冠疫苗，这是英国批准使用的第六款新冠疫苗，同时也是全病毒灭活新冠疫苗首次在英国获批。,英国 首次批准 灭活新冠疫苗,https://news.cctv.com/2022/04/15/ARTIU090FkGvUKNgkux64VrS220415.shtml
2022-04-15 11:09:35,疫情高峰期已过？韩国将全面解除保持社交距离措施,综合韩媒报道，韩国国务总理金富谦15日称，韩国政府决定从18日起全面解除保持社交距离措施。目前，韩国单日新增确诊病例仍维持在10万例以上，不过，韩国防疫部门近日表示，该国新冠疫情高峰期已过，需要转变防疫体系。,韩国 疫情高峰期,https://news.cctv.com/2022/04/15/ARTIhcppD7preMuQ1PKmxlkM220415.shtml
2022-04-15 10:56:07,南非东部洪水死亡人数升至341人,由于连日强降雨，南非东部夸祖卢-纳塔尔省发生洪水，截至4月14日洪水造成的死亡人数已升至341人。,南非 降雨 洪水灾害 救援,https://photo.cctv.com/2022/04/15/PHOAQ9htYP6raxtCJLHkKsYj220415.shtml
2022-04-15 10:38:26,新加坡经济第一季度同比增长3.4%,新加坡贸易与工业部4月14日公布的数据显示，今年第一季度新加坡国内生产总值（GDP）同比增长3.4%。,新加坡 经济 第一季度 国内生产总值,https://photo.cctv.com/2022/04/15/PHOAsp5xxKyWKiEFIyEgEByW220415.shtml
2022-04-15 10:07:51,英国微型艺术展 探索现实版“小人国”,当地时间2022年4月14日，英国南肯辛顿，当地举办“小即是美：微型艺术展”预展。,英国 南肯辛顿 微型世界 展览,https://photo.cctv.com/2022/04/15/PHOAjuZbSSZKsv3egDyuecZD220415.shtml
2022-04-15 10:05:48,中国驻刚果（金）使馆发布领事提醒 称1名中国公民死于袭击事件,当地时间14日，中国驻刚果（金）使馆发布领事提醒称，近日，刚果（金）上韦莱省发生一起中资矿业公司遇袭事件，造成1名中国公民死亡。,领事提醒 遇袭事件,https://news.cctv.com/2022/04/15/ARTIIPHshqBjRHw8cth8BAlX220415.shtml
2022-04-15 09:41:28,美国纽约地铁枪击案嫌犯首次出庭 被要求不得保释,据美国有线电视新闻网(CNN)报道，当地时间14日，美国纽约市地铁枪击案嫌疑人弗兰克•詹姆斯首次出庭，并被要求在审判前不得保释。,美国 纽约地铁 枪击案,https://news.cctv.com/2022/04/15/ARTIm01xQQ9njKrZWjhKOtGI220415.shtml
2022-04-15 09:27:21,金融总量稳定增长 落实落细纾困政策——解读一季度我国主要金融数据,一季度人民币各项贷款增加8.34万亿元，在上年同期基数较高的背景下再创新高。14日，中国人民银行相关负责人在解读一季度金融统计数据时表示，我国信贷扩张靠前发力，引导金融机构持续加大信贷投放力度，全力支持受疫情影响严重地区和行业企业纾困解难。,金融产品 实体经济,https://news.cctv.com/2022/04/15/ARTIFR9FI662mnPyHBjKD7SV220415.shtml
2022-04-15 08:51:16,加拿大中部遭遇罕见暴风雪,从４月13日起，加拿大萨斯喀彻温省、马尼托巴省以及安大略省的部分地区遭遇大规模暴风雪天气。由于很多地方能见度几乎为零，多条高速公路被迫关闭。,加拿大 气象 暴风雪天气,https://photo.cctv.com/2022/04/15/PHOACeORQXVy46bZhQq9Zk73220415.shtml
2022-04-15 06:33:01,卡塔尔埃米尔与巴勒斯坦总统通电话 双方讨论巴以局势,当地时间14日，卡塔尔埃米尔（国家元首）塔米姆与巴勒斯坦总统阿巴斯通电话。阿巴斯介绍了巴以地区局势的最新进展，指责以色列侵占巴勒斯坦领土并对巴勒斯坦平民实施野蛮袭击。塔米姆重申卡方支持巴勒斯坦人民合法权利的坚定立场。,巴以局势,https://news.cctv.com/2022/04/15/ARTIQZpnQNHDYdRNcbfEhEAz220415.shtml
